country,contents
인도네시아,"신들의 섬, 인도네시아 발리의 자연을 만나는 법:한국에서 발리까지의 비행시간 7시간. 가루다항공, 대한항공 직항노선이 있어 접근성이 좋다. 신들의 섬 발리는 전 세계 여행자들로부터 많은 사랑을 받는 휴양지로 수많은 매력이 있다. 그 끝없는 매력 가운데 푸른 자연을 마주할 수 있는 방법은 어떤 게 있을까? 지금부터 인도네시아 발리의 매력을 자연에서 찾아보자.
푸른 하늘과 에메랄드빛 바다의 발리를 만나는 법
  1   온몸으로 만나기 '빠당빠당비치'
발리에는 여행자들의 발길이 끊임없이 이어지는 해변이 가득하다. 그중 에메랄드빛 바다와 푸른 하늘은 물론 새하얀 모래사장을 만날 수 있는 '빠당빠당 비치'는 발리 여행자들이 그냥 지나칠 수 없는 곳이다. 큰 바위 사이의 계단을 지나 그 끝에서 만나는 푸른 해변의 모습에는 감탄을 자아내게 된다.
해변 앞으로는 새하얀 모래사장과 에메랄드빛 바다, 뒤로는 바위와 우거진 숲을 만날 수 있다. 자연 그대로의 모습을 간직하고 있는 곳으로 장난기 가득한 원숭이들이 많이 서식하고 있는 만큼, 선글라스 등 소지품을 원숭이들에게 뺏기지 않도록 주의해야 한다.
특히 빠당빠당비치는 넓게 펼쳐진 바다 위로 높은 파도가 고르게 넘실대는 곳이라 많은 서퍼들의 사랑을 받고 있다. 발리에서 서핑을 즐기고 싶다면 주변 서핑 클럽의 도움을 받아 체험을 해보거나 해변에 있는 숍에서 서핑보드를 대여해 온몸으로 발리의 바다를 만나보자.
 Traveler's  Tips 
· 입장료 : 15,000루피(2019년 7월 기준)
· 사람이 많이 몰리는 시간엔 오른쪽으로 쭉 해안가를 따라가면 좀 더 한적한 해변을 만날 수 있다.
· 원숭이의 장난을 조심할 것. 선글라스, 스마트폰 주의!
· 계단이 많으니 편한 신발을 착용하자.
    2   선셋과 함께 만나기 '비치 바'


발리의 자연환경 중 해가 물드는 시간에 만나는 인도양의 모습은 무척이나 매력적이다. 그만큼 해변가에 위치한 비치바에는 일몰 시간이 다가오면 많은 사람들이 자리를 잡고 붉게 물드는 하늘을 만나고자 한다. 발리 내에는 락바, 포테이토 헤드 등 유명한 비치바가 있다.
우리는 짐바란 지역의 아야나 리조트 내에 위치한 비치 바 '락바'를 찾아갔다. 바위 절벽 위에 세워진 비치바에서 흘러나오는 신나는 음악은 물론 붉게 물드는 해안선을 바라볼 수 있었던 곳이다.
발리 여행 중 이곳을 찾을 예정이라면 그날의 일몰 시간을 미리 스마트폰으로 체크하고, 선셋 시간이 시작되기 전 미리 방문해 선셋을 즐기는 것이 좋다. 인기 있는 비치 바인만큼 리조트 내 손님부터 외부 손님까지 줄지어 이곳을 찾는다.
 Traveler's  Tips 
· 선셋 시간 미리 체크하고 30분~한 시간 전에 방문하자.
· 아야나 리조트 / 짐바란 발리 바이 아야나 호텔 투숙객이라면 입장 대기 없이 빠르게 입장 가능하다.
· 노출이 심한 옷, 슬리퍼, 백팩 착용 시 입장할 수 없다.
    3   시원한 파도 소리로 만나기 '울루와뚜절벽사원'
높고 아찔한 각도의 절벽 위에 지어진 울루와뚜 절벽사원은 발리 여행 명소로 손꼽히는 곳이다. 이와 동시에 울루와뚜 지역은 시원한 파도 소리를 즐길 수 있는 곳으로 통한다.
한눈에 담기엔 부족한 넓은 인도양의 해안선을 바라보며 푸른 하늘과 철썩거리는 시원한 파도 소리를 들을 수 있다. 에메랄드빛 바닷속 하얗게 부서지는 파도 소리를 들을 수 있는 건 물론 투명한 바닷속을 헤엄치는 바다거북의 모습도 만날 수 있다.
사원 내부는 현지인들의 신성한 종교 장소로 관광객들은 출입이 불가능하며, 사원 내부에 들어가지 않더라도 울루와뚜 절벽사원을 입장할 때에는 사롱이라고 불리는 의상으로 노출이 심한 부위는 가려야 한다.
 Traveler's  Tips 
· 입장료 : 30,000루피 (2019년 7월 기준.)
· 노출이 심한 옷은 피하고, 편한 신발을 착용하자.
· 야생 원숭이들의 서식지로 스마트폰, 선글라스, 액세서리 등을 원숭이에게 뺏기지 않도록 주의하자.
  푸른 야자수, 초록빛 내음 가득한 발리를 만나는 법
  1   현지인의 삶 속에서 만나기 '뜨갈랄랑'
바다와 산이 많은 발리에서는 어떻게 농사를 지을까? 정답은 바로 산에 있다. 산의 비탈면을 따라 계단식으로 논을 만들어 농사를 짓는 발리에서는 이 독특한 농사 방법이 또 하나의 관광 명소로 자리 잡았다.
발리의 계단식 논을 만날 수 있는 대표적인 장소는 '뜨갈랄랑'으로 맞은편에는 여러 곳의 뜨갈랄랑 카페가 자리 잡고 있다. 이곳에서 시원한 과일주스 한 잔을 마시며 이색적인 발리의 논을 만나도 좋고, 발리 스윙이라고 불리는 거대한 그네 등 인생 사진을 남길 수 있는 장소도 뜨갈랄랑에 있으니 계단식 논과 야자수를 배경으로 인생 사진을 남겨도 좋다.
 Traveler's  Tips 
· 맞은편의 카페에서 음료 한잔하며 여유를 느끼기에 좋다.
· 경사가 있는 흙길을 걸어야 하니 편한 신발, 옷을 추천한다.
· 카페는 여러 곳 있으니 마음에 드는 뷰의 카페를 찾자.
· 특별한 여행 사진을 원한다면 발리 스윙을 타보자.
    2   자연 속 동물과 함께 만나기 '몽키포레스트'
바다를 벗어나 푸른 나무가 우거진 숲의 도시 우붓으로 향한다. 우붓에서는 울창한 숲과 시원한 물줄기의 강을 볼 수 있다. 그중에서도 발리인들의 종교를 엿볼 수 있는 사원과 야생 원숭이들이 서식하는 몽키포레스트는 우붓 명소로 손꼽힌다.
한낮의 더위도 우거진 숲이 만들어내는 그늘 아래 잠시 사그라든다. 시원한 계곡물소리와 함께 발리의 사원, 숲 그리고 동물을 만날 수 있는 곳이 바로 이곳이다.
야생 원숭이들이 서식하는 곳으로 정말 많은 수의 원숭이들을 만날 수 있다. 현지인들이 먹이를 주며 관리하긴 하지만 야생의 습성을 지닌 원숭이인 만큼 먹이를 건네거나 눈을 마주하는 공격 의사를 나타내서는 안된다. 장난기 가득한 원숭이들은 이곳을 찾는 여행자들의 가방을 뒤지거나 선글라스, 스마트폰을 가지고 달아나기도 하지만 먹이와 맞교환하는 귀여운 면도 있다.
 Traveler's  Tips 
· 입장료 : 성인 80,000루피/어린이(3~12세) 60,000루피 (2019년 7월 기준)
· 규모가 꽤 큰 편이고 길이 좋지만 미끄러질 수 있으니 편한 신발을 착용하자
· 원숭이들에게 먹이를 주거나 공격 의사를 표현하면 안 된다.
· 선글라스, 액세서리 등 소지품 관리에 주의하자.
    3   인생 사진으로 만나기 '발리 스윙'
최근 여행 트렌드 중 하나가 여행지에서 '인생 사진 남기기'가 아닐까 싶다. 발리에서 인생 사진을 원한다면 거대한 조각상이 있는 가루다공원, 이국적인 사라스와띠사원과 렘푸양사원, 띠르따강가 그리고 지금 소개하는 발리 스윙이 대표적이다.
발리 스윙의 경우 많은 셀럽들이 촬영한 발리 여행 사진 명소로 알려져 있으며 처음 시작한 발리 스윙 업체와 함께 우붓에는 여러 곳의 발리 스윙 업체가 위치해있다. 각각 업체마다 바라보는 뷰가 다르고 시설이 조금씩 다르지만, 우리는 우붓 발리 스윙의 원조라는 이름부터 그 자체인 '발리스윙'을 찾았다.
발리 스윙 내에는 한 가지가 아닌 여러 개의 어트랙션이 모여있다. 그네, 새 둥지, 베드, 배 등 다양한 사진 스팟에서 인생 사진을 남길 수 있다. 사람들이 많이 방문하는 명소인 만큼 대기시간이 길 수도 있으니 넉넉하게 시간을 계산하고 다녀오면 좋다.
사진촬영의 경우 입구에서 포토그래퍼 서비스(유료)를 신청해도 좋고 그네를 타기 전 직원에게 스마트폰을 맡기면 전문가 못지않은 실력으로 내 사진을 담아준다. 입장료에는 뷔페 식사가 포함되어있어 간단한 식사를 즐기며 반나절 이상 이곳에서 시간을 보내게 된다.
 Traveler's  Tips 
· 입장료 $35 / 사진촬영 서비스 $10 (2019년 7월 기준/입장료에는 시설 무제한 이용, 식사가 포함되어있다.)
· 드레스 대여 200,000루피아
· 원피스를 대여하지 않을 예정이라면 단색의 긴 원피스를 추천한다. 남자의 경우 깔끔한 컬러의 의상 추천 (원피스가 심하게 펄럭거리니 속바지 착용 필수)
· 시설마다 줄이 길어 넉넉하게 시간을 잡고 방문하면 좋다.
발리의 끝없는 매력을 자연 속에서 만나게 된 우리는 바다와 산을 마주하며 다채로운 발리의 모습에 한 번 더 반하게 되었다. 무더운 한국의 날씨를 벗어나 좀 더 시원한 동남아 발리로 떠나는 시간. 발리는 7월부터 9월까지 건기에 해당하여 가장 여행하기 좋은 시기로 손꼽힌다."
인도네시아,"발리 여행을 더 즐겁게 해 줄 호텔 추천 리스트:추운 겨울엔 따뜻한 동남아로, 더운 여름엔 좀 더 시원한 여행지로 떠나길 기대한다. 발리는 7월부터 9월까지 가장 여행하기 좋은 시기인 건기이다. 이때 전 세계 여행자들을 사로잡는 선선함과 푸른 자연의 매력을 가진 발리를 만날 수 있다.
여행을 준비할 때 가장 먼저 하는 건 항공권 발권! 다음은 호텔 예약이다. 발리는 비교적 저렴한 물가를 자랑하고, 럭셔리 혹은 가성비 좋은 발리 호텔 & 리조트가 많은 곳이다. 수많은 호텔 가운데 우리의 마음에 쏙 들어오는 곳은 어디일까? 지금부터 에디터가 직접 다녀온 발리 호텔을 소개한다.
럭셔리함을 찾는 당신에게
넓은 수영장, 멋진 경치가 함께하는발리의 5성급 호텔 두 곳을 소개한다.
1. 림바 짐바란 발리 바이 아야나
RIMBA Jimbaran BALI by AYANA
짐바란 지역에 위치한 림바 짐바란 발리 바이 아야나는 발리 5성급 호텔로 12개의 수영장, 스파, 레스토랑, 루프탑 바 등의 편의시설을 갖춘 곳이다. 한국인 직원이 상주해 있어 체크인은 물론, 머무는 동안 도움이 필요할 경우 도움을 받을 수 있다. 쿠킹클래스, 애프터눈 티 등 특별한 경험을 할 수 있는 액티비티 프로그램도 마련되어있다.
편안한 객실 분위기와 침구는 물론이고 넓은 수영장을 이용하면서 발리 여행을 즐길 수 있는 곳이다. 건물 앞쪽으로는 넓은 잔디밭과 작은 사원, 작은 계단식 논이 있는 정원이 있어 때론 느긋하게 산책을 즐기는 것을 추천한다. 
림바 짐바란 발리 바이 아야나 투숙객은 바로 옆에 위치한 아야나 리조트의 시설 또한 이용할 수 있으며, 양 호텔 간을 오가며 운행하는 무료 셔틀버스를 이용할 수 있다.
발리 여행에서는 많은 사람들이 멋진 일몰과 바다를 즐기기 위해 해안가의 바를 찾는다. 아야나 리조트 내에 위치한 락바 역시 많은 사람들이 줄 서서 기다리는 일몰 명소이지만, 짐바란 발리 바이 아야나 투숙객이라면 기다림 없이 바로 입장 가능하다.
  2. 식스센스 발리 울루와뚜
Six Senses Bali Uluwatu
여행에서 풀빌라를 찾는 사람들이 늘어나고 있다. 이런 사람들의 욕구를 충족시켜 주 듯 2018년에 오픈한 발리의 신상 호텔 식스센스 발리 울루와뚜는 인도양을 마주할 수 있는 풀빌라 타입의 객실과 일반 객실을 갖추고 있다.
울루와뚜 절벽 위에 지어진 호텔은 레스토랑에서 바라보는 아찔한 높이의 절벽과 인도양의 푸른 바다가 인상적이다. 바다를 바라보고 있으면 맑은 바닷물 속에서 헤엄치는 바다거북을 꽤 볼 수 있다. 
바다가 한눈에 들어오는 레스토랑과 넓은 수영장, 바는 물론 인도양과 함께 즐기는 야외 스크린 영화관이 있어 발리 여행을 더 운치 있게 만들어준다.
  바다를 만나고 싶은 당신에게
해변과 가까운 호텔에 머물고 싶다면 '스미냑'호텔에 주목해보자.
1. 호텔 인디고 발리 스미냑 비치
Hotel Indigo Bali Seminyak Beach
발리 여행의 중심지이자 핫플레이스로 불리는 발리의 '스미냑'. 쇼핑부터 해변을 즐기는 것까지 한 곳에서 할 수 있어 여행자들이 사랑하는 장소이다. 스미냑에는 많은 호텔이 있는데, 그 가운데 글로벌 호텔 체인 인디고 발리 스미냑 비치가 있다. 독특한 인테리어와 감성적인 분위기의 부티크 호텔로 로비에서부터 시선을 사로잡는다.
풀빌라 타입의 객실도 있어 럭셔리한 호캉스를 즐기고자 하는 여행자에게도 제격이다. 조금만 걸어 나가면 스미냑 비치를 만날 수 있고 주변의 비치클럽을 이용할 수 있으니 여행이 더 즐거워진다.
  2. 알릴라 스미냑 발리
Alila Seminyak Bali
스미냑 해변과 좀 더 가깝게 위치한 발리 스미냑 호텔을 찾는다면, 럭셔리함을 갖춘 5성급 스미냑 호텔 '알릴라 스미냑'이 있다. 포근한 분위기의 자연친화적 객실은 물론 객실에서 바라보는 해변의 모습이 아름다운 곳이다.
넓은 규모와 인도양을 마주할 수 있는 3개의 인피니티 풀이 이곳의 또 다른 매력 포인트. 수영장 옆에는 바다와 선셋을 즐길 수 있는 비치바도 운영 중이며 호텔 바로 옆에는 발리에서 유명한 비치 바 포테이토 헤드가 위치하고 있다.
호텔과 이어진 해변 산책로를 따라 산책을 즐겨도 좋고, 넓은 수영장에서 수영하며 휴식을 취하기에도 좋은 곳. 스미냑의 분위기를 즐기고 싶다면 스미냑 스퀘어까지 무료로 운행하는 셔틀버스를 타고 편리하게 이동 가능하다.
  푸른 숲의 매력을 찾는 당신에게
야자수 가득한 곳에서 휴식을 만끽하고 싶다면 우붓 호텔로 가자!
1. 엘리먼트 바이 웨스틴 우붓
Element by Westin Bali Ubud
발리는 푸른 바다와 함께 초록 내음의 숲을 즐길 수 있어 더 매력적으로 다가오는 여행지이다. 이런 발리에서 바다를 뒤로 한채 초록빛 숲으로 둘러싸인 곳에서의 느긋한 휴식을 원한다면 '우붓'으로 향해보자.
우붓에는 가성비 좋은 발리 호텔이 가득하다. 그중 엘리먼트 바이 웨스틴 우붓은 '몽키 포레스트'라는 발리 관광지와 멀지 않은 곳에 위치해있으면서 탁 트인 전망과 넓은 수영장 시설을 자랑하는 곳이다. 건물 7층에서는 사방으로 둘러싸인 초록숲의 모습은 물론 나무 아래로 떨어지는 멋진 선셋을 즐길 수 있는 전망대 겸 루프탑 바가 위치해있다.
넓고 깔끔한 객실과 동남아 휴양지에 온 분위기가 물씬 풍기는 수영장과 레스토랑이 있는 곳. 매일 아침 무료로 진행되는 요가 클래스와 몽키포레스트까지 무료로 운행하는 셔틀버스가 있어 여행의 즐거움을 더해준다.
  2. 스탈라 어트리뷰트 포트폴리오 호텔
Sthala a Tribute Portfolio hotel
우붓의 푸른 숲과 함께 시원하게 흐르는 우스강(Wos River)를 만날 수 있는 우붓 호텔 '스탈라 어트리뷰트 포트폴리오 호텔'이다.
이곳 객실 테라스에서 보이는 수영장은 총 두 곳으로 정글을 바라보며 시원한 수영을 즐길 수 있는 풀과 인생 사진을 책임지는 파노라마 풀도 연결되어있다.
레스토랑에서는 조식을 포함해 런치, 디너, 애프터눈 티를 즐길 수 있는데, 야외 공간에서는 우스강이 흐르는 모습을 볼 수 있어 더 운치 있다. 해변가에서 보는 발리 선셋도 멋있지만 정글 숲으로 떨어지는 선셋 역시 압권이다. 우붓 스탈라 어트리뷰트 포트폴리오 호텔 7층에는 우붓에서 유명한 루프탑 바가 있어 분위기 있는 식사를 즐기며 붉게 물드는 선셋을 즐겨도 좋다.
  3. 코마네카 앳 라사사양
Komaneka at Rasa Sayang
럭셔리함은 물론 관광지와의 접근성까지 갖춘 우붓 호텔 '코마네카 앳 라사사양'이다. 일반 객실부터 풀빌라 타입의 객실까지 다양하게 갖추고 있는 건 물론 객실에서 마주하는 초록빛 숲을 보는 것만으로도 힐링이 되는 공간이다.
우붓 시장, 몽키포레스트와 모두 가까워 도보로도 이동 가능한 위치라는 장점과 함께 가격 대비 시설이 좋은 우붓 호텔로 알려져 있다.
푸른 숲과 마주하며 힐링하는 동시에 시원한 수영을 즐길 수 있는 코마네카 앳 라사사양 호텔. 이곳에서는 발리 공예문화를 접할 수 있고, 투숙객들에게 무료로 제공되는 애프터눈 티, 우붓 네카 박물관 무료입장 등의 다양한 혜택을 즐길 수 있다.
  4. 코마네카 앳 비스마
Komaneka at Bisma
울창한 숲과 독특한 라이스 필드를 만날 수 있는 힐링의 공간 '우붓'에서 럭셔리한 호텔을 찾는다면 '코마네카 앳 비스마'는 어떨까? 발리에 있는 코마네카 호텔 중 가장 럭셔리한 코마네카 앳 비스마는 일반 객실 타입부터 풀빌라 타입까지 다양한 객실 규모를 갖추고 있으며, 보다 넓은 크기의 객실을 자랑하는 곳이다.
이곳의 스파는 흐르는 강물 소리와 함께 즐길 수 있어 더 힐링 되는 듯한 느낌이 든다. 정글 숲 사이를 지나며 자연을 즐길 수 있게 마련된 산책로를 따라 산책을 즐겨도 좋고, 스파 & 수영을 즐기며 휴식을 취해도 좋다.
코마네카 앳 라사사양과 마찬가지로 투숙객들에게 무료로 애프터눈 티를 제공하고 있어, 휴식을 만끽하는 발리 여행을 즐길 수 있다.
지금 여행하기 딱 좋은 시기라는 현지인의 말이 아직도 귓가에 선하다. '가을이 가기 전 한 번 더 발리를 가볼까?'싶을 정도로 발리의 매력은 끝이 없다는 걸 몸소 느끼고 온 여행이었다. 전 세계 여행자들의 사랑을 받는 발리로 장기간 떠날 예정이라면 럭셔리함, 바다, 숲을 마주하는 각기 다른 매력을 지닌 발리 호텔을 모두 경험해보길 추천한다."
인도네시아,"발리 역대급 풍경 대결, 빠당빠당 vs 뜨갈랄랑:발리를 다녀왔다. 많은 이들이 물었다.
""발리 어때? 발리 좋지?""
""그럼! 발리 진짜 좋지""
어느 여행지보다도 발리는 특별하다. 사람마다 취향을 타는 것이 여행이긴 하지만, 지금 소개할 이곳은 보는 순간 발리와 사랑을 빠지게 만들 역대급 스폿들이다. 
울루와뚜에 있는 빠당빠당비치
빠당빠당 비치는 서퍼들이 사랑하는 비치 중 하나이다. 줄리아 로버츠 주연의 영화 '먹고, 기도하고, 사랑하라'에 나왔던 촬영지로도 유명하다. 빠당빠당 비치로 가는 길은 조금 남다르다. 비치인가 의심스러운 작은 입구를 지나, 정적만이 흐르는 우거진 나무 사이를 지나친다. 가파른 암벽 계단까지 내려가면 그제서야 순간 이동이 아닌가 착각이 드는 환상적인 비치가 나타난다.
산으로 바위로 나무로 둘러쌓인 빠당빠당비치는 곳곳에 꽃나무까지 화사하게 피어있어 이국적인 느낌이 가득하다. 더욱이 울루와뚜는 다른 발리 관광지와 달리 한적하기 때문에 빠당빠당비치로부터 오는 반전매력이 확연하게 와닿는다.
입구에는 바다색과 어울리는 하얗고 파란 파라솔들이 자리 잡고 있고, 형형색색 서프보드들이 줄지어 있어, 보는 눈이 즐겁다. 책을 읽는 사람부터 태닝하는 사람, 수다 떠는 사람과 서프보드를 손질하고 있는 사람들까지, 빠당빠당비치에서는 각자의 여유로움을 한껏 누릴 수 있다.

:: 아이폰 촬영 사진, 휴대폰으로 찍어도 이 정도!

입구를 지나 비치 쪽으로 깊숙히 들어가 보자. 스노우볼을 지켜보듯 위에서 아래로 내려다보면, 넓게 펼쳐진 해변 위로 파도가 조각한 바위들이 곳곳에 놓여있다. 존재감이 남다른 바위 앞에서 많은 사람들이 인증 사진을 찍고 간다. 청량한 바다 위 부서지는 하얀 파도가 '아, 이곳이 발리구나.' 실감 나게 한다.
서핑으로 유명한 발리답게 빠당빠당비치 또한, 파도가 거세고 높다. 비치에 떨어져 자리 잡은 물품 대여점까지 파도가 밀고 들어올 정도. 백사장과 가까운 바다는 얕지만 파도로 인해 갑작스레 깊게 느껴질 수 있어 조심해야 한다. 입구와 파라솔이 있는 비치에서는 해수욕을, 바위를 지나서는 파도 침식으로 인한 바위 조각들이 바닥에 있으니 패들 보드나 서프보드로 빠당빠당비치를 즐겨보는 걸 추천한다.
 TIP  먹고, 기도하고, 사랑하라! 빠당빠당비치
입구로 들어갈 때, 야생 원숭이가 있으니 주의.
입장료는 무료!
 우붓에 있는 뜨갈랄랑
정식 명칭은 뜨갈랄랑 계단식 논으로 우붓에 위치해 있다. 열대우림 같기도 한 울창함이 있는 울루와뚜, 빠당빠당비치와 달리 우붓은 어디를 가더라도 논(라이스필드)뷰와 야자수를 만날 수 있다.
뜨갈랄랑에서는 논과 야자수의 신비로운 조화를 여유롭게 느낄 수 있다. 이 신비함은 2012년 유네스코 세계유산에 등재되면서 더욱 빛을 발한다.
뜨갈랄랑은 해발 600미터에 다다르는 계단식 논으로 논에다가 물을 직접적으로 대는 '수박'이라는 방식을 채택하고 있어 시기적절하다면 계단 사이사이로 찰랑거리는 논의 색다른 모습을 엿볼 수 있다.
계단식 논을 여유롭게 바라보며 시원한 생과일주스를 마시는 것도 별미다. 뜨갈랄랑 맞은편으로는 각종 상점들과 전망 좋은 카페들이 옹기종기 모여있어 어느 곳에 앉던지 그곳이 바로 풍경 맛집이다. '발리스윙'처럼 계단식 논을 배경으로 그네가 준비되어 있는 카페도 있어, 신비로운 풍경 속 주인공이 되는 장면을 연출할 수 있다.
:: 아이폰으로 촬영한 인생 사진
쌀이 주식인 우리에게 논은 친근한 풍경이지만, 야자수가 더해져 이국적인 모습을 자아낸다. TV 예능에도 종종 나오면서 더욱 친숙한 뜨갈랄랑. 최근 우붓 특유의 매력이 사라졌다고 많이들 평가하지만, 뜨갈랄랑은 여전히 우붓의 독특한 매력을 책임지는 발리 여행 필수 코스가 아닐까 싶다.
 TIP  벗어날 수 없는 발리 매력 끝판왕, 우붓 그리고 뜨갈랄랑
입장료 있음. 카페 요금 별도.
우붓은 선셋이 안예쁘다는 평이 있고, 트래픽 잼이 있기 때문에 해가 떠있을 때 다녀오는걸 추천.
싱그러운 야자수, 풀과 논으로 인해 공기는 깨끗하지만 날벌레가 있음. "
