country,cleaned_sentences
미서부,서부 디즈니 9일 사진 2015 11 17 서부 디즈니 이구 서부 디즈니 9일 60 1611 160201119 식구 미국 가기 결정 렌트카 직접 예약 선택 고민 편하다 결정 부와 비교 수준 버스 장소 간다 경우 가격 실속 20 30만원 저렴하다 확인 모처럼 가족 가게 부족하다 폭풍 검색 미국 정보 알차다 발견 선택 결정 과정 여러 미주 친절하다 생활 생수 식당 주변 편의점 식당 찾기 어렵다 식당 공짜 물이 화장실 주유소 가게 여자 화장실 서요 서기 문화 미국 여자 화장실 세면대 욕실 분리 욕실 카페트 물이 주의 욕실 바닥 하수 구가 샤워 커튼 욕조 전압 110 지코 필요하다 1일 언덕 도시 샌프란시스코 11월 9일 오후 4시 30분 서울 샌프란시코행 야호 시작 설레다 며칠 이면 아쉬움 아시아나 777 이코노미석 작다 기내식 불편하다 간편하다 번의 간식 브리또 밀가루 느낌 음료 10시간 비행 다리 얼굴 퉁퉁 시차 인하다 아침 고맙다 샌프란시스코 42 명의 얼굴 재미있다 다행하다 구성은 가족 점잖다 조용하다 일정하다 최고 미켈란젤로 산피 에드 대성당 샌프란시스코 시청 구경 피셔맨 워프 베이 쿠루 참고 가족 옵션 신청 여행가 옵션 안타깝다 특색 옵션 무조건 이어폰 한국어 금문교 다리 유람선 어마어마하다 바람 머리 물살 퉁퉁 깔깔 대고 사진 재미있다 엔진 소리 주변 소리 이어폰 소리 작다 언덕 도시 샌프란시스코 언덕 케이블카 신나다 저녁 타운 뷔페 미국 동네 뷔페 메이드 치킨 칠면조 햄등 숙박 2일 샌프란시스코 미티 국립공원 농장 지대 프레즈노 시차 2시 다행하다 꼬마 4시 일어나서 2일 시작 자는둥 마는 간단하다 조식 미티 정상 프레즈노 오렌지 아몬드 나무 도로 가면 구경 건포도 거가 유명하다 점심 중국 식당 멋지다 음악 미티 진입 지명 이름 매치 어렵다 감동 터널 아름답다 사진 요기 폭포 11월 폐쇄된다 미티 폭포 다행하다 전날 폭포 물이 광경 폭포 15분 라가 폭포 산속 방한복 필수 프레즈노 저녁 신선하다 상추 돼지 계속 리필 가능 테이블 명의 와인 간만 한식 신나다 식당 라즈베리 사고 숙박 주변 타코벨 구경 시원하다 얼음보숭이 3일 프레즈노 사막 도시 라스베가스 5시 기상 6시 조식 바스토우 아울렛 1시간 물건 사고 11시 점심 서부 유명하다 버거 크기 감자 튀김 건강 식품 가게 쇼핑 캘리코 은광 가면 오른쪽 신기루 신기 넓다 인지 어제 여름날 잡기 어렵다 사막 선글라스 필수 전망대 덥다 날씨 씩씩하다 사막 도시 라스베가스 진입 베네치안 구경 천장 하늘 자유시간 마술 재료 8만원 미국 기념 소향 식당 김치찌개 불고기 11월 11일 재향군인 인지 재미 라스베가스 시가지 천장 길거리 진입 횡단보도 중간 천장 아프다 몇몇 분과 멀다 좌석 멀다 나머지 흥미 꼬마 구경 커녕 실컷 서울 자주 뮤지컬 공연 좋아하다 경후 버스 바람 벨라지오 분수 마자 종료 안습 숙소 엑스칼리버 궁전 모양 이쁘다 라스베가스 만족 숙소 카지노 로비 단점 상술 4일 라스베가스 브라 이스 자이언 시온 캐년 라스베가스 새벽 4시 기상 어제 저녁 소향 식당 육개장 5시 차안 일출 감상 가족 건강 빨갛다 멀미 어지러움 배앓이 정신 시작 건강 조심 레드 캐년 왼쪽 보구 브라 이스 캐년 이쁘다 붉다 토기 모양 캐년 아름답다 점심 몰몬교 운영 샐러드 샌드위치 신선하다 샐러드 맘껏 섭취 음악 자이언 캐년 진입 브라 이스 캐념 느낌 감동 터널 마다 환호성 여기저기 사진 브라 이스 캐년 포인트 서서 구경 자이언 캐년 차로 가깝다 감동 다르다 라스베가스 스트 토스 피어 전망대 관람 야경 감상 꼭대기 놀이기구 설치 오금 저리다 저녁 엑스칼리버 뷔페 저녁 라스베가스 허쉬 초코렛 상가 구경 카지노 세금 헌납 5일 라스베가스 그랜드캐년 강변 도시 4시 기상 한식당 북어 일출 구경 사막 상상 사막 풀이 작다 관목 사막 그랜드 캐년 그랜드 단어 쓰나미 감동 감탄사 저절로 경비행기 30분 그랜드캐년 구경 경비행기 사진 그랜드캐년 무마 크기 그랜드캐년 경이 로움 자체 추천 왼쪽 사진 캐년 바람 리도 운지 미티 바람 불어 머리 사진 찍기 힘드다 코피 그랜드 캐년 화장실 히터 작동 점심 멕시코 식당 브리또 라스 저녁 뷔페 강변 산책 요기 로비 카지노 손님 노인 대부분 세금 왕창 에고 아깝다 6일 로스엔젤레스 4시 50분 기상 바스토우 한식당 거기 3만원 망고 구입 볼거리 엄청나다 유니 버셜 스튜디오 전체 입체안경 중간 재미나 신기하다 트램 아찔하다 트랜스포머 입체안경 슈렉 영화 한편 워터월드 들뜨다 영화 별로 액션 폭발 장면 공연장 튀어 엄청나다 관람 강추 작전 확인 의자 표기 구역 쥬라기 공원 물이 조심 관람 점심 샌드위치 날씨 덥다 5시간 서고 금방 차이나 극장 이병헌 안성기 배우 손도장 확인 헐리우드 스타 거리 구경 스파이더맨 분장 사진 거리 산책 라마 갤러리 선물 비타민 젤리 학용품 향수 어마어마하다 구입 저녁 한식당 고기 고기 서빙 주네 숙소 히터 이상하다 1시간 피곤하다 7일 로스엔젤레스 하임 디즈니랜드 서울 분과 서울 가시 디즈니 오늘이 차로 디즈니 차갑다 입장 문의 마라톤 이벤트 기후 무료 입장 어쩐지 어마어마하다 디즈니랜드 놀이기구 집중 디즈니랜드 맞은편 캘리포니아 어드벤쳐 입장 입장 티켓팅 강조 막막하다 공부 막상 막막하다 패스트 패스 랜드 먼저 3시 30분 신상 인기 먼저 역다 트왈 타워 유명하다 진짜 아찔하다 사진 향기 꼭타 벅스 랜드 군데 정신 고장 실망 재미나다 멀다 고장 점심 햄버거 물이 음료 소나기 정보 우산 필요없다 어제 유니버셜 덥다 바람 가볍다 두껍다 잠바 필요하다 에고 날씨 어렵다 7시 창동 순두부 주변 우범 지역 아들 무섭다 편의점 아들 나머지 초콜렛 잔뜩 달러 소진 8일 로스엔젤레스 아시아나 380 에어버스 노미 좌석 넓다 깨끗하다 더하다 서울 9일 7일 미국여행 어마어마하다 거리 생생하다 미국여행 친절하다 가족 재미나 행복하다
미서부,이완 설레다 서부 설레다 인천공항 난생처음 미국 아시아나 몸흘 이륙 10 비행 미국 샌프란시스코 만난 이완 첫인상 탈랜트 이서진 느낌 시작 9일 동거 금문교 샌프란시스코 유래 역사 내용 여행지 캘리포니아 지형 특징 여행지 유타주 몰몬교 라스베가스 역사 인디언 행적 미국 철도 유래 섬세하다 브라이언 캐넌 웅장 자이언 캐넌 자연 작품 야하다 그랜드 캐넌 짧다 만남 여운 해박 지식 이완 준가 이드 진심 열거 미안하다 로스엔젤레스 한인타운 소주 한잔 소주 일상 시차 상관없다 지인 권장 북미 서부 권장 느낌 깊다 인상 이완 이완 준가 이드 북미 담당 이기영 수고
미서부,서부 캐넌 사막 지형 감동 10월 8일 10월 16일 서부 캐넌 사막 지형 감동 설레다 넓다 지위 자연 경관 저절로 인류 역사 세월 그랜드 캐넌 창조 불가능하다 거대하다 자연 흔적 자이언 캐넌 브라이언 캐넌 지형 거대 조물 자체 감동 말로 표현 제안 인디언 보호 구역 지역 캐넌 라스베가스 프로그램 인디언 보호 구역 프로그램 개발 보완 원래 주인 인디언 철저하다 자연 지혜롭 존중 더라면 미국 휠씬 풍부하다 문화 다양성 아쉬움 서부 선택 관광 가격 비싸다 미국 수도 대안 마당 선택 관광 비용 80만원 부담 라스베가스 관람 180달러 지불 가격 비싸다 경비행기 130 달라 유니버셜 스튜 디어 160달러 200달러 가깝다 선택 관광 51 명의 여행자 여행자 버스 좌석 배치 안락하다 현격히 수준 숫자 선택 비용 합리 대안 임금 구조 여행자 선택 관광 요금 의존 비용 체계 여행자 여러가지 불편하다 문제 문제 발생
미서부,신승준 특별하다 서부 서부 일주일 친구 특별하다 15년 친구 20 기념 의미 설레다 대반 시작 만난 신승준 행복하다 가슴 설레다 착하다 부드럽다 인상 미소 편안하다 질문 미국 구석구석 친절하다 즐겁다 보통 감정 사진 만난 신승준 미국여행 통해 감정 진정 말씀 특별하다 자연 행복하다 자연 감동 자연 인하다 미움 고민 고통 신비롭다 하늘 별도 아름답다 사랑스럽다 신승준 행복하다 신승준 고생 친구 행복하다 버스 노래 선곡 최고 지인 홍보 항상 건강하다
미서부,6월 중순 아시아나 항공 캐년 정복 서부 캐년 정복 서부 알차다 아시아나 항공 직항 편하다 샌프란시스코 짧다 기간 알차다 첫날 샌프란시스코 추위 당황 일주일 날씨 캐년 경치 지역 기온 습도 사막 덥다 곳도 얇다 바지 춥다 곳도 일주일 길다 대형 버스 편안하다 연세 문제 편하다 자연 경관 샌프란시스코 라스베가스 도시 유니버설 스튜디오 신기하다 촘촘하 경혐 베테 부장 최대한 짧다 구경 컴팩트 역사 배경 지역 본인 인생 지루하다 음식 맛있다 곳도 별로 곳도 대체로 하루나 이틀 편하다 서부 라면 추천
미서부,서부 신승준 4월 27일 5월 4일 캐년 서부 일주 샌프란시스코 라스베가스 캐년 로스앤젤레스 코스 4000 킬로 호강 첫날 샌프란시스코 관광 멀다 샌프란시스코 문구 샌프란시스코 시청 시청 광장 바퀴 금문교 웅장 피셔 기억 미티 국립공원 감탄사 절로 우왕 바스토우 탠져 아울렛 쇼핑 사진 쇼핑 정신 간곳 캘리코 은광 가면 보안관 할아버지 웃음 사진 1달러 미국여행 예의 기대 라스베가스 세기 권투 대결 시합 라스베가스 권투 축제 라스베가스 무작정 간곳 캐년 브라 이스 캐년 자이언 캐년 그랜드캐년 멋지다 그랜드캐년 경비행기 헬리콥터 후회 간곳 유니버셜 스튜디오 추락 장면 깜놀 헐리웃 거리 손바닥 싸인 안성기 이병헌 손도장 사진 군데 공개 신승준 만남 와이프 버스 여러 오신 멋지다 형님 연락 안부 다음주 약속 신승준 김정은 본인 직접 얘기 거임 직접 그랜드캐년 동영상
미서부,서부 서부 즐겁다
미서부,서부 권혁 고맙다
미서부,케빈 즐겁다 서부 해외 자유여행 경험 피곤하다 긴장 퀄리티 버스 꼼꼼하다 날씨 옷차림 정보 편하다 버스 장시간 거리 인하다 기분 다운 케빈 개그 식당 팀원 본인 안쓰럽다 베스트 드라이버 어디가 서나 행복하다 팀원 일상 팀원 항상 행복하다
미서부,서부 특별하다 특별하다 계획 두근거리다 샌프란시스코 순간 즐겁다 바쁘다 시작 38 명의 낮선 거대 부지역 풍자 유모 연륜 자연 전달 여러가지 머리 가슴 기대하다 자연 웅장 도시 세련되다 화려하다 농가 파스텔 색채 자연 자연 사랑 환경 거대하다 스탠포드 대학 캠퍼스 서점 영영사전 가격 저렴하다 구입 흐믓 스탠포드 대학 캠퍼스 10분 넓다 캠퍼스 정문 모하비사막 캐년 감탄 대자연 신의 최고 작품 표현 안개 그랜드캐년 순간 구름 신비 로움 더하다 감탄사 달리 관관 버스 지역 광대하다 캐년 야생동물 등장 재미 집채 통채 이사 재미 음지 라스베가스 화려하다 신나다 대도시 탈바꿈 가족 연인 찿는 구경 거리 작다 공연 기도 라스베가스 벨라지오 인공 호수 분수 우아하다 낭만 그날 저녁 자유롭다 라스베가스 거리 찬란하다 사이 산책 바쁘다 피곤하다 장난 피로 풀기 결정 숙소 강변 도시 콜로라도 취침 스타 거리 좋아하다 영화배우 유니버설 스튜디오 놀이기구 동심 중학생 영어 사진 통해 방학 추억 행복하다 추억 크게
미서부,신승준 과장 열흘 서부 딸아이 미국 서부 신승준 과장 세심 배려 열정 설레다 소중하다 추억 첫날 기억 새록새록 아름답다 레드우드 공원 공기 코끝 맴도 스탠포드 대학 광활하다 교정 눈앞 거립니 절경 영원하다 신승준 과장 본인 피곤하다 새벽 열심 라스베가스 여러 알차다 할리우드 거리 재밌다 유니버셜 스튜디오 동심 디즈니랜드 추억 짧다 10일 신승준 과장 즐겁다 신나다 건강하다
미서부,간이 서부 기행 간이 서부 기행 겨울 초입 유타주 위트 니스 보리밭 산맥 길다 어진 도로 사이 샌프란시스코 직하다 정겨운 듬성 듬성 어쨌든 몰몬교 도의 유타주 마을 어귀 종이 예의 순수하다 근면하다 몰몬교 놀란 토끼 순식간 지도 위트 니스 해리슨 포드 주연 미국생활 20년 이준 정적 몰몬 교도 일부다처제 고수 기독교 이지 근면 성실하다 불구 인정 미국정부 일부다처제 포기 전제 유타 주로 승격 몰몬 교도 당연하다 이유 몰몬 교도 근면 성실하다 친구 선교 젊다 시절 흔하다 통해 영어 후회 확인 목도 즐거움 몰몬교 놀래다 자이언 힐링 자이언 캐년 개척 몰몬교 1874년 인근 솔트레이크시티 몰몬교 신도 정착 예루살렘 약속 성경 의미 자이언 시온 이름 지은 몰몬 교도 터전 자이언 캐년 장엄하다 거대하다 기기묘묘하다 전체 장엄하다 비장하다 기도 편안하다 편안하다 행복하다 힐링 자연환경 최소한 슬그머니 아프다 곳도 원래 조상 인지도 인디언 터전 인디언 인디언 조상 몽고 출신 백인 아메리카 발견 우랄알타이어족 몽고 해협 건너 아메리카 인디언 시작 이준 뗄레 관계 피라밋 조상 우랄알타이어족 거나 실제 인디언 생활 이준 아기 관습 음악 음계 사용 인디언 자장가 전래 자장가 자장 자장 자장 자장 자장 곡조 아들 기쁘다 고추 인디언 집안 고추 이러하다 설득 이러하다 인디언 주로 아리조나 유타 네바다 캘리포니아 미티 분포 미티 인디언 입장 학군 계곡 짐승 방이 이러하다 최고 생활 터전 백인 인디언 보호 구역 미국 인구 3억 소규모 인구 오늘날 인디언 조상 인지도 우스개 소리 캘리포니아 왕창 이민 천만 캘리포니아 우리땅 전쟁 고토 회복하다 방법 방법 이준 농담 한바탕 일만 드넓다 농토 좁다 덩어리 복닥 거리 면서 필요 농업 유망 사업 젊은이 이참 시골 농사 기술 밑천 도전 거대하다 덩어리 욕심 미국 부지역 샌프란시스코 참으로 샌프란시스코 외곽 비롯 고속도로 캘리포니아 모하비사막 산들 민둥산 산이 나무 그러하다 민둥산 들판 목장 용지 활용 들판 규모 상상 초월 들판 어깨 너머 멀리 지평선 끄트머리 기어이 힐링 오밀조밀하다 타래 느낌 기차 길다 기차 어보 100 150 리도 어마어마하다 대륙 철도인 대륙 철도 절반 스탠포드 건설 스탠포드 대학 설립 스탠포드 건설 과정 에피소드 이준 직접 재미있다 어설프다 흉내 그랜드캐년 경비행기 어쩐지 아깝다 캘리포니아 모하비사막 공짜 구경 미안하다 모하비사막 그랜드캐년 경비행기 택할 모하비 사막 택할 사막 횡단하 길다 거대하다 아름답다 한편 신비 한편 시가 린트 이스트 우드 멀리 언덕 응시 어저께 미티 인디언 사막 인디언 보호 구역 하자 그랜드캐년 하바 파이 나바호 인디언 천년 뿌리 그랜드캐년 협곡 녹지 일부 인디언 보호 구역 지정 경비행기 헬기 수가 버스 하이킹 협곡 콜로라도 래프팅 강가 만날 그랜드캐년 애리조나주 북부 콜로라도 20억년 협곡 구덩이 규모 어마 무시 오죽하다 선정 여행지 위인 깊이 길이 460 평균 넓이 16 아리조나주 그랜드캐년 그랜드캐년 스테이 트라고 곳도 인디언 활동 무대 서부 라스베가스 슬롯머신 배달 위스키 쏠쏠하다 24시간 환락 도시 사막 복판 건설 참으로 미국 다운 발상 미국 싱겁다 표현 싱겁다 스케일 덩어리 간이 이상하다 라스베가스 캐년 왕복 도중 불법체류자 500만 사면 소식 대선 주자 힐러리 선물 공화당 입장 타격 공화당 입장 생색 내면 면도 투표 영향력 최소 화하다 동의 주어 성공 오서방 용납 아예 대통령 고유권 한인 행정명령 사면 내일 삿대질 피터지다 삿대질 치면 미국 싱겁다 정적 표현 인권 관련 기독교 교리 실제 정적 미국 이민 20년 이준 재미있다 미국 아파트 가면 각국 언어 아파트 아파트 신분 언어 종교 인종 차별 신고 미국 신분 차별 미국 불법체류자 의심 직접 인권 신분 차별 고용주 입장 불법체류자 의심 직접 대신 질문 월급 통장 현금 현금 불법체류자 유추 월급 깍아 제시 경찰 마찬가지 교통경찰 교통 딱지 불법체류자 인지 확인 확인 수도 민국 자료 주지 이기 확인 확인 수가 경찰 자료 판결 추방 통보 불법체류자 300 000 정보 불법체류자 일지 미국 민국 단속 추방 판결 안전하다 별개 정책 불법체류자 일지 세금 생년 일과 이름 대면 세금 꾸준하다 납부 불법체류자 사면 유리하다 이민자 이유 미국 정책 건강하다 약자 정적 반대 건강하다 약자 핍박하다 태도 단호 여권 미국 어떠하다 처벌 종신형 선고 미국 여권 인신매매 간주 죄질 나쁘다 범법 반대 180 온정 주의 적용 유흥업소 한인 고리대금업 교포 여권 여권 필요하다 깜박 려고 주인 보관 까마귀 날자 급습 여권 발견 그로 인하다 고리대금업 교포 종신형 선고 영어 서툴다 억울하다 당사자 입장 일인 항소 결과 건강하다 약자 보호 미국인 의식 이롭다 여권 다반사 경우 도대체 뜨겁다 그립다 이름 런가 초입 바람 싱그럽다 지붕 포기 소중하다 오죽하다 나무 그늘 거지 보따리 보이지 이쯤 증인 남매 중간 위로 집착 그립다 동포 동포 눈물 콧물 환의 도시 전혀 낯설다 오죽하다 할리웃 거리 명소 로만 차이니스 극장 카디 단성사 저녁 지인 베버리힐즈 크리스마스 분위기 한창 크리스마스 트리 하늘 높다 산타 태운 썰매 머리 주위 호리 호리하다 청춘 일색 자세하다 샌프란시스코 동성애자 어쩜 고기 파스타 미국 터전 베버리힐스 11월 17일 8일 서부 이준 재미있다 형식 잘못 기술 부분 이준 정정 시기 2014 12 장재성
미서부,아시아나 항공 서부 캐년 일주 안녕하다 11월 통해 서부 캐년 즐겁다 기억 1일 3시간 인천공항 미팅 일찍 수속 4시간 1시간 먼저 여유 미팅 수속 원하다 좌석 일찍 추천 좌석 배정 면세점 구경 도하 다가 탑승 국적 기인 아시아나 항공 불안하다 편안함 설레임 어느덧다 샌프란시스코 심사 입국심사 간단하다 긴장 심사 나오니 피켓 계시다 날수 모이 버스 탑승 버스 50 인승 탈수 대형 버스 40 명정 탑승 상당하다 넓다 여유 기간 불편하다 기억 샌프란시스코 한눈 트윈픽스 지역 안타깝다 안개 안개 사이사이 샌프란시스코 지붕 아름답다 트윈픽스 샌프란시스코 시내 유니온스퀘어 시청 피셔맨 워프등 관광 베이 크루즈 선택 관광 한국어 라디오 금문교 일품 크루즈 로마시대 유적 재현 팰리스 오브 평화 아름답다 도시 금문교 버클리 대학교 관광 유럽 달리 깔끔하다 넓다 샌프란시스코 첫날 마무리 사진 원망 스럽다 2일 서부 기대하다 관광지 미티 국립공원 부지런하다 아침 버스 탑승 미티 미국 미국 서부 판매 햄버거 가게 점심식사 황무지 순간 울창 미티 국립공원 유네스코 자연 유산 등재 수많다 영화 소설 배경 미티 절벽 가깝다 높이 카피 바위 신부 면사포 이름 면사포 폭포 미티 폭포 관람 11월 폭포 말르다 미티 아름답다 부족함 미티 산책로 산책 차량 탑승 미티 정상 포인트 절경 경이 충분하다 신나다 미티 관광 차량 어느덧다 2일 숙박 지인 농장 지대 프레즈노 지역 3일 아침 부지런하다 끝없다 바스토우 사막 지대 바스토우 아울렛 아울렛 코치 폴로 해외 브랜드 입점 아울렛 사막 아울렛 신기하다 자유 쇼핑 쇼핑 만족스럽다 구입 아울렛 신나다 쇼핑 차량 탑승 서부 민속촌 캘리코 은광 캘리코 은광 예전 부시 마을 재현 지도 부영 주점 재현 엇어 11월 햇빛 날씨 따뜻하다 신나다 사진 어느덧다 이지나 캘리코 은광 뒤로 디어 라스베가스 저녁 라스베가스 먼저 라스베가스 베네치아 관광 궁궐 넓다 라스베가스 흔하다 스트립 거리 다운타운 존재 다운타운 자율 관광 전광판 관람 관람 라스베가스 특급 엑스칼리버 자유시간 라스베가스 카지노 대부분 저녁 자유시간 자유롭다 카지노 관광 추천 4일 서부 관광지 핵심 관광인 캐년 캐년 브라 이스 캐년 자이언 캐년 관광 거리 이기 아침 일찍 일어나서 전날 중간 중간 피로 어느덧다 브라 이스 캐년 브라 이스 캐년 캐년 섬세하다 여성 캐년 불리 기도 오전 착하다 고도 높다 기온 쌀쌀하다 브라 이스 캐년 아름답다 브라 이스 캐년 뒤로 점심식사 자이언 캐년 브라 이스 캐년 여성 캐년 라면 자이언 캐년 웅장 남성 캐년 자이언 캐년 순간 자이언 캐년 미국 시온 예루살렘 언덕 성스럽다 캐년 협곡 사이 풍경 감히 카메라 찍기 민망하다 아름답다 캐년 관광 라스베가스 서부 높다 스트 토스 피어 전망대 109 야경 감상 도시 아름답다 캐년 감동 라스베가스 명물 벨라지오 분수 훌륭햇어 저녁 룩소르 뷔페 자유시간 전날 마찬가지 어르신 카지노 자유롭다 스트립 라스베가스 카지노 셧다 스트립 산책 추천 5일 아침 일찍 라스베가스 작별인사 버스 탑승 이만 최대 최후 다시없다 작품 그랜드캐년 관광 그랜드캐년 아침 일찍 버스 장시간 을해 피곤하다 버스 붙이 감동 덥다 점심 디어 그랜드 캐년 브라 이스 캐년 섬세하다 자이언 캐년 웅장 그랜드캐년 감히 야하다 표현 캐년 서로 감동 전하 경비행기 선택 관광 1시간 그랜드 캐년 하늘 감동 그랜드캐년 미국 선정 야하다 당당하다 순간 느꼇어 어느덧다 벌써 숙박 지인 강변 도시 있엇네 투숙 관광 피로 6일 서부 대표 도시 코리아타운 굉장하다 크게 구성 관광 코리아타운 헐리웃 관광 선택 관광인 유니버셜 스튜디오 입장 유니 버셜 스튜디오 미국 디즈니랜드 테마 파크 종일 부족하다 넓다 거리 유명하다 재밌다 탈것 5시간 후회 관광 유니 버셜 특식 갈비 지난 기간 어르신 대화 고기 한잔 기분 말로 표현 7일 기상 공항 하니 공항 수속 작별인사 마무리 미국여행 버스 주위 막상 버스 지루하다 일찍 일어나서 부담 하루하루 적응 피곤하다 감동 크기 미주 감히 서부 적극 추천
