country,cleaned_sentences
미서부,베스트 서부 코치 당분간 가수 김동률 아련하다 서부 추억 소환 따뜻하다 공항 게이트 인천 9시간 탑승 숙제 평소 숙제 주지 숙제 여독 숙제 용이 평소 직장 동료 통해 자주 나름 만족하다 꼼꼼하다 적절하다 가격 알차다 부적 래미 수능시험 그간 벼르 캐리어 새롭다 입시 캐년 그랜드캐년 대자연 신비 눈앞 그랜드캐년 포함 서부 결정 머리 생생하다 서부 편린 머리 희망 9시간 비행 샌프란시스코 공항 공항 나오니 푯말 계시다 선하다 훈훈하다 훤칠 남자 3시 입국심사 까다롭다 지체 공항 만난 6시 어둠 짙다 코치 버스 창밖 풍경 칠흑 선곡 올드팝 샌프란시스코 샌프란시스코 시청 시청 야경 찬란하다 주변 건물 위용 자랑 아름답다 주변 건물 센터 양식 시청 사진 짧다 도장 피셔맨 어둠 바다사자 짧다 만남 뒤로 금문교 중학교 영어 교과서 삽화 등장 만해 설레다 멀리 다리 배경 사진 보통 금문교 자전거 횡단 버스 외모 깔끔하다 목소리 금문교 건설 스트 라우스 얘기 재미나 당시 현수교 높다 굉장하다 내용 적절하다 스피드 이해 쏙쏙 샌프란시스코 미국여행 첫날 마감 샌프란시스코 시청 화려하다 웅장 형태 황금 천장 고풍 연상 웅장 건물 결혼식 장소 유명하다 금문교 해협 이름 명명 출신 실리콘 밸리 저명하다 사업가 이종 문씨 기증 건물 피셔맨스워프 사진 피셔 맨즈 워프 피어 39 피어 39 만난 바다사자 깜깜 울음소리 요란하다 피셔 맨즈 워프 하우스 보트 1893년 기라델리 기라델리 초콜릿 회사 설립 유명하다 초콜릿 대도시 캐년 미티 국립공원 추가 관광지 시작 선곡 김동률 미티 시월 멋지다 고등학생 음악 좋아하다 반응 탁월하다 선곡 빙하 인하다 자연환경 거대하다 웅장 스케일 장난없다 감탄사 연발 여기저기 설경 미티 밸리 폭포 스케일 멋지다 풍경 폭포수 여하튼 폭포 물줄기 장관 사진 찍기 예쁘다 장소 직접 마다 가족사진 몇개 미티 밸리 포인트 풍경 강물 초원 절벽 폭포 구경 멋지다 인앤아웃 버거 미국 캘리포니아주 어바인 본사 서부 매장 운영 미국 버거 인앤아웃 쉑쉑 맥도날드 점심 인앤아웃 버거 주문 감자 프렌치프라이 바삭 신선하다 재료 쓰기 서부 동부 터널 안개 미티 밸리 미티 미티 국립공원 폭포 면사포 폭포 미티 국립공원 폭포 아름답다 웅장 미티 대표 암벽등반 유명하다 캐피 절벽 비싸다 사기 힘드다 명품 바스토우 아울렛 매장 진짜 저렴하다 할인 쿠폰 이중 적용 평소 엄두 가방 안사면 국가 후회 짧다 빠르다 아들 후드 사고 신랑 약도 쇼핑 캐리어 과거 은광 캘리코 햇볕 강렬하다 썬글라스 과거 마을 유지 풍경 캘리포니아 골드러쉬 초등학교 견학 개구 지게 선생님 소리 벅벅 컨트롤 정겨운 항상 버스 목적지 관련 당시 미국 역사 배경 상세 다방면 편안하다 하루하루 갈수록 카지노 라스베가스 스트 토스 피어 타워 109 야경 구경 높다 자이로드롭 놀이기구 구경 아찔하다 벨라지오 분수 베네치아 마르코 광장 곤돌라 드타 화려하다 퍼포먼스 화려하다 스웩 라스베가스 투숙 자유 여신 코카콜라 빌딩 허쉬 초코렛 빌딩 쇼핑 펩시 빌딩 초코렛 빌딩 좋아하다 서서 쉑쉑버거 12시 주문 오신 라스베가스 버거 아깝다 라스베가스 딸도 구경 사진 버거 나오니 굵다 빗방울 숙소 성급하다 캘리코 은광 모하비 사막 라스베가스 벨라지오 분수 라스베가스 야경 높다 전망대 스트 토스 피어 자이로드롭 놀이기구 번지점프 라스베가스 프리몬트 리트 오후 6시 새벽 1시 정각 올해 황금돼지 해인 예쁘다 돼지 전망대 라스베가스 야경 쉑쉑 버거 베네치안 뉴욕뉴욕 라스베가스 쇼핑 기념품 유타주 자이언 캐년 브라 이스 캐년 아침 비도 기상 악화 안개 자이언 캐년 경치 구경 브라 이스 캐년 도저히 안개 수가 레드 캐년 레드 캐년 브라 이스 캐년 축소 판이 어디가 브라 이스 레드 똑같다 아쉬움 자생 나무 협곡 형성 과정 상세 지구과학 수업 전날 라스베가스 후유증 버스 눈꺼풀 무거워 죄송하다 고개 몇번 석식 케납 식당 스테이크 가수 포크송 가요 만남 흥이 가수 노래 만남 떼창 인상 반응 가수 유타주 깊다 자이언 캐년 설경 자이언 캐년 자이언 캐년 멀리 레드 캐년 목적 이자 야하다 명소 그랜드캐년 아리조나주 어마 무시 덩어리 미국 시차 미국 아리조나 여행자 금쪽 터리 그랜드캐년 진작 공항 경비행기 19 인승 경비행기 기억 경비행기 탑승 인지 설레다 조종사 경비행기 그랜드캐년 웅장 아름답다 형용 대자연 미약 존재 인지 저리 순간 노스 경비행기 사진 사진 동영상 다가 순간 뭉클하다 갱년기 증상 폭발 광경 자꾸 눈물 참고 경관 마음속 경비행기 버스 이동해 그랜드캐년 중심부 포인트 사진 상쾌하다 공기 그랜드캐년 만끽 아름답다 부족하다 웅장 거대하다 외롭다 형용사 비행장 경비행기 경비행기 세상 그랜드 캐년 포인트 포인트 아름답다 자연 겹겹이 계곡 장관 여정 로스앤젤레스 유니버셜 스튜디오 헐리우드 캘리포니아주 미국 50 횡단 캘리포니아주 시작 네바다주 유타주 아리조나주 캘리포니아주 귀국 코스 8천 킬로미터 여정 새삼 버스 기사 전하 일본 오사카 유니버셜 스튜디오 유니버셜 스튜디오 예상 스튜디오 관람차 트랜스포머 워터월드 해리포터 대기 점심 맛있다 김밥 유부초밥 신속하다 자유시간 워킹데드 체험 캐릭터 사진 찍기 심슨 물통 기념 헐리우드 그간 보지 도시 북적 거리 분위기 한인타운 헐리웃 거리 차이니즈 극장 한인타운 음식점 삼겹살 갈비 맛있다 서부 마무리 유니버셜 스튜디오 유니버셜 스튜디오 관람차 영화 제작 장면 멋있다 수능 수고 꽃길 워터 월드 200 유명 영화배우 사인 바닥 로스앤젤레스 공항 탑승 시애틀 앵커리지 삿포로 중이 4시간 가야 귀국 별로 체험 리드 서부 고민 결정 도움 최선 목적지 컴백 푯말 높이 포토 휼륭하다 사진 찍기 신공 발휘 가족 사진 유니 버셜 스튜디오 해리포터 입장 자유시간 말씀 나오니 출구 계시 길안 도움 려고 수고 전문성 해박 지식 소유자 버스 미국 역사 문화 시사 관광지 지식 관련 인물정보 새벽 시작 강행 버스 자고 적도 미국 탄생 배경 역사 그랜드캐년 형성 과정 재밌다 낭낭 목소리 말씀 갱년기 아줌마 팬심 자극 기적 차별 화가 훈훈하다 외모 패션 장난 따님 얘기 사모님 얘기 가정 성대 건강 미모 계속 유지 항상 행복하다 건강하다 버스 연구 목적지 관련 적절하다 노래 선곡 기본 그랜드캐년 관련 다큐멘터리 버스 컴퓨터 화면 흑인 인권 향상 영화 한편 적도 시청각 자재 적절하다 사용 남녀 노소 맞춤 식이 연구 면모 힐링 관광 목적 직장 생활 반성 새롭다 자극 반성 전문성 결심 서부 알차다 아쉬움 첫날 샌프란시스코 미국 출국심사 느리다 체험 첫날 타이트 무리수 첫날 군데 발상 개인 금문교 두운 지난 가수 싸이 나잇 콘서트 재밌다 스트레스 글로벌 가수 다르다 관련 기사 댓글 가수 리플 달이 지난 분야 최선 멋지다 미주 이기영 서부 코치 통해 힐링 신선하다 자극 응원 시기
미서부,즐겁다 서부 이란 편하다 즐겁다 견문 기억 남아 참되다 일인 충족 보람 단점 최소 주신 드라이버 선생님 말씀 팍팍하다 부담스럽다 다행하다 만족 스럽다
미서부,서부 도시 캐년 주선 서부 대도시 캐년 말로 샌프란시스코 라스베가스 로스 레스 라멘토 서부 도시 자이언트 캐년 브라 이스 캐년 엔텔 로프 캐년 그랜드캐년 서부 캐년 날씨 관계 엔탤로프캐년 나머지 예정 아깝다 그랜드캐년 웅장 장엄하다 순간 의미 가치 부여 기간 친절하다 고맙다 숙소 한가지 인상 고맙다 틈틈하다 감미 아름답다 음악 기간 고맙다 기회
미서부,서부 멋지다 그랜드캐년 신혼여행 그랜드캐년 미국 선택 바쁘다 일과 결혼 자유여행 버겁다 선택 과거 동남아 부분 상당하다 실망하다 경험 자체 정부 부분
미서부,서부 그랜드캐년 멋지다 신혼여행 자유여행 미국 칸쿤 계획 서부 선택 부분 본적 신혼여행 선택 동남아 기분 경험 10일 부분 조인 푸른 담당 3분 미국 역사 관광지 제이크 공항 즐겁다 부분 정부 공항 착하다 유니버셜 비몽 힘드다 소화 라스베가스 그랜드캐년 제외 크게 인상 부분 버스 로만 아쉬움 2019년 군데 하니 희생양 기분 한식 크게 나쁘다 전날 솔뱅 돈까스 진짜 최악 날씨 불구 야하다 불편하다 신혼여행 예약 과일 바구니 정부 아쉬움 넓다 미국여행 운전
미서부,서부 경험 추천 자유여행 입장권 경향 여행지 정해진 불편하다 자유여행 노력 관련 친구 필요 치안 관련 안전하다 만족하다 굳다 날씨 운치 캐년 만날 샌프란시스코 금문교 예쁘다 일몰 선물 신승준
미서부,즐겁다 서부 캐년 정우진 아시아나 샌프란시스코 만석 인하다 가족 뿔뿔이 시작 미국 즐겁다 기원 입국 심사 지연 샌프란시스코 시작 정우진 해박 조그마하다 어촌 마을 짧다 나마 뿌옇다 기기 남아 금문교 사진 첫날 2일 레이크 타호 드넓다 호수 유람선 미국 호수 동네 경포 호수 호수 우물 맑은 공기 3일 미티 국립공원 대자연 바위 설악산 울산 바위 조약돌 노스 페이스 모태 바위 바위 인상 4일 아침 일찍 은광 멋지다 사진 광활하다 자연 경관 캐년 초라하다 광경 초기 따뜻하다 태양 멋지다 사진 부지런하다 라스베가스 분수 시티 조명 브레드 관람 5일 브라 이스 캐년 시온 캐년 포인트 구경 멋지다 터키 카파도키아 작다 놀이터 광활하다 브라 이스 캐년 버스 구경 시온 캐년 멋지다 풍경 구경 6일 사진 작가 형형색색 캐년 사진 앤텔 로프 캐년 구경 인디언 멋지다 촬영 솜씨 사진 문제 앤텔 로프 사진 사진 인생 사진 멋지다 앤텔 로프 그랜드 필요 광활하다 대지 끝판 경비행기 그랜드 캐년 경비행기 짧다 비행 정우진 러시아 탑승 탑승 항의 100 환불 속지 금전 이득 10분 아쉬움 7일 새벽 4시 4시간 차량 운행 아침식사 한식 구경 이병헌 안성기 손도장 구경 21 구경 갈비 8일 공항 넉넉하다 편안하다 13시간 비행 무사하다 미국 미국 건국 성장 발전 토대 대통령 인디언 고민 주신 정우진 건강하다 기원
미서부,김덕규 폴킴 서부 인생 사진 샌프란시스코 명물 금문교 저녁 금문교 아름답다 연착 차질 김덕규 폴킴 기사 불구 첫날 기억 김덕규 힘드다 기억 재치 농담 순간 순간 절묘하다 노래 선정 감탄 자이언 캐년 선곡 아베마리아 엄마 눈물 포인트 유니버셜 스튜디오 핵심 버스 상영 어거스트러쉬 라라 랜드 인생 영화 뒷모습 영원하다 동행 소중하다 인연 인생 터닝 포인트 동기부여 교수 부부 오신 계시다 버킷리스트 추가 고맙다 김덕규 기사 고맙다 동행 고생 엄마 사랑
미서부,서부 하와이 미래 관계자 진심 대박 여정 다양하다 구성원 수능 탁월하다 리더십 감탄 지구촌 해박 역사 지식 버스 충분하다 종료 항상 복기 정리 통해 참가자 정보 가치 고객 지향 최고 자세 그간 감동 일로 효과 참가자 소개 서로 서먹하다 어색하다 해소 도움 중간 중간 제공 지도 자료 이해도 빠르다 높다 테마 파크 음악 행복 행복하다 달콤하다 추억 근원 심오하다 혜안 인연 강조 구도 아름답다 특권 신혼 부부 소중하다 선물 관계자 완벽하다 조화 성공 얘기 찬사 훈훈하다 얘기 중심 서부 김학선 서명 하와이 최상호 세분 존재 뜨겁다 열기 고객 참여 훈훈하다 분위기 역량 헌신 지속 성장 초석 마련 도움 확신 도움 11일 2018 10 15 10 25 서부 도시 캐년 하와이 일주 33년 추억 설레임 기대 기쁘다 참여 시작 설레임 시작 하와이 지속 금번 서부 하와이 가치 창조 고객 만족도 역량 열정 크게 다르다 소중하다 계기 지도자 잘못 공동체 위험 거나 불행하다 리스크 금번 확인 수평 고객 지향 리더십 관련 해박 지식 금치 재치 넘치다 입담 프로그램 감초 역할 톡톡하다 이처럼 철저하다 고객 눈높이 소통 참가자 감동 울림 해외 인상 꼽으라 단연 참가자 찬사 나름 이유 고객 지향 서비스 꾸준하다 자기개발 노력 투철 사심 수평 리더십 완성 높다 역할 금번 해외여행 경험 참가 첫째 스펀지 친화력 프로그램 완성 역량 성공 담보 초가 친구 이자 역할 완벽하다 현란하다 흡인 강하다 말솜씨 유모 어색하다 익숙하다 차질 거리 차안 시종일관 눈높이 대면 대화 소통 진정 충분하다 전혀 이러하다 참가자 프로그램 집중 충성 22 명의 인원 한치 오차 동인 이처럼 신앙 열정 헌신 역할 넓다 확고하다 패밀리 고객 구축 성장 탄탄하다 희망 디딤돌 둘째 도전 정신과 자기개발 통해 힘차다 긍정 에너지 발산 계시다 품격 높다 열정 자기개발 매진 귀감 이러하다 열정 도전 자기개발 결과 경쟁력 지속 가능 원천 통해 명불허전 아침 절실 심오하다 지식 현란하다 화술 성장 원동력 충성 강하다 집토끼 고객 결집 새롭다 성장 산토끼 고객 확보 무난 공간 존재 규정 고객 불편 해소 안전 중요하다 본분 인식 항상 제자리 사고 예방 관리 빠르다 반응 조치 국가 지도자 국민 대접 방식 차이 애국심 차이 역사 국격 가늠 기본 국민 생명 안전 국가 의지 국민 곤경 조국 확신 절대 국격 세분 고객 안위 관심 배려 충성 높다 요인 제자리 시작 마중 배웅 마무리 이스라엘 국가 국민 애국심 상관관계 이스라엘 우간다 국민 인질 이스라엘 특공대 무려 4000 구출 작전 성공 국민 석방 팔레스타인 포로 수백 일도 국민 소중하다 국가 이스라엘 국민 충성 화답 전쟁 이스라엘 해외 청년 귀국 입대 유명하다 넷째 세분 인연 신의 소중하다 옷깃 인연 슬기롭다 종료 시점 인연 인연 신의 소중하다 고객 지향 공동체 생사 고락 성향 강하다 성향 철학 아들 고객 긴밀하다 호흡 유지 원천 주변 미래 기억 고객 걸음 걸음 신뢰 새롭다 도약 사심 헌신 노력 최근 해외 업도 치열하다 경쟁 생존 환경 살신성인 극기 희생 미래 설계 충정 계시다 알차다 결실 으뜸 관광 회사 자리다 의심 현재 과거 필연 물이 미래 필연 원인 과거 현재 미래 실현 미래 문제 소재 개혁 변화 지혜 혜안 세분 축복 충만
미서부,서부 에릭 최형준 10월 1일 8일 짧다 베테 에릭 51 명의 남녀 노소 70 어르신 언찮음 불만 대략 4천 거리 전문가 미국 역사 장거리 버스 지루하다 추억 팝송 멋지다 장소 일일이 사진 경비행기 탑승 지연 남아 지루하다 후버댐 해주시 멋지다 보너스 기분 아시아나 지연 정보 2시간 지인 개인 자동차 10 공항 에릭 알차다 여운 만족하다
미서부,서부 서부 편안하다 불편하다 편안하다 상세
미서부,최고 즐겁다 서부 김학선 진짜 최고 안녕하다 미국 서부 추석 연휴 계속 불구 김학선 박수 어른 젊다 소통 기쁘다 서부 공부 미국 미국 호감 미국 서부 김학선 부모님 미국 서부 김학선 방법 일주일 기간 52 김학선 결혼
미서부,서부 대도시 김학선 추석 연휴 서부 대도시 8일 작년 추석 통해 동유럽 13일 유쾌하다 기억 통해 서유럽 미국 서부 캐년 미국 결정 통해 기대 추석 오후 여유 인천 국제 공항 티켓팅 직원 짤막하다 미팅 아시아나 항공 탑승 10시간 끼니 기내식 프란시스코 무사하다 까다롭다 입국심사 입국 나오니 핏켓 미남자 김학선 환하다 미소 한참 8일 51 깜놀 52 대형 버스 탑승 완료 마이크 잡고 본인 소개 김학선 리더쉽 항하 당당하다 소홀하다 배려 8일 지루하다 자세하다 빡빡 미국인 간다 마트 필요하다 생필품 구입 미국인 생생하다 생활 고맙다 과일 이름 색도 맛있다 과일 김학선 미국 가게 연락 51 8일 얼굴 상한 진짜 진짜 고생 이서진 임명 짝짝
미서부,서부 그랜드캐년 브라 이스 캐년 자이언 캐년 개성 캐년 직접 진리 토요일 복잡하다 유니버셜 스튜디오 짧다 뺑뺑 공기 잔소리 주시 곳곳 훌륭하다
미서부,서부 즐겁다 서부 즐겁다
미서부,서부 캐년 배려 감동 유럽 몇번 미국 미국 가슴 벅차다 감동 최고 만족 아들 단둘 추억 기쁨 행복 서부 뿌듯하다 숙소 불편하다 서부 행복하다 즐겁다 불쾌하다 경험 박수 짝짝 일일이 인원 숫자 파악 따갑다 햇살아래 막연하다 미국 유익하다 공부 미국 역사 대하 초대 대통령 현재 대통령 비하인드 스토리 재미 더하다 신나다 스케일 다르다 서부 배려 아들 행복하다 행복하다 기회
미서부,미국 서부 에드워드 서부 완정 정복 4월 5일 4월 13일 서부 대도시 캐년 에드워드 최고
미서부,서부 고민 가세 사진 수정 미국 서부 8일 기대하다 즐겁다 유익하다 첫날 공항 일주일 백승 만남 샌프란시스코 시가지 드라이브 금문교 멋있다 해질녘 분위기 북극 레이크 타호 호수 화창하다 울창 나무 사이 미티 국립공원 골드러쉬 역사 캘리코 은광 멋지다 화려하다 라스베가스 야경 자연 흠뻑 캐년 날씨 덩달아 기분 캐년 그랜드 캐년 풍경 평생 관경 8일 즐겁다 행복하다 버스 주변 지역 풍습 시사 경제 역사 자세하다 백승 미국 역사 단순하다 이해 배려 불편하다 숙소 깨끗하다 음식 즐겁다 번은 동부 서부 적극 추천 고민 샌프란시스코 명물 금문교 어둑어둑하다 사진 분위기 아름답다 버스 백승 미국 역사 다양하다 샌프란시스코 노래 기억 남아 레이크 타호 유랍선 바깥 풍경 유람선 경치 멋있다 빼곡 나무 사이 풍경 멋있다 유랍선 샌드위치 외국인 계시다 이제야 미국 실감 레이크 타호 관람 단독 선택 신의 짝짝 캐년 레이크 타호 즐겁다 사진 풍경 2시간 설원 풍경 진보 미티 국립공원 핵심 미티 폭포 실제 폭포 기억 명소 미티 국립공원 주변 풍경 멋지다 폭포 끊임없다 장관 생생하다 라스베가스 벨라지오 분수 라스베가스 노래 분수 시작 주변 무지개 라스베가스 아름답다 활기차다 도시 라스베가스 추억 라스베가스 야경 멋있다 불빛 화려하다 도시 브라 이스 캐년 캐년 하나로 섬세하다 돌탑 사진 자연 아름답다 감상 명소 엔텔 로프 캐년 입구 입구 섬세하다 캐년 나볼 바위 작다 관광 기분 천장 통해 햇볓 반사 동굴 기억 캐년 관람 그랜드캐년 기억 여행지 세트 멋지다 실제 지평선 캐년 까마귀 사진 까마귀 그림 사진 실제 예술 추천 캘리코 은광 아름답다 하늘 고스트 타운 일부 구름 맑은 날씨 은광 상점 서부 느낌 낭낭 영화로 배경 기분 버스 중간 중간 미국 마켓 사진 제철 과일 판매 소소하다 마켓 과자 과일 사서 버스 입도 즐겁다 즐겁다 미국 서부 날씨 대부분 겨울 대요 마국 서부 즐겁다 행복하다 추억 남아 8일 추억 서부 백승 서부 추천
미서부,서부 만족하다 백승 개인 학교 서울 남아 서부 샌프란 국내선 이동해 합류 신나다 즐겁다 유쾌하다 과정 도움 주신 홍준 인사 백승 재밌다 중간 중간 자료 영화 음악 경치 조화롭다 즐거움 레이크 타호 캐년 부모님 모시 즐거움 즐거움 상세 기억 세심 신경 백승 진심
미서부,계절 특별 즐겁다 서부 하와이 먼저 서부 일주 8일 수고 우정 수고 아무나 서부 힘드다 여정 재밌다 샌프란시스코 레이크 타호 캐년 포인트 유니버셜 스튜디오 짧다 완주 고행 하와이 회사 동기 친구 가족 무사하다 12일 일상 복귀 기억 시끄럽다 동갑 내기 손님 건강하다 어마어마하다 평생 추억 하와이 다짐 서부 계속 연발 대륙 어마어마하다 스케일 정점 그랜드 캐년 포인트 인정 선택 경비행기 야하다 포인트 공항 배웅 주신 우정
미서부,최고 순간 서부 8일 12월 25일 크리스마스 무술년 새해 1월 1일 의미 서부 캐년 전체 날씨 맑은 하늘 인하다 자연 경관 말로 표현 훌륭하다 장시간 버스 미국 역사 생활 문화 유머 재치 넘치다 지루하다 1일 인천 무사하다 샌프란시스코 버스 먼저 규모 상당하다 샌프란시스코 시청 미국 선상 부두 영화 더록 감옥 절대 탈출 불가하다 인파 짧다 미국인 생활 영화 자주 랜드마크 문교 철재 다리 유명하다 다리 수백 가닥 와이어 지탱 당시 기술 놀랍다 첫날 저녁 피곤하다 맥주 한잔 2일 맑은 날씨 버스 끝없다 들판 자유롭다 한우 불쌍하다 점심 유명하다 버거 모하비사막 사막 보관장 소로 활용 유태인 지혜 경의 미크 국립공원 압도 자연 휴식 공간 따름 3일 바스토우 아웃렛 쇼핑 은광 서부 개척 시대 흔적 확인 황량 미국 원동력 라스베가스 말로 영화로 라스베가스 직접 와우 라스베가스 시내 전등 자부심 온통 카지노 천국 시티투어 음악 분수 베니스 곤돌라 마르코 광장 천장 신기하다 거기 아이스크림 구경 주위 뉴욕 도시 복사 건물 미니어쳐 무크 자유 여신 파이 스테이 빌딩 에펠탑 4일 자이언트 캐년 브라 이스 캐넌 신세계 느낌 케납 스테이크 5일 서부 하일 라이트 그랜드캐년 대단하다 이해 환상 경비행기 지구 나이 변화 말로 표현 힘드다 위대하다 엄청나다 경관 압도 경비행기 광경 인생 최고 순간 미국 의문 라서 가시거리 16 눈앞 날씨 미세먼지 저녁 남아 아울렛 와이프 쇼핑 어제 카지노 몆번 숫자 와이프 가량 다행 경험 6일 곰탕 헐리웃 거리 손도장 확인 이병헌 안성기 손도장 여러 유명하다 스타 흔적 개인 출장 유니버셜 스튜 변하다 입장료 45 백투더퓨쳐 죠스 터미네이터 인파 트랜스포머 쥬라기 공원 해리 포트 워킹 데스 좀비 드라마 코스 경험 좋아하다 무섭다 재미있다 싱글 라이더 차원 다르다 만족도 저녁 삼겹살 갈비 맥주 아쉬움 7일 작별 공항 체크 면세점 쵸콜렛 사고 인천 무사도 착하다 지난 몆번 서유럽 동남아 3년 특별하다 경험 탁월하다 선택 25년 만남 즐겁다 항상 건강하다 만남 결실 피곤하다 인생 경험 실화 영원하다 소중하다 추억 무형 자산 여지 미래 2018년 새해 무술년 새해 대박 금문교 세비 국립공원 라스베가스 그랜드캐년 유니 버셜 스튜디오 해리포터
미서부,감동 여운 서부 여유 여유 길다 행복하다 즐겁다 예약 당일 친절하다 상담 여행지 친절하다 안전 운전 기사 노랗다 선택 만족감 아들 해외여행 추억 아들 박일 해박 지식 지루하다 유머 감각 다년 미국생활 정보 공유 계획 상당하다 도움 그랜드캐년 규모 경관 놀란 표정
미서부,서부 김학선 스페인 서부 고민 서부 택했다 고생 만족도 높다 선택 일조 결정 엄청나다 거리 버스 심신 미티 국립공원 캐년 자이언 브라 이스 그랜드 장관 누적 피로 기적 부분 개인 자이언 캐년 장관 브라 이스 캐년 그랜드 캐년 프란시스코 시작 로스엔젤레스 마직막 방문 비버 스튜디오 인산인해 스튜디오 버스 승차 80분 소요 지루함 버스 승차 다이내믹 어드벤처 소리 여정 한결 현장 리드 학선 추억 고생 기억 지면 통해 고마움
미서부,서부 박일 행복하다 최선 다해
