country,cleaned_sentences
라오스,라오스 1일 2014년 3월 28일 금요일 뉴욕 타임즈 야하다 넓다 지하자원 풍부하다 50 60년 간직 추억 산업 관광 산업 의존 내륙국 인도차이나 반도 중심 미얀마 태국 캄보디아 베트남 국경 이러하다 라오스 작다 상념 조각 미지 기대 설레임 매력 복잡하다 도시 탈피 순수하다 자연 동화 힐링 라오스 인원 37 인원 혈기 왕성 청춘 중후 자랑 중장 년층 분리 호팀 기내식 왓따이 국제공항 19시 15분 인천 015 싫다 진에어 승무원 복장 활동 편하다 청바지 셔츠 머리 진에어 상징 나비 모양 신선하다 참신하다 기내식 5시간 30분 비행 고속버스 터미널 크기 라오스 비엔 티엔 왓따이 국제공항 시차 2시간 빠르다 나오니 컴컴하다 어둠 후끈하다 라오스 열기 김현동 버스 10분 거리 라스트 여장 넓다 에어콘 빵빵 깨알 정보 바람막이 잠바 기내 싸늘하다 저가 항공 이기 담요 판매 1만 5천원 간식 저녁 오렌지 쥬스 지불 기내식 부실하다 비엔 티엔 배고프다 2일 3월 29일 토요일 앙프 라스트 아침 식당 풍경 호빠깨우 빠뚜 사이 조각 공원 소금 마을 탕원 유원지 점심 오후 방비 호빠깨우 왕실 원인 호빠 에메랄드 불상 시기 사원 태국 전쟁 인하다 약탈 당하다 현재 불상 프랑스 재건 푸른 나무 즐겁다 초기 크메르왕국 불상 6840 부처 신혼부부 웨딩 촬영 빠뚜 사이 1958년 프랑스 독립 기념 프랑스 개선문 모방 계단 꼭데기 범벅 시내 한눈 망하다 즐거움 만끽 불상 공원 비엔 티엔 40분 소요 힌두 불상 조각 공원 벌레 합창 소리 인하다 열대지방 실감 공원 한눈 망하다 입구 계단 좁다 허리 어렵다 라오스 화장 문화 이기 사망 뿌리 주로 루앙프라방 방비 빡세 소수민족 크게 룽족 70 지대 구릉지 거주 퉁족 20 쑹족 주요 수출 품목 목제 커피 전기 주석 수출 소금 마을 버스 려고 서울 사탕 동이 예전 바다 육지 변하다 땅속 지하수 가해 소금 100 천일염 짭쪼름 구수하다 일품 남능강 탕원 유원지 가득 음식 선상 중식 대나무 밥통 찰밥 젓가락 찰기 강하다 대나무 밥통 라오비 탕원 유원지 한지 2시간 휴게소 시원하다 아이스크림 방비 무수 고무나무 즐비하다 스스로 먹이 저녁때 거리 도로 발견 흡사 인도 바라나시 연상 4시간 소요 방비 여행자 거리 중심 롱낙콘 널찍하다 에어콘 빵빵 시원하다 롱낙콘 저녁 맛있다 삼겹살 저녁 상추 삼겹살 저녁 삼겹살 옵션 맛사지 친후 여행자 거리 유럽 배낭 수영복 활보 젊다 청춘 흔하다 게스트 하우스 술집 음식점 노점상 넘치다 여행자 거리 음식점 깨알 정보 여행자 거리 열대과일 쥬스 가격 과일 넉넉하다 3일 3월 30일 일요일 옵션 롱테일 보트 몬도가네 아침 시장 동굴 동굴 볶음밥 닭꼬치 구이 점심 오후 래프팅 체험 옵션 버기카 블루라군 종일 물놀이 샤워 친후 저녁 구수하다 갈비 김치찌개 마무리 롱테일 보트 아침 6시 30분 라비 쏭강 일출 보트 신선하다 정글 향기 가슴 깊이 쏭강 거슬러 고산족 아낙 빨래 음식 냄새 솔솔 식욕 바닥 투명하다 빛과 병풍 돌산 부드럽다 작다 산들 즐겁다 일명 계림 적격 지상 낙원 몬도가네 아침 시장 지인 아침 시장 열대과일 온갖 신선하다 재료 즐비하다 원시 짐승 온몸 오싹하다 물건 아줌마 아침 대나무 밥통 찰밥 젓갈 나물 소박하다 아침 행복하다 표정 찰밥 덩어리 나물 여인 진하다 열대과일 보따리 동굴 동굴 코끼리 코끼리 머리 종교 성지 유명하다 농토 촌가 주변 어미 병아리 귀엽다 방비 시골 정취 흠뻑 작다 동굴 부처님 불상 불상 코끼리 입구 왼쪽 베트남 전쟁 당시 포탄 껍데기 동굴 수중 동굴 입구 동굴 안쪽 연결하다 구명조끼 튜브 머리 헤드 랜턴 밧줄 체험 거슬러 밧줄 갈수 재미 체험 유년 시절 진달래 물장구 짜릿하다 감동 동굴 크게 린다 튜브 슬리퍼 춘자 아지 최고 목청 웃음 컴컴하다 동굴 이색 체험 영원하다 동굴 체험 나니 점심 맛있다 가깝다 바게트 볶음밥 닭꼬치 구이 망고 수박 맛있다 점심 래프팅 체험 부부 뱃사공 절대 안전하다 아름답다 유유 저으 강가 물고기 조개 천진난만하다 어린이 만날 신선 놀음 옵션 관광인 버기카 블루라군 종일 물놀이 저녁 갈비 김치 찌게 깔끔하다 정리 깨알 정보 몬도가네 아침 시장 열대과일 사기 점심 과일 산다 과일 시장 입구 상점 저렴하다 동굴 동굴 먼저 수중 동굴 동굴 탐험 동굴 시골 원두막 넓다 장소 구명조끼 해드 랜턴 아쿠아 방수 중요하다 현금 여권 본인 아쿠아 비닐 방수 본인 나머지 모자 선크림 방수 최소한 차림 동굴 튜브 탐험 궁둥이 튜브 동굴탐험 점심 마르다 점심 방수 래프팅 일부러 뿌리 상의 방수 무릎 무방 4일 3월 31일 월요일 젓갈 마을 몽족 마을 한식 점심 부처님 사리 안치 탓루앙 사원 비엔 티엔 시내 버스 재래시장 달랏 사오 백화점 건강 식품 가게 므앙 사원 대통령궁 외관 챠오 아누 공원 뷔페 만찬 야시장 공항 젓갈 마을 비엔 티엔 길목 젓갈 마을 흔하다 건어물 가게 가격표 건어물 물소 인상 몽족 마을 젓갈 마을 15분 거리 몽족 자비롭다 과자 라오스 차별 정부 지원 소외 탓루앙 사원 라오스 상징 이자 부처님 사리 안치 황금 사원 비엔 티엔 시내 비엔 티엔 시내 진입 한식 점심 탓루앙 사원 버스 시내 재래시장 달랏 사오 백화점 주변 포진 달랏 활기차다 의류 짝퉁 가게 생활용품 먹거리 완벽하다 구비 사은 노니 연두색 비닐봉지 건강 식품점 석청 세관 검다 생강 건강 식품 가게 라오스 특산 석청 검다 생강 일등 여러 건강 식품 검다 생강 태국 산악 지역 생산 특산 인삼 사포닌 생강 은은하다 므앙 사원 신성하다 바위 부처 사원 세월 담장 마리 작년 대통령궁 챠오 아누 공원 대통령궁 맞은편 공원 산책 운동 여유 만날 흥화 건설 메콩강 방죽 조성 아누 동상 메콩 강변 석양 감상 태국 메콩강 야시장 의상 가방 신발 액세서리 다양하다 구비 메콩강 방죽 조성 노천 시장 외국인 호객 행위 둘러보기 편리하다 만찬 야외 식당 뷔페 야시장 공항 이동해 귀국 절차 016 1시간 연착 12시 40분 기내 5일 귀국 에필로그 열악하다 환경 순박하다 맑은 미소 라오스 순수하다 여행자 천국 다이나믹 체험 힐링 원하다 적극 추천 궁금하다 식당 나쁘다 호사 누리 18 45 인승 버스 배려 유정 옵션 관광 불참 전혀 내색 김현동 전하 고맙다 깨알 정보 재래시장 달랏 사오 지하 짝퉁 가방 물건 70 깍아 춘자 아지 45 가방 20 50 가방 16
라오스,라오스 최고 추천 라오스 다양하다 추억 기억 친절하다 라오스 가시 지오 복지 약국 의료 본인 직접 코코넛 안쪽 섬유질 부분 면서 민간요법 이외 가끔 무리하다 부탁 친절하다 보조 라오스 가시 지오 추천 편안하다 즐겁다
라오스,라오스 이바 불교 희다 교가 불상 공원 라오스 이바 불교 희다 교가 불상 공원 조용하다 자동차 경적 엄는 수도 비엔 티엔 교차로 사거리 신호등 엄는 작다 만하 정적 도시 느낌 프랑스 식민 생활 여파 붉다 도복 스님 부채질 엄따 유럽 조그만 도시 방문 유럽 물씬 도시 점심 30 여분 방문 불상 공원 불교 희다 합성 공원 1958년 루앙 분르 쑤리랏 조각가 건축 무앙 불상 공원 부다 파크 공원 우주 기지 건축물 구분 우릴 깜깜 미로 가파른 계단 지옥 연옥 극락 계단 궁뎅 계단 해석 지옥 연옥 극락 구분 꼭데기 한눈 불상 공원 불교 문화 쪼메 다르다 부처님 거리 파마머리 인자 눈매 어깨 귓밥 부다 신성 스럽다 라오스 부처님 꼬깔 모자 머리 순례 스님 인도 희다 파괴 쉬바 신도 마리 코끼리 부릎뜨 주시 신들 파괴 로움 탄생 창조 쉬바 이기 희다 가능 인간 희노애락 싸움 평화 상징 불상 희다 창칼 인간 무서움 닥아 무서움 인간 느낌 남대문시장 재기 라오스 달라 전통 시장 에어컨 뻥빵 현대 건물 라오스 재래식 물건 살수 노점 파리 거리 건물 현대 과거 공존 느낌 현대 건물 휴게실 카푸치노 커피한잔 칭구 뱀술 현대 상점 자랑 제품 파리 거리 육식 이름 물고기 판매 가판 갖가지 동물 팔고 온갖 열대 조류 엄는 야채 한편 갖가지 전통 라오스 치마 라오스 전통 치마 웅장 가게 가게 생계 가게 작다 행복 미소 시장 시장 빠뚜 사이 개선문 60 프랑스 식민지 독립 기념 개선문 실제 빠리 개선문 흉내 프랑스 빠리 개선문 맹그렀 리제 거리 모양 거리 대통령 연결 리제 거리 저녁 지식 닭고기 숯불 구이 탕수육 새우 생선 땀막홍 파파야 셀러 짙다 야채 안남미 맥주 1만 수가 사서 제법 이름나다 비어 라오 귀가 길거리 과일 가게 과일 산다 망고 망고 스틴 마늘 과일 2만 4만 대략 6500원 산다 샤워 깜깜 식당 저녁 과일 마늘 모양 망고 스틴 마딧따 망고 맜있었 망고 스틴 맛있다 마늘 모양 망고 스틴 아열대 과일 취해 저녁 잔뜩 과일 잠자리 컴앞 망고 스틴 쌔롱 쌔롱 멀다 방화동 서당 훈장
라오스,라오스 이바 신선 수염 쾅시 폭포 정신 넝감탱이들 라오스 이바 신선 수염 쾅시 폭포 정신 넝감탱이들 프랑스 식민 생활 익숙하다 라오 빠게트 스테이크 어느새다 유럽 라오 스테이크 점심 반대 삼겹살 한식 돈까스 스테이크 유명하다 쾅시 폭포 신선 수염 신선 수염 폭포 이름나다 쾅시 폭포 농장 농장 기념품 여인 활짝 사진 부탁 반하다 미소 엄꼬 미소 활짝 미소 그립다 입구 갖가지 기념품 갖가지 먹거리 알수엄는 조류 통째 야만인 폭포 100 점핑 탈의실 몇개 배낭 반바지 점핑 옥빛 에메랄드 발하랴 옥빛 물속 풍덩이 입가 금은 미소 부러 대신 칭구 꼬득임 타잔 칭구 수가 용감하다 능걸 용기 점프 먼저 칭구 강남 훈장 증말 몬뗀넘이네그랴 22 엄시 풍덩이 증말 정신 할배 그랴 손주 정신 홀랜드 네델란드 서서 이바 칭구왈 푸념 병아리 소릴 리버 점프 입가 미소 청춘 시절 가트 즐거움 폭포 산이 328 계단 숨결 치면 낮다 산이 인도 맥스 투파 붓다 최초 설법 장면 뭣땀시 도저히 엄따 도중 사당 기도 라오 지지 배랑 잘생기다 달라 기도 지배 가트 메콩강 형성 루앙프라방 전경 루앙 한눈 맞이 석양 멋지다 생활 우리네 석양 사치스럽다 이국 정취 석양 리도 감격 하니 우기 구름 사이 비치 햇살 멋지다 석양 엄섰따 숙연 푸시 산이 넘치다 가닥 석양 희망 북적 인종 전시장 저녁 곧바로 몽족 야시장 베트남 전쟁 당시 미국 하나로 깊다 산속 피신 몽족 정부 도움 자립하다 땅거미 자동차 오트바이 달리 도로 30분 돼지 시장 형성 여개 점포 가판 대가 줄줄이 호객 엄시 입가 우릴 하늘 남아도 시장 벌써 여개 천막 복잡하다 시장 형성 일종 순대 라오 음식 바나나 구어 라오스 빠게뜨빵 야채 닭고기 생선 대용 15000 2000원 물건 손수 노코 바느질 직접 거실 신발 쓰렛빠 인지 저녁 라오 주식 까오 삐약 일종 쌀국수 증말 썽질나 지배 대답 사지 손님 빠이 라오 베알 구심 간다 피자 밀가루 땅콩 이상하다 과일 고기 야채 김밥 저녁 충분하다 이조 돼지 물건 가격 물어 입가 찬음 엄따 헤맑 미소 우리네 살벌하다 대조 손수 공예품 바가지 상흔 엄는 순수하다 밤새 상술 행복 누리 부럽다 내일 꼭뚜 새벽 탁발 땜시 일찍 잠자리 간다 옆방 묵꼬있는 부부 도마뱀 침대 메트 기겁 파리 모기 타일러 거짓말 능거 도마뱀 유익하다 동물 틀림 엄능것잉께 있으몬 모기 엄승께 편하다 심심 찬케 기어 도마뱀 내일 탁발 쵸코렛 15000 대략 사서 고온 싸인 다스 잠자리 스님 공양 싸인 쵸코 양품 음식 일상 필요하다 물건 공양 엄따 현찰 박치기 현찰 방화동 서당 훈장
라오스,라오스 이바 방비 아침 동양화 라오스 이바 방비 아침 동양화 꼬끼오 울음 소리 붉다 산등성이 방비 아침 자락 마을 지붕 수줍다 살포시 안개 감탄 김종환 노래 사랑 맴도 풍경 강변 강변 계곡 계곡 지붕 지붕 안개 정취 흠뻑 신선 노닐다간 동양화 그림 6시 식당 베트남 말로 아가씨 솜땀 우동 까오 삐약 국수 잡채 쌀국수 계란 라이 마주 치자 합장 우릴 맞이 5000 900원 백화 수복 맥주 1500원 강가 마련 탁자 아침 7시 허락 김치 솜땀 면발 굵다 우동 쫄깃하 마딧따 솜땀 우동 까오 삐약 잡채 국수 솜땀 쫄깃하 마딧꼬 까오 삐약 솜땀 쫄깃 닭고기 단백 마딧따 취향 향료 젤로 왼쪽 고춧가루 양념장 좋트 야하다 젤위 사각 그릇 채소 일종 허브 종류 싫드 아침 29일 식당 솜땀 우동 사진 식당 환대 아름답다 미소 동굴 메콩 쏭강 동굴 탐색 물위 동굴 튜브 동굴 탐색 동굴 현대 자동차 포터 개조 미니 버스 산비탈 종류 식물 나무 한그루 기생 특이하다 나무 수엄시 이름 하야 싼썀 나무 먼저 동굴 길목 몬도가네 새벽 시장 옛날 새벽 반짝 시장 새벽 시장 개념 죙일 갖가지 동물 물고기 박쥐 족제비 황소개구리 이름 벌레 전갈 다람쥐 고기 고기 원시 시대 새벽 시장 우기 이상하다 동물 엄딴다 쪼메 다르다 이름 몬도가네 시장 개고기 서양 야만인 취급 당하다 식생활 라오 몬도가네 시장 야만인 야자 도끼 직접 판다 야자 라오 미소 메기 산소 공급 기도 엄는데 도데 라오스 싸움 어케 라오 카약 간다 20분 산아 조그만 마을 다리 건너 테일 모터 보트 샛강 오솔길 짐승 침입 설치 두렁 동굴 입구 라오 미소 우리네 정신 지체 장애자 저러케 증말 미소 라오스 점심 삼겹살 바베큐 마나 인정미 넘치다 우릴 저러케 낮다 튜빙 물살 제법 쎄다 튜브 부산 광안 해수욕장 죙일 관록 튜브 헤드 랜턴 로프 굴속 종류 기어 벌레 박쥐 보이지 머리 부딫칠까 염려 동굴 자갈 우기 물이 불어 입구 대략 10 제일 낮다 포복 머리 지붕 부딫친다 증말 천평 코메디언 몬들어 낮다 포복 나니 하얗다 반바지 노랗다 황토색 바지 뒤로 쌩쥐 모양 동굴 코끼리 동굴 굴속 석상 코끼리 모양 이름 동굴 탐험 나오니 삼겹살 바베큐 파티 누러케 변색 된거 반바지 간다 욜씨미 괴기 고기 꾸버주 삼겹살 빠겟뜨 빵맛 환상 쌀밥 열대과일 처려진 밥상 게글스레 모양 마딧 점심 가트 라오스 막스 카약 오전 동굴 차림 카약 간다 칭구넘 설레다 선뜻 칭구넘 호흡 카약 난생 카약 기대 동굴 탐색 반바지 카약 2시간 동심 아프다 노저 입구 카약 기대하다 오전 간다 라오스 첫날 우짜 꼬득 불루 하자 마지못하다 선택 관광 참여 신혼 살림 채린 부부 불루 지도 선택 관광 신청 신청 젤로 에메랄드 포츠 어제 폭포 점핑 차원 다르다 좀더 높다 스릴 넘치다 선봉 대부분 점핑 점핑 못했드라 앙꼬 엄는 찐빵 표현 담날 아침 20 만원 비싸다 잠자리 불루 이바 부러 가득하다 억울 허무하다 억울 농부 갓길 서산 샤워 삼겹살 한식 식당 간다 한식당 방비 그림 북적 온통 한글 투성이 낙서 유러 피안 라오 한잔 방비 방화동 서당 훈장
라오스,라오스 이바 루앙 사원 왓파깨우 메콩 강변 야시장 라오스 이바 루앙 사원 왓파깨우 메콩 강변 야시장 비엔 티엔 조그만 마을 마을 장엄하다 건축 기술 엄따 전율 인도 차이나 반도 가파른 지붕 건물 형태 사원 부처님 갈비뼈 보존 위대하다 불탑 이름 라오스 랜드마크 대변 루앙 사원 이사원 맹그런 셋타티랏 동상 황금색 사원 500 라오스 65 불교 건축 형태 캄보디아 이슬람 희다 문명 전쟁 상흔 고스 남아 아프다 사원 16 세기 셋타티랏 맹글었 세기 인도 불교 전도 승려 부처님 갈비뼈 조각 사원 건립 사원 주탑 45 85 회랑 사면 정사 회랑 다르다 다해 가슴 입구 계단 부처님 갈비뼈 희다 루앙 납골당 형성 불상 매년 11월 동네 므앙 승려 루앙 축제 하단 축제 이바 라오스 11월 우기 수확 계절 축제 번제 낭시 처녀 애기 처녀 임신 죄목 제물 낭시 탓루앙 축제 낭시 축제 할멈 낭시 축제 참석 왕실 사원 왓호파 사원 셋타티랏 루앙 프라 비엔 티엔 수도 천거 기념 인도 대부분 사원 신발 양말 입장 사원 450 에메랄드 불상 간직 태국 왕국 침략 파괴 불상 현재 태국 왕실 박물관 진열 수많다 전쟁 수난 상흔 80년 프랑스 도움 재건 현재 사원 변신 우릴 근처 사원 종이 벽화 그림 눈부시다 진열 6800 여개 불상 어쩜 엄는 불상 저걸 일일이 은제 토기 구성 6800 여개 각기 모양 맹그러 당시 조각 기술 능력 가늠 힘드다 태국 샴왕국 파괴 1935년 재건 사원 가득 불상 집중 참으로 대단하다 사방 팔방 6800 불상 입구 향불 향로 오후 선택 관광 어깰 20 방이 건물 라오스 코스 비엔 티엔 야시장 메콩 강변 노점 야시장 사이 태국 경계 아누 동상 건너 태국 뚝방 시민 오트바이 오트바이 지껄 워찌 가족 야시장 라오스 태국 화해 아누 동상 건너 태국 둑방 건강 에어로빅 강사 매일 해질무렾 시민 저러케 에어로빅 봉사 인사 하니 메아리 저러케 아름답다 미소 엄섰따 지지 수루 경상도 부산 말로 오징어 수루 구이 장사 손님 마리 달라 부채질 입구 갖가지 호기심 자극 라오 여인 외국인 라면 우쨋떤 바가지 상흔 바가지 외국인 물건 동일하다 라오스 길거리 포장 마차 한잔 괴기 고기 하몬 리도 손짓 호객 행위 호객 생활 행동 라오스 라오 민속 디너쑈 우릴 대접 캄보디아 압살 민속 인도 카주라호 민속 라이 겨자 내용 캄보디아 압살 머슴애 뚠레샵 호수 배경 고기 청혼 장면 인도 라이 겨자 민속 글자 겨자 청춘 남녀 결혼 과정 연출 라오스 청춘 남녀 과정 결혼식 모던 축복 황혼 결혼 생활 표현 어느새다 내용 축복 라오스 마딧는 훌륭 영원하다 추억 라오 레스토랑 화려하다 공항 번화가 식당 줄줄이 지붕 가게 테이블 노천 영업 식당 고기 마을 고기 냄새 진동 길가 탁자 까오 삐약 부부 5일 라오 이바 구들 할멈 서당 식구 어깰 이바 보따리 공항 간다 방화동 서당 훈장
라오스,라오스 이바 승려 탁발 라오스 이바 승려 탁발 커텐 한밤중 커피 너머 리치 빗방울 하필 이면 푸념 탁발 거룩하다 사이비 어린시절 편견 뇌리 탈피 이념 철학 이해 넓다 70 가까이 연륜 종교 상반 이단 기독인 불심 신청 신청 일일이 사서 대나무 도시락 쌀밥 증말 마딧따 꼭뚜 새벽 지인 판매 자리다 칭구눈 피해 증말 마딧 도마뱀 기겁 칭구 수가 스님 둘리 길다 양주 인지 지인 대부분 참여 드뎌 행렬 시작 나눔 공존 형성 즈음 스님 풍족하다 가타 나로 덩달아 기쁨 양품 소쿠리 비스켓 과자 파능걸 사서 공양 워메 바뿌 바쁘다 싸인 공양 찰밤 현찰 두루 찰밥 줄때 스님 싸인 현찰 줄땐 지둘렸다 분도 건너 뜀엄시 멀다 5천 대략 900원 천막 공양 스님 맨발 승려 날씬하다 체구 뚱뚱하다 스님 엄따 괴이 음식 승려 음식 대부분 몽족 승려 음식 식구 전체 탁발 탁발 다해 탁발 양품 멀리 스님 나눔 공존 부족함 엄는 입가 미소 살벌하다 불행 스님 권리금 교회 사찰 사고 현실 철학 내일 지구 한그루 사과나무 스님 한잔 노코 마주 뒤로 새벽 재래시장 6시 자리다 시작 마다 부엌 나무 아열대지방 나무 마르다 나무 다가 판매 죽순 배추 먹듯 어김엄시 죽순 손질 마나 미소 미소 카메라 핸는데 멍석 갖가지 생선 야채 과일 즐비하다 온갖 몽땅 떨이 2만원 가게 길가 우릴보 하이 미소 애처롭다 기보 충족 부럽다 몽땅 떨이 1만원 7만 밀납 벌집 저걸 입가 미소 듬뿍 물건 내뿜는 맘씨 고스 바나나 라오 식품 프랑스 식민 부산물 비치 비참하다 산소 공급 기도 엄시 쏭강 고기 물건 도데 밑천 발가락 고무 쌘달 카메라 짖궂다 썽질 커녕 웃음 해주 아줌마 이뿌다 알맞다 바나나 김밥 오른쪽 노코 팔고 간이 마딧따 1500 210원 라오스 채용 허락 쌰이싸 아침식사 사서 간이 마딧따 양배추 붉다 옥수수 쪽파 판매 야채 아지 매도 발구락 쌘들 가격 흥정 쓴웃음 금고 즉석 순대 공장 공장장 모양 깨끗하다 맨발 이아 자씨 맨발 손님 맨발 물건 예쁘다 쌘들 신고 캐온 운지버섯 야릇하다 이나 야채 냉채 라오 간다 동물 내장 고기 아예 점포 구성 빠게뜨빵 풍기 문란 어데 손님 훌러덩 망하다 가트 마딧는 망고 저러코롬 일종 잡체 종류 빵가루 비유 그랴 똥그 석쇠 조류 구이 동물 부위 비닐봉지 조류 모퉁이 진열 무덥다 지방 냉장 보관 판매 비위생적 엄따 증말 비위생적 몬도가네 육류 판매 제법 규모 노점 부로 컬리 쪽파 깻닢 종류 잎사귀 원뿔 형태 꽃장식 파흐흥 집안 송진 부살 왼쪽 부분 길다 나무 막대 집집 가게 마련 기도 새벽 시장 아침 간다 라오 주식 까오 삐약 우동 종류 쫄깃 마딧따 이조 도로 정이 열악하다 교통 수단 카약 도시 방비 가기 아침 8시 5분 250 8시간 라오스 동양화 마을 꼬불 꼬불 1000 고개 지그 재그 어깰 부딫치 난이 시속 40 보지 풍쿤 휴게실 우릴 아름답다 소개 사진 사진 박아 그러케 아름답다 엄따 잔뜩 뿌엿키 잔뜩 다리 뻑적 다리 간단하다 스트레칭 달레 기지개 해발 1300 고지 휴게실 맞이 지식 점심 휴게실 마스코트 빗속 이채 아름답다 평화롭다 몽촌 마을 원래 풍쿤 마을 매일 매일 도중 몽촌 볼펜 학용품 학교 건물 제법 산지 화전민 초가 지붕 라오 숭족 마을 초대 방문 실내 한쪽 화장실 볼일 청소 계단 넓다 이집 양철 지붕 부엌 장작 부엌 이불 그랴 이불 엄네그랴 겨울 엄승께 이불 필요 능걸 1400 지대 마을 학교 개월 여름 방학 중이 대부분 라오 숭족 높다 야생동물 침범 학용품 일용품 다주 쪼메 상점 과자 몽땅 사서 1960년 가면 휴게실 살림 댕기 자동차 마을 편의점 역활 두루 제법 세탁기 오붓하다 행복 넘치다 가정 멀다 강물 대나무 노아 참게 팔고 생포 조류 팔고 1500 고지 물자 인간 인정 넘치다 복되다 25 아파트 현재 포기 짜장면 배달 알바로 궁금하다 지그 재그 야하다 방비 지대 산악 길이 방화동 서당 훈장
