country,cleaned_sentences
미서부,서부 10일 신혼여행 서부 선택 선택 아름답다 캘리포니아 자연환경 샌프란시스코 도시 날씨 선선 휴식 대고 설레다 느낌 푸른 아름답다 품격 부탁드리다
미서부,서부 김학선 큰딸 대입 수능 계획 가족 부로 정해 여기저기 검색 서부 선택 개인 선택 자유 정이 포함 주요 도시 캐년 경험 장점 우린 옵션 선택 자유 크게 선택 관광 도심 숙소 라스베가스 이틀 저녁 개인 자유 나름 피자헛 피자 파파이스 치킨 맛있다 우린 행복하다 김학선 상세 한몫 자유 프리미엄 아울렛 쇼핑 왕딸 큰딸 작은딸 나름 작다 즐거움 자연 예술 작품 캐년 미국 캐년 감상 어림 직접 도중 버스 통해 일출 일몰 일출 일몰 산도 바다 지평선 시골 마을 캐납 저녁 식당 노래 미국 아르바이트 소녀 노래 나름 정겹다 자체 캘리코 은광 정부 은광 토벌 작전 예정 즐겁다 공짜 미티 국립공원 점심 도시락 별미 바위 폭포 도시락 먼저 단연 도시락 맛있다 시원하다 유람선 관광 30 여분 직접 금문교 도보 차별 현장 체험 코스 나름 기억 헐리우드 2019 봉준호 감독 기생충 타국 대한민국 자긍심 코스 유니버셜 놀이 8일 피로 워터월드 대박 즐거움 자체 한몫 김학선 결정 10년 차이 연배 막내 동생 조카 친구 관련 유의사항 당연하다 날씨 옷차림 숙소 상세 이전 여느 기본 차별 무언가 태도 가족 정이 보통 서부 가족 거나 나이 적지 김학선 동생 때로는 조카 관심 사진 기본 어르신 와이파이 연결 직접 공항 체크 가족 중간 중간 해당 지역 관련 역사 에피소드 거리 영화 영상 볼거리 제공 깊다 노력 유익하다 경험 즐거움 수도 반감 수도 중요하다 행운 김학선 변수 우린 서로 행운 서로 배려 행복 아름답다 그림 건강하다 행복하다 소망
미서부,즐겁다 서부 김학선 지난 1월 29일 2월 5일 8일 비행 포함 10일 서부 진작 현실 복귀 작성 짙다 그리움 완벽하다 현실 결과 즐겁다 선택 평소 자유여행 어머니 모시 편하다 결과 선택 기본 대도시 제외 나머지 지형 렌트 이동해 풍경 운전 비교 짧다 기간 고루 여느 여행지 서부 효율 한가지 불만족 스럽다 확정 과정 임박 직전 최종 확정 계속 좌석 관련 나름 사정 친절하다 응대 여행자 입장 직전 계속 불안 직전 설레다 여유 구성 그간 경험 구성 알차다 단계 이정 저렴하다 비용 이보 알차다 서부 확신 해당 선택 결과 선택 큼직하다 전체 로스앤젤레스 공항 오전 라스베가스 관람 야경 라스베가스 불의 계곡 프리미엄 아울렛 자이언 캐년 브라 이스 캐년 캐납 엔텔 로프 캐년 그랜드캐년 경비행기 캘리코 은광 바스토우 아울렛 미티 국립공원 샌프란시스코 케이블카 유람선 금문교 도보 로스앤젤레스 유니버셜 스튜디오 장점 선택 자유여행 장점 선택 일부 선택 관광 개인 여유 참여 서부 빼곡 만족하다 일찍 마무리 자유 수도 자유 일반 자율성 전체 라스베거스 이틀 숙박 라스베거스 근방 불의 계곡 아울렛 방문 라스베거스 시티투어 카지노 번화가 쇼핑 자유 넉넉하다 첫날 오전 로스앤젤레스 공항 여유 중요하다 4일 캐년 알차다 5일 휴식 존재 전체 중국인 인지 기다림 미티 국립공원 여유 유니버셜 스튜디오 기다림 어트랙션 충분하다 라스베거스 샌프란시스코 로스앤젤레스 도시 구석구석 도시 광활하다 자연인 캐년 사이 대조 극적 샌프란시스코 도보 금문교 경험 유니크 경험 소중하다 추억 보통 행시 제시 불만족 부분 마련 부분 구성 사진 사진 정리 친절하다 구성원 서부 담당 김학선 운전기사 이름 알차다 즐겁다 비교 버스 재미있다 농담 가득 기억 중간 중간 서부 해당 지역 관련 재미있다 영상 감성 대부분 요구사항 필요 노력 경험 즐겁다 백방 노력 부분 좌우 절반 이상인 즐겁다 기억 길다 짧다 짧다 구성원 공항 인사 탑승수속 하필 달라 사진 한장 아쉬움 비교 젊다 친구 아쉬움 남고 여행자 분위기 즐겁다 만족스럽다 추억 안고 현실 의미 의미 고요 행운 행복 가득하다
미서부,서부 안녕하다 개인 좋아하다 이미지 예전 예능 머리 어딘가 이미지 항공사 업계 종사 자유여행 고집 소위 경험 통해 편하다 효율 무료 역사 강의 장점 인생 사춘기 대비 아들 소통 1년 번은 다짐 벌써 멀다 유럽 미국 가기 계획 멀다 기도 넓다 신랑 아들 제일 안전 아들 11 살의 다르다 인터넷 우연찮 저렴하다 가격 서부 발견 자유여행 예산 저렴하다 참고 항공권 저렴하다 직원 티켓 사용 가격 운전 안해 직접 모로 기대 이유 자유시간 새벽 일찍 일어나서 피곤하다 경험 부지런 원수 미국 유럽 렌터카 외국 운전 주차 보통 어렵다 차라 차감 베테 드라이버 계시다 미국 역사 재밌다 에피소드 본인 참으로 감동 감동 말씀 계속 뇌리 수가 공항 감동 음악 영화 감동 말씀 하이라이트 훌륭하다 공부 연구 안해 제일 좋아하다 단어 착하다 깊다 말씀 잘생기다 사진 후회 말솜씨 진짜 약속 배려 최고 눈쌀 행운 진심 베테 이신 최고 서부 통해 아들 소통 기대하다 넓다 세상 다양하다 경험 인종 안목 바램 저렴하다 가격 알차다 기획 멋지다 이미지 오래오래 기회 넓다 세상 최고 편안하다 안전하다 즐겁다 행복하다 건강하다 여행지 샌프란시스코 시청 39 금문교 미티 공원 리코 타운 라스베가스 베네시안 그랜드캐년 경비행기 엔텔 로프 그랜드캐년
미서부,재밌다 서부 부로 엄마 캐년 웅장 라스베이거스 화려하다 기억 김승범 중간 중간 해주시 친절하다 팀원 약속 철저하다 추천
미서부,재밌다 서부 부로 엄마 캐년 웅장 라스베이거스 화려하다 기억 김승범 중간 중간 해주시 친절하다 팀원 약속 철저하다 추천
미서부,폴킴 즐겁다 서부 무사하다 서부 미국 입국심사 설레다 즐겁다 여권 눈앞 깜깜 자칫하면 수도 당황 전화통화 해결 마법 김덕규 노력 신경 임시 여권 차질 죄송하다 무사하다 공항 스티븐 한님 성함 보지 죄송하다 임시 여권 발급 믿음직하다 김덕규 즐겁다 안전하다 서부 미국 방문 낯설다 불안하다 강조 김덕규 추억 역할 크게 작용 추가 구성 깔끔하다 만족스럽다 조식 특식 식도 만족스럽다 로프 캐년 추가 감동 인생샷 필요없다 사진 요새 미티 공원 미세먼지 가면 느낌 산림 기분 상태 조용하다 깨끗하다 넓다 가족 이상은 이면 노력 라스베가스 외관 기대하다 가족 만족하다 캘리코 치면 미국 서부 카우보이 민속촌 예쁘다 국적 기념품 얼른 인증샷 특식 옛날 카우보이 특이하다 만족스럽다 화려하다 라스베가스 재미있다 이벤트 즐겁다 카톡 프로필 배경 정신 캐년 감동 자이언트 캐년 음악 감동 경비행기 그랜드캐년 말로 표현 최고 로프 가세 비싸다 사진 작품 작품 배경 인생 가세 유니버셜 스튜디오 날씨 최고 볼거리 탈수 재밌다 놀이기구 간절 약하다 사진 보관 리지 상상 제생 최고 하와이 하와이 1년 최고 배려 도움 컷던 기억 추억 서부 하와이 거나 고민 이신
미서부,서부 음악 이미지 딱딱하다 재미있다 차량 디테 대자연 음악 기분 최대한 시차 유니버셜 기프트샵 할인 자고 힘드다 셨을껀데 30 통솔 수고
미서부,서부
미서부,서부 김학선 즐겁다 우린 몇개 월전 유럽 샤워실 하수 관련 정보 입실 세상 샤워 당연하다 하수 구가 시차 차이 적응 카페트 난리 아침 기진 맥진 체력 정신 극도 피로 이러하다 김학선 자세하다 섬세하다 감동 버스 지루하다 법도 헀는데 중간 중간 재치 유머 차내 항상 웃음소리 광활하다 대지 인디언 아프다 과거 주심 잔잔하다 울림 서부 캐넌 순수하다 여성 아름답다 살포시 자이언 캐넌 웅장 장엄하다 남성 매력 넘치다 브라 이스 캐넌 오묘하다 신비 엔탤 로프 캐넌 경험 보지 자연 미지 선물 그랜드 캐넌 마음속 깊이 뿜어져 황홀하다 감동 도취 눈속 저장 시리다 놀이 공원 고소공포증 놀이기구 보지 가상 체험 얼떨결 팀원 즐겁다 비명 소리 좀비 직원 얼굴 소리 민망하다 아프다 즐겁다 동심 만양 호호 유니버셜 스튜디오 인기 영화 소재 최고 테마 파크 선택 필수 강력 추천 서부 김학선 유머 열정 성실하다 총알 리도 인연 김학선 동부 김학선 가족 즐겁다 여운 길다 김학선 행복하다 즐겁다 선물 행복하다
미서부,9일 소중하다 친구 생기며 추억 서부 김학선 최고 중요하다 항상 가족 해외여행 여행지 소중하다 동갑 친구 생기 여동생 또래 생기 잘맞다 항상 즐겁다 인생샷 서로 정이 가족 끼리 휴식 또래 재미 휴식시간 추억 중후 부서 그날 정이 매일 구경 또래 3시간 기쁨 알람 소리 필요없다 새벽 나날 선명하다 캐넌 관광 평생 위대하다 강하다 유니 버셜 스튜디오 선택 관광 선택 필수 26 성인 또래 동심 마냥 기억 평생 어른 동심 즐겁다 미국 넓다 충분 관광지 깊이 한계 김학선 재치 유머 심심하다 순간 예능 프로보 재미있다 절대 방심하다 친구 동생 김학선 셀카 사진 대박 재미있다 볼떄 저절로 즐겁다 김학선 가족 사진 항상 연예인 사진 감동 41 꼼꼼하다 항상 안전 운전 성실하다 버스 기사 인생 멋지다 서로 배려 서로 멋지다
미서부,서부 김학선 11월 7일 9일 서부 여행가 기전 여행자 김학선 막상 반갑다 웠다 신경 재미있다 유익하다 말로 42 분한 참으로 감시 유익하다 분위기 인분 분위기 김학선 리더성 2007년 행시 통해 동유럽 시작 기회 김학선 인사
미서부,대반 설레다 서부 캐년 제일 기대 홀슈밴드 앤탈롭캐년 서부 홀슈밴드 앤탈롭캐년 옵션 거나 선택 탁월하다 선택 기억 개인 단연 홀슈 밴드 바탕화면 장관 눈앞 뿌듯하다 첫날 비행 기안 시작 근교 할리우드 거리 코닥극장 관광 크게 부담 근교 버스 김승주 정보 그나 문화 폭넓다 이해 계기 자유여행 아침 일어나고 낯설다 기도 친절하다 편하다 거기 기대 선택 모뉴먼트 밸리 지프 사막 지역 구동 지프 오프로드 기분 최고 모래바람 날씨 인생샷 그랜드캐년 경비행기 경비행기 멀미 나기 경치 대박 장관 멀미 대자연 장엄하다 멀미 그날 바람 영향 다르다 작다 인승 경비행기 승객 멀미 복불복 미티 국립공원 증기기관차 숲속 관광 산불 인하다 나무 검다 여전하다 아름답다 숲속 햄버거 풍경 바람 점심 폭포 트레일 하이킹 종일 아름답다 포인트 서부 주저 어서 고고 서부 신분 계절 다르다 이쁘다 기회
미서부,서부 캐년 와이프 해외여행 자유여행 주로 서부 캐년 지역 거리 길다 신청 공항 11시간 마중 버스 1일 관광 할리우드 거리 유니 버셜 스튜디오 관광 본격 관광 시작 정표 전체 시작 2일 라스베가스 3일 자이언 캐년 브라 이스 캐년 캐납 4일 글랜캐년 앤탈롭캐년 홀슈 밴드 모뉴먼트밸리 5일 세도 벨락 그랜드캐년 6일 오트맨 바스토우 베이커스필드 프레즈노 7일 미티 8일 버클리 샌프란시스코 8일 샌프란시스코 공항 13시간 거리 3700 캘리포니아주 네바다주 아리조나주 유타주 서부 장대 광경 즐겁다 거리 길다 피곤하다 전체 정이 짜임새 선택 관광 추가
미서부,만족하다 서부 캐나다 9월 27일 10월 13일 15 17일 캐나다 동부 서부 길다 즐거움 행복감 만족 웠습 이민욱 친절하다 손님 제공 고맙다 제공 캐나다 동부 행시 이민욱 동행 재미 감동 더하다 관광지 포인트 손님 개개인 사진 세심 감동 유명 관광 일시 사진 찍기 전쟁 수준 포인트 사진 이민욱 사진 일일이 주시 수고 스럽다 귀국 사진 사진 이민욱 광주시 상구 정영균 대표 세심 배려 내년 계획
미서부,서부 지난 남편 검색 염두 자하 시기 마감 지인 통해 추천 통해 작년 만족하다 통해 베트남 가족 지난 서부 남편 9일 공항 공항 깨끗하다 웅장 편안하다 느낌 공항 김학선 마중 계서 안심 만족하다 공항 김학선 날씨 춥다 가방 야하다 만족 52 인원 길다 잠도 자가 지루함 지루하다 즈음 김학선 유머 개그맨 못지않다 입담 52 주시 유니 버셜 스튜디오 체험 주시 트램 김밥 점심 주시 기도 선택 미안하다 불만 매끄럽다 관광지 포인트 사진 주시 알차다 알차다 김학선 배려 남편 김학선 안전 운전 기사 고생 새벽 저녁 편안하다 운전 주시 52 서로 배려 편안하다 여행가 건강하다 행복하다
미서부,서부 대도시 개년 운발 날씨 김학선 힐링 세상 어렵다 시댁 동서 남편 형수 동서 버킷리스트 서부 여자 끼리 곗돈 모은지 1년 미국 난국 2시간 입국심사 진작 영어 공부 할껄 어째뜬 통과 미국 만난 총각 키도 서글서글하다 얘기 멤버 공항 대기 나이 남자 광산 김씨 즈음 광산김씨 역쉬 이름 광산 김씨 김학선 성큼성큼 시작 프라 시스코 방문 부산 항구 도시 피어 39 지역 바다 김학선 동생 바다표범 자연 동물 미국정부 뗏목 개체 관광 자원 시청 금문교 날씨 재미있다 안심 미티 공원 비교 유로 시차 적응하다 날씨 덥다 가을 김학선 인디언 역사 관광지 사진 장소 사진 주기 시작 사진 점심 특선 버거 서부 유명하다 동부 쐑쐑버거 유명하다 냉동 신선하다 재료 버거 감자 튀김 요령 바스토우 아울렛 물건 매장 기대하다 의류 사이즈 대신 코치 가방 무지 착하다 가격 강추 은광 서부 마을 날씨 덥다 사막 지역 모하비 사막 풍력 발전기 사막 여호수아 나무 주변 황색 선택 관광 선택 베스트 착하다 가격 선택 관광 신청 후회 라스베가스 색다르다 경험 시티투어 종목 베랄 지오 파티 리무진 분수 스트 토스 피어 전망대 카쇼 경극 서커스 무대 규모 상당하다 기술 경험 빡빡 카지노 투숙 카지노장 신기하다 담배 냄새 미국 허용 절대로 자이언 캐년 브라 이스 캐년 관람 김학선 차량 기사 조언 바위 캐년 구경 놀이 찰나 사진기 한장 성공하다 서행 사진 방향 자이언 캐년 덥다 브라 이스 캐년 바람 날씨 가을 날씨 김학 리기 겉옷 당부 캐년 감상 음악 감동 친절하다 세심 배려 내일 캐년 감상 시골 도시 캐납 조용하다 별도 식당 컨츄리 가수 노래 동네 투덜 잔뜩 하니 새롭다 경험 캘리 포이 오렌지 쥬스 맘껏 호수 소금 특이하다 기념품 부가 바오 마을 인디언 여사 경비행기 선택 관광 경비행기 작다 영어 공부 할껄 궁금하다 비행사 수가 대신 비행 기내 비치 사진 앤텔 로프 젊다 인디언 사진 기술 남다르다 사진기 조정 색깔 예술 기대하다 그랜드 캐년 규모 그랜드 유타 네바다 사막 지역 따뜻하다 남쪽 도시 그랜드캐년 바람 영화 김학선 친절하다 저녁 특식 해물 부페 꽃게 마리 나니 로스엔젤레스 아침 걱정스럽다 유니 버셜 스튜 디어 역쉬 하늘 편임 헐리우드 도시 부산 피프광장 분위기 영화 행사 장소 쇼핑몰 레드카펫 행사 평상시 장사 달라 유니 버셜 스튜디오 재밋었다 김학선 능력 장소 착착 바람 짧다 경험 넓다 장소 여기저기 전화하다 점심식사 차갑다 핸드펀 식당 최선 흐뭇하다 대한항공 아시아나 항공 아침 일찍 전날 한인 운영 서비스 인상 조식 코너 침구 일회용 면도 구도 어째뜬 서부 인천공항 서부 날씨 힐링 캐나다 도전
미서부,버킷리스트 행복하다 서부 백승 입담 선곡 장시간 버스 지루하다 41 인원 멋있다 인생샷 영킴 운전기사 매일 장시간 장거리 운전 피곤하다 여러가지 주시 신경 선택 관광 라스베가스 시내 구경 기사 깨알 친절하다 추억 버킷리스트 그랜드캐년 평생 장관 자연 위대하다 절실 경비행기 진짜 무섭다 즐겁다 후회 번은 미티 국립공원 피톤 치드 폭풍 흡입 대도시 분위기 다르다 예쁘다 샌프란시스코 샌디에이고 선택 상담 대구 지점 박주희 대리 친절하다 상담 장거리 비행 장거리 자체 피곤하다 미국 기사 기억 안고 귀국 중요하다 버스 기사 직원 친절하다 생애 미국여행 배려 기분 중요하다 부분 몇몇 개인 이기심 불편하다 기억
미서부,김학선 서부 개인 핵심 의미 성공하다 듭니 자체 아침 일찍 시작 길다 시차 적응도 차만 차로 재미있다 해주시 적절하다 노래 영화 절대 지루하다 이어폰 노래 좋아하다 말씀 재미있다 이어폰 인원 40 신경 어색하다 사소하다 햄버거 캐쳡 혼잣말 캐쳡 피클 에어컨 연락 직접 카운터 전달 해결 사소하다 계기 그랜드캐년 화장실 휴대폰 버스 5분 지난 시점 버스 화장실 핸드폰 멘붕 핸드폰 절대 기도 넓다 야하다 막막하다 머리 10분 핸드폰 절대 40 묶여서 민폐 핸드폰 환호 박수 기쁘다 죄송하다 진짜 10일 사건 기억 지인 얘기 거리 무사하다 핸드폰 그랜드캐년 다람쥐
미서부,호연지기 서부 6일 넓다 기개 커다랗다 포부 목표 의미 일상 아들 벼르 벼뤘던 대륙 미국여행 가끔 중화권 자유여행 나로 생경 지역 나름 기대 설레다 교차 출국심사 까다롭다 출국 신발 미국 12시간 16시간 시차 극복 공항 미주 푸른 맞이 벤츠 13 인승 콜밴 유니 버셜 스튜 디어 서부 첫날 시작 어린이 어른 희망 유니버셜 미사일 중국인 머리 사고 발생 상호 외치 만족스럽다 웃음 헐리우드 스타 거리 이병헌 안성기 사인 훈훈하다 이병헌 배우 첫날 출국 미국 출입국 영어 인터뷰 대비 차례 포모나 여장 고단 육신 눕혔다 아침 미국 헷갈리다 미국 사과 미국 리지 우유 조식 시작 이틀 특별하다 제공 벤츠 서부 전문 본인 직접 소개 이용식 문성원 푸른 차장 직접 라스베가스 그랜드캐년 5시간 차장 박식하다 식견 감탄 금치 피곤하다 안전하다 라스베가스 리조트 카지노 여장 저녁 업무 관련 기분 언짢다 저녁 취소 화려하다 호연지기 함양 당초 목적 화려하다 라스베가스 관람 주인공 공중 부양시 사진 아들 핀잔 진정하다 호연지기 그랜드 캐넌 관광 시작 이름 아침 조식 성하다 아침 과식 협곡 경비행기 촬영 구식 캠코더 사진기 휴대폰 촬영 장비 그랜드 캐넌 거대하다 지평선 협곡 비경 촬영 장비 가동 영화 차장 영화 관계자 마음껏 비명 협곡 하늘 콜로라도 강가 휴양도시 저녁 야자수 사이 푸른색 강물 달빛 피로 맥주 아침 집합 문성원 차장 흐뭇하다 미소 애마 벤츠 콜밴 시동 힘차다 바스토우 시내 최고 레이스 그리피스 천문대 파머스마켓 두루 역사 지리 식물 문화 문학 공자 가라사대 해박 지식 탄복 6일 서부 유익하다 즐겁다 호연지기 함양 아들 홧이팅
미서부,김학선 로이킴 행복하다 8일 서부 긴장도 설레다 김학선 로이킴 편안하다 분위기 리드 미국 역사 지식 지루하다 재미있다 집중 재밌다 시차 적응 졸음 부분 멀미 멀미 구해 주시 편안하다 해주시 감동 아프다 컨디션 유니버셜 스튜디오 구경 식당 음식 세심 발라 선택 관광 장단점 억지로 인원 데리 내색 내시 재밌다 달리 언니 동생 순삭 당하다 하루하루 기분 슬프다 공항 배웅 감동 짧다 짧다 길다 길다 사이 김학선 언니 동생 정이 8일 8초 눈물 솔직하다 가기 싫다 다행하다 약속 사고 기분 날씨 행복하다 만날
미서부,김학선 8일 서부 가격 대비 깨끗하다 동생 즐겁다 40 인원 세심 신경 안전하다 성격 인연 날수 반갑다 중국 음식점 나쁘다 기억 고맙다 자유여행 여행지 정보 교통 운전 편리하다 정보 역사 음악 사진 고생 건강하다
미서부,서부 이완 준가 이드 안녕하다 직장 11년 30 여성 올해 휴가 고민 친하다 언니 두바이 싱가폴 하와이 검색 고민 중이 검색 앤텔 로프 캐년 인터넷 비교 이유 상담 통화 친절하다 상담 언니 서부 자유여행 상담 언니 작다 항상 응대 담당 이분 정확하다 문자 이분 이분 최고 이분 신경 선택 길다 선택 6월 13일 와우 샌프란시스코 공항 9시간 길다 13시간 공항 이완 준가 이드 훈남 비주 자상하다 버스 와우 만석 덥다 서부 오후 시작 샌프란 시스코 명물 금문교 날씨 먹구름 안개 무심하다 금문교 보이지 날씨 반입 피셔맨 조개 스프 보딘 베이커리 세상 이인 신기하다 풍경 바게트 귀엽다 실컷 빵집 구경 거리 가볍다 산책 사진 예쁘다 마그넷 구매 경후 샌프란 시스코 시청 노숙자 위험 요소 사진 미국 낙후 스트레스 예상 깨끗하다 가볍다 맥주 한잔 섬세하다 이완 방안 해주시 20분 불편 사항 피곤 와우 인원 케어 대단하다 느꼇습니 즐겁다 기대 2일 캘리포니아 수도 새크라멘토 관광 시작 드타 아윌 비백 터미네이터 지사 캘리포니아 청사 이민 아름답다 좋아하다 공원 오렌지 나무 사랑스럽다 돗자리 마음속 고이 갈수 코스 레이크 타호 아름답다 풍경 중간 비도 선상 감자 튀김 냄새 반하다 언니 맛있다 멀미 마음속 인생 즐거움 표현 사진 숙소 미국 한식 맛집 순두부 찌개 순두부 찌개 맛있다 시차 살짝 적응 컨디션 3일 좋아하다 공원 스티븐 잡스 사랑 미티 국립공원 날씨 입구 진짜 와우 이민오 거짓말 보태 번은 미국 캠핑 국립공원 차량 미국 역사 관광지 즐겁다 최고 멋있다 미티 폭포 근처 가기 비바람 바람 사진 미역 폭포 바람 시원하다 기분 자연 프레즈노 저녁 맛있다 스테이크 와인 행복하다 외국 노래 신기 방기 아주머니 완벽 적응 4일 아울렛 은광 라스베가스 젊은이 제일 얼른 라스베가스 날씨 은광 사진 영화 서부 사나이 상상 엄청나다 은발 최대 규모 도시 1896년 은값 하락 유령 마을 관광지 구두 구두 굳다 라스베이거스 오션스일레븐 영화 80년 환상 어마어마하다 벨라지오 분수 왐마 영화 선택 관광 개인 취향 잽싸다 라스베가스 분수 라스베가스 도시 외치 곳도 즐겁다 화려하다 조명 미국 남발 벨라지오 야간 분수 4분 번은 거리 분수 라스베가스 제일 카지노 안고 기계 천운 신나다 기절 숙면 미국 5일 오우 캐년 시작 자이언 캐년 불법 인곳 멋지다 노래 감상 이롭다 거구 두번째 브라 이스 캐년 가비 날씨 성질 날씨 이상하다 사이 잽싸다 자연 위대하다 내일 기대하다 마무리 최고 기대하다 앤텔로프캐년 6일 기상 새벽 난리 인디언 40분 오우 최고 영혼 축복 안고 그랜드 캐년 젠장 먹구름 사고 불안하다 막상 펜스 가슴 허리 경내 사진 그랜드 캐년 가비 장대비 결심 차로 아쉬움 맥주 야하다 7일 여자 라면 라라 랜드 영화 라라 랜드 촬영 포스터 사진 그리피스 천문대 오잉 영화감독 카메라감독 버시 능력자 할리우드 거리 스타 거리 유명하다 사인 가득하다 거리 오오오오오오오 거리 유니버셜 스튜디오 어른 사랑 유니버셜 미국 종일 행복하다 1시간 1분 곳도 데리 가능하다 행복 진짜 유니버셜 스튜디오 이완 행복하다 최고 이완 이별 아아 훈훈하다 섬세하다 이완 준가 이드 니요 일찍 계시다 새롭다 디즈니 종일 자유 디즈니 신경 이완 계시다 완벽하다 디즈니 랜드 종일 자유 정이 어른 어드밴쳐 갈껄 원조 랜드 게임 안녕 기상 악화 최고재 인디아나 존스 마운틴 뭐시기 희망 환상 디즈니랜드 어린이 가기 20 라면 어드밴쳐 추천 좀더 강하다 놀이기구 티켓 티켓 대신 선택 가요 즐겁다 신나다 이완 헨리 기사 행복하다 가게 선택 헨리 기사 위험 한적 운전 캐리어 아침 저녁 실어 주시 심심하다 이완 대단하다 계시다 빈자리
