country,cleaned_sentences
라오스,라오스 2020년 1월 20일 19시 10 이륙 제주 항공 정시 20분 일직 라오스 비엔티안 라오스 2일 아침 비엔티안 시내 불교 초기 크메르 왕궁 불상 6840 사원 관광 코키리 트레킹 짚라인 방비 방비 숙소 삼겹살 저녁 무한 필로 저녁 내일 행사 근처 시장 슬리퍼 구매 마감 라오스 3일 숙소 본격 방비 관광 시작 숙소 근처 롱테일 보트 숑강 상류 하류 간곳 한참 개발 에메랄드 불루라군 길이 비포장도로 우의 마스크 착용 가야 일부 승객 버킹카 새롭다 불루라군 수영 다이빙 시작 불루라군 다이빙 수영 동굴 튜브 출구 점심 카약 숙소 맛사지 맛사지 저녁 오리 고기 어제 구경 야시장 아이쇼핑 숙소 라오스 4일 아침 8시 20분 버스 비엔티안 도중 승선 풍류 점심 물품 구입 판매점 구입 원하다 구입 저녁 먹기 평양 냉면 식당 이북 종업원 무대 저녁 대한민국 가기 공항 출국 수속 면세점 작다 판매점 구매 저렴하다 가격 구매 제주 항공 동굴 참여 20 환불
라오스,아름답다 자연환경 다양하다 티비 라오스 라오스 역사 종교 생활 문화 다양하다 티비 스트레스 친절하다 꼼곰 즐겁다 라오스 추천
라오스,아름답다 루앙프라방 티비 가득하다 추억 방비 순박하다 자고 약속 라오스 방학 사랑 사춘기 타잔 놀이 꼬심 라오스 기대 즐겁다 리뷰 오자 약속 자연 순박하다 기쁨 치안 호객 행위 맛있다 커피 아름답다 경치 가득하다 라오스 순수하다 세밀 최광수 리뷰 주신 쇼핑 센터 질도 강매 옵션 상태 두번째 애용 결심 최고
라오스,라오스 신동원 친절하다 신동원 동한 여행자 라오스 역사 라오스 현실 짚라인 여러가지 체험 활동 안전 안전하다 체험 활동 추억
라오스,멋지다 최고 신동원 즐겁다 라오스 5일 12월 15일 5일 라오스 비엔티안 방비 멋지다 신나다 신동원 검다 피부 이국 인상 토박이 서울 셨습 전체 숙소 음식 만족스럽다 여헹 상세 일찍 밀리 편안하다 관람 방비 멋지다 풍경 원스 롱테일 보트 황토 먼지 신나다 편도 1시간 버기카 제일 연장 소의 짚라인 선두 멋지다 신나다 하늘 다리 재미있다 옆팀 물장난 즐겁다 카약 킹등 멋지다 평양 식당 아가씨 연주 노래 맛있다 음식 상태 기대 이모 멋지다 즐겁다 친절하다 멋지다 신동원 즐겁다 11 명의 가족 협조 배려 최고 신동원 동행 행복하다 성탄 연말 새해 보갆 건강하다
라오스,라오스 루앙 프랑 방비 비엔 티엔 작년 캄보디아 앙코르와트 베트남 하노이 하롱베이 연결하다 올해 라오스 가게 인도 힌두교 인도문 여러가지 기대 크게 모로 소기 목적 달성 르앙프라방 조언 이전 코스 포함 국보 불상 여러 불교 문화 왕궁 박물 관등 구경 나름 좀더 의미 그날 햇볕 굉장하다 따갑다 개인 사이판 하와이 햇볕 뜨겁다 따갑다 다행하다 방비 해양 티비 소나기 구름 시원하다 여하튼 라오스 햇볕 대비 르앙프라방 왕궁 박물관 지갑 선생님 가야 현금 불상 사가 아침 동남아 상의 말씀 금액 쇼핑 센터 토종 변상 다행 선생님 신경 마무리 된거 지갑 현금 선생님 서로 확인 확인 서로 불편하다 대비 여행지 지갑 보지 박물관 의아 코끼리 트래킹 코끼리 잔인하다 사육 동물보호 단체 라오스 다행하다 코끼리 그다지 심하다 코끼리 트래킹 짚라인 재미있다 경험 경치 음식점 음식 맛있다 라오스 배탈 긴장 즐겁다 포함 만족하다 가격 대비 자유여행 저렴하다 사정 안전하다 쇼핑 센터 부담스럽다 점도 추천 이유 야시장 기념품 득템 공항 가도 가격 비싸다 똑같다 물건 선생님 조언 도움 탓루앙 사원 인생샷 즐겁다 견문
라오스,아름답다 순박하다 라오스 친구 고오 기대 라오스 길다 추억 멋지다 기억 한아름 안고 라오스 사랑 가득하다 애정 포함 옵션 사항 적절하다 배분 여유 로우 서도 부족하다 즐겁다 라오스 3일 라오스 계획 라오스 현씨 오지 가야 라오스 친구 현씨 고맙다 항상 건강하다 승하
라오스,라오스 비엔 디안 방비 차장 친절하다 상세 경청 읍니 가족 주어 깊다
라오스,라오스 가족 5일 라오스 가족 심신 통해 라오스 계약 여행가 방만 달랑 기억 시작 150 만족 라오스 곽기봉 만족도 높다 짚라인 폭포수 블루라군 다이빙 본래 기회 열정 인생 성하다 기회 5일 달이 항상 짧다 기간 중요하다 전체 스캐줄 역량 비중 차지 중요하다 새삼 희생 봉사 곽기봉 기회 내년 6월 라오스 항상 건강하다 행복하다 기도 라오스 정혜
라오스,티비 라오스 이지은 친구 여름 휴가 급하다 선택 팔자 려니 이지은 만난 최고 항상 솔선수범 맛깔나다 해주시 라오스 나무 공기 친절하다 물가 살기 직장인 얘기 만요 공부 자유여행 도전 항상 건강하다 행복하다 이지은 차장 정일 과장 고생 항상 건강하다 행복하다
라오스,얼굴 노랗다 라오스 옵션 쇼핑 참고 라오스 쇼핑 보라카이 마닐라 세번 쇼핑 각오 역대 최강 최악 쇼핑 세번 쇼핑 쇼핑 계약위반 쇼핑 망고 농장 화장실 자연 소통 실패하다 30분 화장실 쇼핑 과일 망고 번만 쇼핑 세번 쇼핑 대학 강의 쇼핑 50분 강의 주제 노니 침향 공포 위협 강의 50분 강의 십분 사나 사납다 지겹다 서비스 지겹다 두번째 쇼핑 감옥 쇼핑 30분 짧다 쇼핑 생활 잡화 전혀 물건 거저 계속 사라 계속 도니 맴도 마다 얘기 침묵 세번 쇼핑 강매 쇼핑 30분 고급스럽다 건물 귀금속 쇼핑 건물 고급 직원 언행 저급 안통 여친 여친 하니 싫다 엄마 엄마 하니 엄마 본인 안통 거저 착용 시킴 기분 나쁘다 남자 중학생 용돈 엄마 나사 진짜 빵터지다 너무하다 번의 쇼핑 얼굴 노랗다 라오스 분도 각오 가세 노랗다
라오스,친구 라오스 명의 친구 라오스 목적지 설레다 안고 비엔티안 공항 공항 우릴 젊다 오빠 전우성 숙소 차안 세심 숙소 짧다 자고 우린 돌입 전우성 해박 지식 역사 라오스 이튿날 티비 짚라인 생애 추억 친구 즐겁다 행복하다 젊다 오빠 귀엽다 전우성 라오스 최고
라오스,라오스 계획 타입 3일 예약 입금 보지 후진국 라오스 적나라하다 첫날 불편하다 라오스 선하다 배려 순수하다 동화 긴장 라오스 편안함 역사 박학 충석 부장 해박 안전 원칙 10 명의 인원 음식 맛있다 열대과일 실컷 방비 야시장 북한 판매 북한 여성 활기 넘치다 대한민국
라오스,라오스 2월 1일 대망 라오스 시작 인천공항 연착 라오스 비엔 티엔 멀다 갈수 내일 여정 2월 2일 라오스 국가 상징 탓루앙 사원 아멜랄드 붓다 시기 왕실 사원 호파 초기 크메르왕국 불상 830 부처 불교 국가 사원 불상 하늘 맑다 화창하다 날씨 여러 사원 불상 역사 내용 배재 자세하다 머리 점심 풍류 탕원 유원지 선상 중식 선상 지식 음식 즐겁다 점심 한가지 노래 노래방 기기 배치 음주 가무 친구 듀엣 무조건 인기 지식 생선 튀김 나물 종류 나물 싸하다 점심 방비 3시간 소요 라오스 도로 사정 원래 1시간 이면 충분하다 3시간 막간 소금 마을 방문 바다 라오스 최대 염전 소금 마을 대부분 생산 소금 라오스 주민 사용 어느덧다 방비 오후 5시 피로 풀기 마사지 피로 중국 필리핀 여러 아시아 국가 마사지 달라 아프다 시원하다 피로 식당 그날 여지 잡고 소박하다 라오스 방비 야시장 저녁식사 마무리 내일 여정 갈수 자원 물자 도움 라오스 기대 기대 배재 지역 방문 유래 이해도 빨르다 라오스 내일 티비 기대 수영 복장 하라 기분 방비 지식 쌀국수 김치 과일 수박 망고 기타등등 음식 대체로 라오스 회수 생수 아리 방비 시장 재래시장 농사 지은 야채 과일 개구리 당부 징그럽다 소리 순수하다 상처 방비 티비 짚라인 구간 단계 단계 갈수록 높다 자꾸 계속 하니 재미 높다 방비 산수 감상 높이 자신감 짚라인 구간 10 구간 13 구간 짚라인 동굴 탐험 튜브 의지 동굴 가게 머리 동굴 탐험 시피 동굴 천장 석회암 종유석 구경 버깅카 운전 황토 블루라군 1시간 소요 길거리 소도 차량 한쪽 조심 운전 가야 가축 방목 경우 포장 도로 황토 먼지 일어나서 마스크 착용 태양 뜨겁다 선글라스 필수 공기 용서 버깅카 블루라군 점심식사 도식락 물놀이 시작 다양하다 입수 방법 입수 입수 거기 나름 재미 버깅카 블루라군 방비 쏭강 카약 체험 한조 저으 산수 감상 가면 안전 요원 안심 물의 깊이 허리 나름 맑다 카약 체험 황토 먼지 휴식 수영장 휴식 앞서 수영장 물놀이 휴식 코스 롱테일 보트 전동 가기 자연 산수 구경 물소 유유 목욕 라오스 주민 물고기 일상 감고 바쁘다 노곤 배려 마사지 저녁 야시장 방비 일상 만낏 2월 4일 조식 비엔 티엔 도로 사정 3시간 가야 비엔 티엔 젓갈 라오스 주민 강가 물고기 젓갈 정해진 물고기 젓갈 사진 젓갈 건어물 젓갈 달라 위생 문제 배달 날수 태국 접경 지역 태국인 간혹 건어물 산다 중간 점심 비엔 입성 수직 활주로 승리 독립 기념 빠뚜 싸이 중심 그날 날씨 무척 덥다 날씨 덥다 마사지 이동해 저녁식사 와인 사원 관광 서운하다 일상 언니 오빠 반갑다 언니 배재 수고 일일이 사진 챙리랴 고생 인사 항상 건강하다 아기 예쁘다 라오스 부탁
라오스,감동 라오스 지난달 1월 26일 30일 라오스 읍니 주부 구정 이제야 라오스 최광수 대하 최선 불편하다 잠자리 만족하다 읍니 최선 최광수 고맙다 라오스 기회 최광수 항상 건강하다 행복하다
라오스,정일 라오스 친하다 친구 라오스 가기 결정 자유여행 고민 안전성 고려 가기 여러 회사 비교 노랗다 가격 구성면 원하다 조건 부합 선택 만족도 크게 친구 다행 친절하다 정일 정일 굉장하다 자세하다 반복 라오스 당시 날씨 조율 이유 상세 세심 배려 해주시 22 연령 대도 다양하다 원하다 방향 다르다 가신 서로 배려 즐겁다 여러 노력 갈등 추가 요구 옵션 구매 물품 무조건 강요 장점 경험 바탕 추천 티비 경우 안전하다 재미있다 방법 사원 유적지 넓다 지식 재치 라오스 역사 문화 질문 자세하다 전달 노력 인상 사진 예쁘다 추억 추가 라오스 멋지다 풍경 사진 정일 친구 정일 즐겁다 행복하다
라오스,라오스 12월 멋지다 마무리 12월 15 12월 19일 허물 고등학교 친구 세번 해외 은기 베스트 즐겁다 행복하다 5일 티비 은기 추억 동영상 사진 5일 짧다 동고동락 공항 출국 일일 감동 은기 보배 열정 응원 커플 즐겁다 건강하다 행복하다
라오스,신나다 라오스 가족 협조 역쉬 부장 할부 재미 난건 맛있다 먹방 유행 좋아하다 지식 옥수수 망고스틴 망고 과일 풍족하다 라오스 가볍다 면서 아버지 보호 주신 고맙다 음식 이기 샴겹살 라오스 맛있다 여러가지 체험 힘드다 라오스 가족 여러 식구 화합 즐겁다 젊다 친구 추억 잘만 라오스 신랑 자유로 방비 비엔 티엔
라오스,라오스 진아씨 양예진 첫날 공항 예쁘다 원피스 마중 진아씨 배려 감동 맛있다 간식 망고 주스 바나나 옥수수 골뱅이 꼬치 카스테라 라오스 길거리 음식 체험 고기 기름 맛있다 소금 마을 소금 고기 마다 예진 아씨 기억 정신 사진 주시 톡방 사진 일일이 전송 주시 섬세하다 감동 이간 라오스 정이 라오스 공항 눈물 라오스 가면 진아씨 양예진 양예진 추억
라오스,라오스 소중하다 인연 메랄듯빛 블루라군 라오스 1일 인천공항 19 40 5시간 30분 22 55 비엔 티엔 국제공항 동남아 습하다 냄새 자그마하다 공항 입국심사 빠르다 로움 심사 나오니 라오스 순수하다 그을 박건수 피켓 맞이 삼분 갑작스럽다 도마뱀 출현 자그마하다 도마뱀 커다랗다 놀래다 포획 방생 해주시 도마뱀 벌레 언니 벌레 모기 본적 모기 퇴치 모기향 매트 수건 포트 드라이기 첫날 드라이 포트 한장 수건 드라이기 로비 수량 제한 로비 말씀 2일 라오스 소태 희다 편안하다 희다 볶음밥 바게트 충분하다 쌀국수 상추 흡사 월남쌈 느낌 가볍다 조식 완료 아침 탁박 행렬 패스 시내 관광 사원 왓호파 사원 탓루앙 사원 이유 여행지 역사 현재 좀더 자세하다 재미있다 라오스 좀더 해주시 박건수 듣기 빗속 관광 라오스 언어 단어 사원 동굴 이름 인사 메콩강 선상 유유 강가 풍류 신선 여유 로움 가득하다 74 60 연령 어른 분위기 좋아하다 슬듯 부모님 오시 좋아하다 가득하다 식후 소금 마을 검다 눈동자 순수하다 안녕하다 외치 인사 사탕 넉넉하다 못내 3일 라오스 궁극 카약 롱테일 보트 생략 라오스 풍경 버키 연령 높다 인원 부족 패스 어머 어마 재미 추천 아쉬움 짚라인 입성 선두 박건수 자유롭다 사진 멋지다 감탄 놀란 심장 번의 라인 소리 순간 하늘 바람 만끽 발견 동굴 동굴 코끼리 소원 차갑다 어두운곳 가면 심장 무리 간다 가볍다 물놀이 시작 선두 어머님 벌써 물속 자유 만끽 계시다 어두움 나름 스릴 시원하다 동굴탐험 볶음밥 바게트 꼬치 맛있다 카야 시작 작다 신나다 달리기 시작 연세 잘맞다 어르신 마직막 카야 신나다 물놀이 빗줄기 반갑다 신나다 환하다 즐거움 주변 블루라군 폭우 지속 연령 높다 건강 우려 숙소 확인 8분 숙소 컵라면 커피 맥주 온기 블루라군 다이빙 버킷리스트 두려움 박건수 애절하다 다이빙 요청 수락 나무 무섭다 수면 발견 수영 미안하다 수술 70 아버님 60 아버님 조끼 다이빙 숙소 가신 잡지 아쉬움 저녁식사 야외 바베큐 소원 이벤트 작다 빗방울 소원 하늘 불빛 티비 감성 감동 선사 배려 고맙다 4일 어느덧다 빠뚜 사이 메콩강 야시장 므앙 관광 시원하다 달콤하다 빙수 커피 잡화 가볍다 쇼핑 피로 맛사지 멀다 10분 악수 인사 5일 짧다 아쉬움 진심 작별인사 박건수 로컬 알릭 비행 이모 에고 공항 스케줄 마무리 인사 고온 70 대의 노부 행복 멀다 부다 행복 안고 긍정 박건수 단체 카톡 사진 예쁘다 포즈 잡고 라오스 멋지다 풍경 중간 중간 과일 망고 망고 스틱 맛있다 라오스 언어 단어 좀더 공부 5일 빠르다 동남 쇼핑 옵션 강요 행복 박건수 14 명의 어르신 기약 소중하다 인연 행복 부모님 친구 행복하다 라오스
라오스,라오스 인생 장병권 친구 부부 동반 나들이 선택 라오스 변덕 날씨 즐거움 삭감 말로 형님 누님 가족 주신 진정 추억 장식 페이지 차지 손색 차분하다 세련되다 장소 동시 마다 볼거리 거리 길거리 도움 주심 실감 주심 승승장구 추억 거리 주심
라오스,아름답다 라오스 5월 5일 어린이날 라오스 만난 가족 라오스 컨디션 안좋다 진짜 드라이기 작다 수건 몇장 가세 작다 수건 수건 드라이기 커피포트 롱낙혼 드라이기 커피포트 추가 요구 경우 1달러 비누 쪼깐 비누 쓰기 불편하다 수영복 빨때 고간 클렌징폼 비누 작다 와이파이 로비 월드 로밍 포켓 와이파이 사용 마찬가지 포켓 와이파이 보조 밧데리 불량 전혀 작동 사용 무조건 본체 충전 저녁때 밧데리 충전 낭패 밤새 충전 보조 밧데리 종일 빵빵 안심 보험 그닥 필요 금액 불안하다 보험 위험하다 포켓 와이파이 분실 방비 티비 롱테일 보트 카약 짚라인 버기카 가족 티비 버기카 진짜 강추 초등학교 학년 남편 학년 운전 위험하다 스스로 운전 경치 감상 자부심 비포장도로 달리 물웅덩이 흙탕물 쓰기 낯선 지구 복판 기분 끝내주다 카약 안전 요원 재밌다 서로 뿌리 보트 노래 싫다 수영 심하다 안심 짓궂다 직성 서로 비엔 티엔 주로 관광 덥다 날씨 아스팔트 우산 양산 공항 려고 일부러 안좋다 우산 예쁘다 우산 노란색 분홍색 하늘색 우산 사진 라오스 착하다 잘생기다 귀엽다 예쁘다 속마음 아름답다 쇼핑 서로 흥정 손짓 발짓 기도 계산 웃기 기억 새록새록 지갑 과일 신선하다 망고 매일 버스 휴게소 사탕수수 옥수수 라오스 과자 1달러 봉지 전신 마사지 마무리 기전 2시간 마사지 마사지 손가락 팔꿈치 다리 사용 요가 동작 연상 마사지 마사지 선호 라오스 라오스 마사지 문화 경험 후회 마사지 사랑 얘기 웃기 나름 재밌다 장판 마사지 깔깔 대고 이란 즐거움 올해 어린이날 어버이날 라오스 얼굴 까맣다 환하다 라오스 그땐 도로 포장
라오스,60 엄마 20 후반 라오스 해외여행 가기 버스 던데 버스 상당하다 소파 푹신하다 다리 의자 굉장하다 편하다 사진 버스 버스 휴게소 바나나칩 저렴하다 선물 왕창 품절 블루라군 짚라인 마사지 버기카 롱테일 보트 티비 짚라인 코스 코스 코스 코스 12 짚라인 무섭다 60 살인 도전 재미있다 짚라인 풍경 롱테일 보트 경치 구경 라오스 가기 숙박시설 안좋다 기대 태주 과장 아프다 항상 신경 여행지 기분 상하 관심 즐겁다 즐겁다 해외여행 진짜 친절하다 재치 엄지 엄지 라오스 살이 이나 편하다 현재 주변 지인 소문 저렴하다 가격 라오스 다양하다 티비 경험
라오스,티비 혜자 라오스 김정기 아름답다 선하다 라오스 버기카 롱테일 보트 카약 블루라군 짚라인 동굴 라오스 아름답다 풍경 체험 인생 추억 선하다 라오스 추억 아름답다 자연환경 맛있다 음식 라오스 추억 김정기 상세 세심 배려 예술 사진 촬영 아름답다 재밌다 라오스 강추
라오스,라오스 멋지다 추억 주신 김시현 장님 진심 해외여행 라오스 5일 설레다 인천공항 17 35분 5시간 20분 비행 비엔 티엔 공항 피켓 계시다 핸썸 김시현 인사 공항 5분 숙소 아침 명과 대전 유성 오신 어르신 10분 즐겁다 시작 비엔 티엔 왓호파깨우 사원 수천 근엄하다 불상 장님 역사 아무나 장님 노력 불구 금방 단점 장님 어르신 불편하다 단결 장님 물음 대답 학생 라오스 방비 티비 버기카 짚라인 블루라군 동굴 롱테일 보트 쏭강 카약 다양하다 체험 활동 멋지다 자연 풍경 힐링 5일 작다 세밀 신경 주시 관광 피해 예약 맛있다 구경 유적지 빠트리 배려 주시 팀원 사진 포토 멋지다 카톡 전송 김시현 장님 진심 고맙다 사진 감탄 짧다 출국 배웅 김시현 장님 공항 좌석 티켓 발권 수화물 주시 작별 인천 일상 출근 머릿속 온통 라오스 추억 라오스 고향 자부심 열정 멋지다 추억 기회 5일 정이 핸썸 김시현 장님 안전 즐겁다 진심 기회 계획 계시다 자연 라오스 강력 추천
라오스,부부 동반 라오스 부장 고맙다 20년 10 명의 부부 동반 귀국 정신 입술 텃다 베낭족 천국 라오스 친구 와이프 의견 일사불란 결정 선택 알차다 오전 선택 오전 라오 항공사 항공 부득이 라오항공 선택 웬걸 활주로 가면 엔진 소음 우려 달리 힘차다 하늘 비엔 티엔 분명 출입국 고서 기재 불구 세관 10 볼모 재작성 작성 제출 미팅 초과 부장 반갑다 자초지종 하니 안타깝다 고맙다 첫날 비엔 티엔 소화 2일 관광 핵심 방비 고고 롱테일 보트 강변 느낌 부장 무료 맛사지 여행자 거리 저녁식사 3일 킬로 짚라인 체험 버기카 점심식사 도시락 환상 적임 희다 맛있다 친구 와이프 다이어트 시작 승부 장님 라오스 노력 고맙다 한국인 해외 친절하다 불편하다 본인 사비 자꾸 과일 음료수 미안하다 제발 만류 전체 친근하다 친구 부부 알선 나로 부장 행운 일일이 나열하다 지면 부족하다 짧다 솜씨 승부 장님 표현 부적절 귀국 12시 45분 공항 수속 마무리 부장 사진 편집 안해
라오스,여고 동창 라오스 윤강 도록 말로 현실 가격 저렴하다 라오스 기대 오전 라오스 국적 라오항공 독특하다 덕잠파꽃 머리 승무원 라오스 맥주 맛있다 비엔 티엔 라오 방비 대박 야시장 맛사지 짚라인 수직 낙하 버기카 롱테일 보트 튜빙 카약 즐겁다 음식 맛있다 윤강 배려 인지 라오스 특징 망고 배부르다 매일 매일 만족도 좌지우지 윤강 특별하다 서나 라이스 선하다 친절하다 항상 열씸히 감동 노래 실력 폭풍 쇼핑 부탁 귀엽다 맨트 기억 고맙다 메콩강 추억 가슴 오래오래 기억 라오스
라오스,라오스 윤강 부장 언니 동생 남편 라오스 새벽 무거워 공항 쇼핑 탑승 라오스 국적 인지 승무원 신기 승무원 친절하다 기내식 먹기 기내 라오 맥주 맛있다 착륙 공항 청주공항 작다 2023년 공항 착공 하니 그땐 먼저 더위 어마 무시 먼지 먼지 후회 담날 방비 집라인 블루라군 버비카 이름 기억 안나 카약 멋지다 야시장 개인 새롭다 경험 개인 쌀밥 맛있다 보편 식이 차이 스님 중심 윤강 부장 선하다 인상 뻘뻘 최선 택한것 도아 주신 윤강 부장 라오스 큰집 사서 초대 덥다 부디 건강하다 여사 재미나
라오스,라오스 모임 부부 동반 5일 라오스 특징 옵션 불만 전반 즐겁다 지식 입맛 한식 끼니 불리 비엔 티엔 루앙프라방 방비 최단 거리 경로 한가지 개인 야시장 구경 부족하다 숙소 별로 만족하다
라오스,라오스 보라보라 강보라 두리안 번의 제일 강보라 부장 고객 세심 배려 고객 신경 고객 재미있다 듭니 라오스 개인 진정 사랑 직접 확인 10 만점 10
라오스,라오스 최고 감동 추억 김성구 김민수 최선 최고 전날 마감 30분 탑승권 발행 라오스 별빛 가득하다 하늘 캄캄하다 밤하늘 소망 형형색색 케이크 라오스 감동 만족 라오스 매년 3회 청년 장년 작다 차질 경우 만족도 민원 제기 적도 고가 대형 주로 통해 신뢰 확고하다 고객 만족 외부 고객 만족도 만족도 계속 유지 사의 발전 기원 예약 접수 김성구 내용 여행자 변경 계속 추가 요구 고객 항상 친절 성실하다 답변 신뢰 무리하다 부탁 단호 거절 서비스 정신 상세 대응 부탁드리다 사항 트림 전달 피드백 여행자 대우 편안함 세심 작다 체크 사항 고품격 단체 개인 상담 신뢰 이미지 이기 김성구 훌륭하다 자원 김민수 내용 수십 명의 라오스 김민수 직업 정신 찬사 고객 진심 동행 최고 서비스 고객 동선 고객 감동 감동 최고 최고 최선 노력 인사 약속 인사 김민수 최고 진심 확신 라오스 젊은이 70 이신 고령자 고령자 막무가내 투정 인상 세심 배려 웃음 편안하다 옵션 취소 전혀 싫다 내색 쇼핑 센터 강매 막무가내 투정 인상 세심 배려 웃음 편안하다 저녁 예정 옵션 급작 취소 속상하다 내색 유시 감동 스케줄 눈물 감동 스토리 선사 라오스 멋지다 추억 가슴 김민수 진심 동행 감동 찬사 아깝다 작다 성의 직업 사랑 추억 김민수 축복 안녕 기원 이별 내용 개인 비교 실속 라오스 비교 최고 음식 서비스 최고 관계자 인사 현장 고객 직접 대응 김성구 김민수 훌륭하다 직원 사심 직업 열정 직할 충분하다 대우 추억 간직 여행자 계속 응대 각별 관심 지면 감동 진심 서비스 김성구 요구사항 친절하다 깊다 관심 서비스 세심 체크 진심 김민수 라이스 최고 진정하다 진심 고객 감동 라오스 훌륭하다 자산
라오스,라오스 추억 동생 추천 가게 라오스 신청 정의도 알차다 즐겁다 아름답다 자연 티비 진짜 힐링 인생 짚라인 동굴 체험 카약 블루라군 다이빙 롱테일 보트 롱테일 보트 가슴 기분 사원 해주시 재미있다 말씀 기억 야시장 샌드위치 맛있다 추천 쌀국수 맛있다 저렴하다 가격 음식 라오스 불편하다 미소 친절하다 인상 라이 라이
