country,cleaned_sentences
필리핀,마닐라 현우 장님 특별하다 첫날 황제 총리 마닐라 필리핀 인식 순수하다 자연 경관 간직 폭포 여정 인상 따갑다 호수 여정 원주민 작다 손목 못내 기회 필리핀 방문
필리핀,4일 필리핀 마닐라 부부 4일 날씨 즐겁다 경험 분화구 호수 조랑말 1시간 30분 폭포 거슬러 카누 레프팅 사공 직업 가슴 뭉클하다 선택 옵션 88 스프링 마닐라 시내 마차 새롭다 경험 가깝다 필리핀
필리핀,마닐라 4일 마닐라 20190208 2019 02 11 교수 재직 좋아하다 30년 우연찮 인연 동일하다 필리핀 66 개국 역사 피리 계기 건물 현대차 필리핀 과정 필리핀 부강 헀던 과정 부강 크게 발전 내용 필리핀 여성 남성 드라마 좋아하다 과정 틈틈하다 버스 인상 필리핀 유명하다 과정 말타 과정 멋있다 상봉 화산 이중 호수 경치 말로 형용 아아 놀랍다 엉덩이 꼬리뼈 부분 쓰라리다 안장 상처 3일 지난 쓰라리다 꼬리뼈 힐수 수건 엉덩이 받침 전달 폭포 가기 보트 고생 스럽다 안쓰럽다 폭포 직접 쾌감 이루 패댕 달라 헀다 10 제사 미안하다 남원 운영 노천 놨다 리조트 설계 필리핀 색다르다 건물 출입구 권총 경비원 출입 보완 검사 실시 3일 소피텔 식당 분할 항상 소티텔 아침식사 무얼 신기하다 한식 계획 조정 재치 조정 재치 무난 공항 공항 방법 종류 수고 용선 수고 즐겁다
필리핀,필리핀 마닐라 신은수 즐겁다 데리 짧다 기간 즐겁다 중요하다 부분 역할 동반 고려 카지노 방문 대신 제안 폭포 카누 따갑다 조랑말 탈때 가족 사진 주시 세심 인상 깊다 참여 가족 가족 전용 차량 전용 호사 마닐라 신은수 즐겁다 성공하다 것로 멋지다 외모 매너 항상 손님 배려 주시
필리핀,마닐라 최악 조식 1일 아침 순두부 점심 쌈밥 저녁 삼겹살 제육 2일 아침 조식 점심 쌈밥 저녁 불고기 제육 3일 아침 조식 점심 항의 항의 지식 필리핀 10년 교민 3일 행온 한식 한식 동태 찌개 2일 폭포 옵션 온천 최악 대형 쇼핑몰 아예 잡화 사라 잡화 물품 종류 원하다 필리핀 쇼핑 헤어 과자 아예 사려 편의점 커미션 일부러 계속 쇼핑 어필 잡화 한국인 특성 옵션 쇼핑 개도 아깝다
필리핀,7월 28일 8월 1일 극성 수기 마닐라 7월 28일 8월 1일 극성 수기 마닐라 16 대가족 부모님 조카 가족 매년 1년 가족 신경 부분 편안하다 기간 불편하다 결론 여러가지 편안 불편하다 부모님 케어 고맙다 박경수 소장 필리핀인 고맙다 쇼핑 강매 옵션 강매 정보 제공 선택 필리핀인 부모님 고맙다 가족 필리핀 보조 사진 구매 필리핀 마닐라 상당하다 덥다 지역 덥다 날씨 적당하다 날씨 폭포 감상 유일하다 단점 교통경찰 섭외 빠르다 박경수 소장
필리핀,마닐라 마닐라 최고 여행지 항상 식구 항상 학교 학부모 상담 선생님 엄마 직장 괴롭다 표현 비밀 노트 넌지시 비밀 노트 비밀 노트 학기 부모님 거짓 표현 노트 부모님 맘껏 출하 시작 노트 노트 순간 소나기 선생님 막내딸 엄마 애착 형성 형성 일도 중요하다 심정 추억 제안 추억 해외여행 난뒤 단둘 이의 근심 배려 예의 기사 유쾌하다 즐겁다 작성 아담 최고 지루하다 유머 재치 겸비 재미있다 관광 시원하다 계속 망고 사비 듬뿍 사서 맛있다 고객 웃음꽃 필수 해외 종종 공항 간단하다 아담 가시 인사 티켓 자세하다 친절하다 기사 단둘 두렵다 근심 훌훌 사진 요청 안해 진심 감동 담번 식구 가게 아담 기사 바램 거품 아담 기사 격려 박수 전달 항상 건강하다
필리핀,마닐라 즐겁다 연휴 3일 03시 15분 필리핀 마닐라 베네룩스 새벽 날짜 계산 바람 급하다 필리핀 새벽 낯선 사이 장현 미국 이름 즐겁다 박학 다식 마닐라 곳곳 코코넛 파이 열대과일 시식 마닐라 방역 문제
필리핀,엄마 마닐라 차장 마이크 하트뿅뿅 매일 바쁘다 티비 하늘 일찍 퇴근 여기저기 채널 홈쇼핑 그요 마닐라 거기 국적 다주 299000원 전화기 엄마 마닐라 서막 필리핀 계엄령 위험하다 마닐라 전혀 위험하다 위험하다 계시다 절대 위험하다 아침 꼭두새벽 일어나서 인천공항 체크 수화물 붙이 문해 화장품 벌써 탑승 진짜 지모 벌써 엄마 하늘 라그 기내식 음료수 엄마 수다 벌써 마닐라 마닐라 덥다 덥다 비도 덥다 필수 에어콘 빵빵 진짜 오들오들 먼저 금강산 후경 관광 시작 공원 차장 한국인 간략하다 인증샷 마이크 사진 마닐라 대성당 관람 마차 시내 바퀴 곳곳 인증샷 찍그 재밌다 시내 관광 어요 진심 차장 역사 공부 강추 방송 쏙쏙 차장 알곘더라그 관광 마닐라 중심 잡고 복합 리조트 카지노 관광 2천 룰렛 30초 2천 하늘나라 카지노 즐겁다 즐겁다 지노 과일 시장 방문 매일 해동 망고스틴 생으로 10달러 어치 사서 숙소 꼭두새벽 일어나서 고단 첫날 숙소 기절 따갑다 화산 날로 9시 로비 따갑다 조랑말 8만원 결재 동물학대 아예 결재 막상 선택 관광 무조건 선택 관광 그요 식당 다르다 조랑말 산꼭대기 이모 8만원 포함 거랍니 식당 결재 저렴하다 막상 조랑말 조랑말 미안하다 번은 그요 선택 관광 지안 천지 따갑다 관광 마닐라 베이 나이트 산미구엘 정표 보니파시오 산미구엘 필리핀 빈부격차 한편 간정 자유시간 글로벌 브랜드 진짜 쇼핑 진심 대비 40 저렴하다 라그 확실하다 면세 안녕 폭포 날로 그날 9시 로비 폭포 필리핀 명물 부코파이 일명 코코넛 파이 따끈따끈하다 계란빵 부드럽다 맛있다 휴게소 코코넛 쥬스 쥬시 진짜 휴게소 스타벅스 음료 버스 코코넛 쥬스 진짜 차장 쏙쏙 역사 진짜 벌써 그요 점심 카누 폭포 우비 어차피 몽땅 폭포 체험 재밌다 폭포 헬멧 재밌다 폭포 체험 88 온천 선택 관광 노천온천 과자 팔고 노래 온천 천안 식당 저녁 비행 오전 7시 로비 여야 기절 7시 로비 쇼핑 센터 군데 방문 노니 비누 워낙 유명하다 노니 비누 쇼핑 센터 후다닥 방문 4일 고생 마이크 사진 출력 인화 사진 마이크 4일 고생 이정 지출 추억 사고 핸드폰 사진 출력 유치하다 공항 인사 진짜 회원 가입 100 차장 마이크 꾹꾹 참고 진짜 차장 마이크 추억 역사 공부 신분 마닐라 가면 차장 마이크 지정 지정
필리핀,마닐라 마틴 감솨 20 23일 마닐라 큰딸 스트레스 위염 고생 마틴 주시 공항 티켓 바람 당황 공항 마닐라 공항 여권 마틴 역사 해박 지식 제아 연세 어르신 재미있다 쏙쏙 솜씨 말씀 마닐라 가격 대비 가족 친구 모녀 부부 끼리 가도 숙소 가격 이쯤 마틴 구상 거기 연락 친구 가보 렵니
필리핀,마닐라 가족 가족 출국 개인 출국 접수 화물 등록 마닐라 아예 공항 접수 필리핀항공 기내식 맛있다 불리 김해 제주 인천 관광 인천 공항 한참 새벽 숙소 여유 여유 공원 15분 짧다 딸아이 아프다 즐겁다
필리핀,즐겁다 만족하다 마닐라 롯데 홈쇼핑 마닐라 가격 대비 즐겁다 부부 모처럼 여러가지 재미나 체험 힐링 안과 고객 서서 적절하다 조정 전체 인원 만족스럽다 어르신 보필 부모님 모시 마닐라 계획 안과 적극 추천
필리핀,작년 8월 남자 마닐라 안녕하다 작년 8월 마닐라 이제야 일전 쿠팡 세부 거기 여자 나이 아줌마 이분 파서 이분 마닐라 필리핀 위험하다 위험하다 작년 마닐라 착하다 적응 필리핀 지인 달라 무섭다 솔직하다 하루하루 착하다 순수하다 결론 저렴하다 추천 필리핀 마닐라 재미있다 작년 8월 남자 아줌마 연락
필리핀,필리핀 마닐라 따갑다 4일 필리핀 마닐라 따갑다 4일 필리핀 즐겁다 의미 깊다 헤라 소개 멘트 인간 깊다 맑다 솔찍 즐겁다 행복하다 고맙다 헤라 건강 행복 기원
필리핀,7회 마닐라 골프 린지 안녕하다 관계자 건강하다 대박 골프 좋아하다 모두투어 하나투어 자주 참가 해외 자주 이서진 배우 광고 홈피 접속 5회 베트남 다낭 골프대회 찬국 레슨 데니스 협찬 모두투어 하나투어 비교 다양하다 알차다 프로그램 집사람 참석 부부 인연 참석 약소 겨울 기다림 생활 태국 개최 홈피 확인 예약 차후 연락 확인 여직원 전달 과정 미스 죄송하다 개인 티켓 구입 아시아나 지인 부탁 티켓 구입 방이 거절 실망 홈피 자주 접속 확인 마닐라 예약 처리 작년 일도 절차 계약 그날 사무실 연수 날짜 마닐라 귀국 오후 출국 고민 작년 계약 계약 해지 무리수 참석 미팅 시스템 공항 오토바이 에스코트 분야 세심 부분 수고 신분 무리 김명 부장 리더쉽 대단하다 존재 확신 행사 다르다 추억 오후 피곤하다 탑승 무리 연수 마무리 마닐라 추억 거품 말로 진정하다 항상 하나투어 모두투어 고정관념 계기 항상 고객 믿음 차후 벌써 기대하다 설레임 생활 도움 주신 두서 주심
필리핀,7회 필리핀 마닐라 골프 린지 안녕하다 7회 필리핀 마닐라 골프 린지 지난 태국 아유타야 골프대회 성공 마무리 필리핀 마닐라 골프대회 마닐라 공항 숙소 알라 버스 20분 편리하다 투숙 크림슨 크림슨 간단하다 소개 마닐라 크림슨 객실 345 객실 마닐라 전체 세련되다 우아하다 분위기 인테리어 스타 일리 모던 가구 조화 부대 무료 커피숍 카페 24시간 룸서비스 야외 수영장 피트니스 비즈니스 센터 미팅 컨퍼런스 대형 컨퍼런스 드라이클리닝 세탁 서비스 마사지 객실 객실 금고 고급 침구 목욕가운 무료 세면 용품 미니바 커튼 에어컨 전용 욕실 책상 커피 헤어드라이어 2015 04 03 04 연습 운딩 본선 골프대회 이글릿 이글릿 필리핀 유명하다 최고급 골프장 이자 골프장 미국 골프장 설계 전설 피트 이의 아들 앤디 설계 일본 골프 황제 이사오 아오키 메이저 관록 스윙 머신 영국 팔도 호주 백상어 그레그 노먼 명의 이름 코스 디자인 72 288 124 코스 크림슨 차량 40분 소요 거리 연습 운딩 신사 연습 실전 2015 04 04 7회 필리핀 마닐라 골프 린지 당일 당일 화창하다 날씨 참가자 선전 기원 김명 영업 사업 부장 시작 활기차다 골프대회 시작 72 찬국 운영 명일 대표 말씀 대표자 4분 시타 카트 탑승 주시 바알 루고 구경 아름답다 참가자 나이스 사진 베스트 포즈 사진 두둥 베스트 포즈 상감 참가자 다이나믹 기대하다 골프대회 만찬 만찬 지난 김명 영업 사업 부장 시작 필리핀 전통 공연 분위기 국내 색소폰 연주가 단연 인자 서정근 교수 공연 참가자 환호성 대단하다 행운 추첨 시상식 어마어마하다 40 수상 영예 수상하다 축하 우승자 시상식 무려 무려 데니스 코리아 골프 세트 아이언 세트 진심 축하 7회 필리핀 마닐라 골프 린지 마무리 참석 말씀 저번 참여 무한 감동 업그레이드 관심 부탁드리다 그날 항상 행복하다 소식 가득하다
필리핀,설연휴 기간 친구 둘이서 마닐라 호핑 폭포 친구 해외여행 안전하다 자유여행 15년 2월 연휴 부지역 마닐라 지역 친구 마닐라 위험 지역 전혀 여자 이서 불안하다 밤늦다 솔직하다 전혀 위험 지역 호핑 주저 호핑투어 꿀잼 바다 싫다 수영복 곳도 샤워 장도 편하다 바다낚시 스노 쿨링 친구 어렵다 참고 수영 쉽다 재미있다 폭포 진짜 솔직하다 별거 폭포 폭포 길이 멋지다 어마어마하다 풍경 사진 실제 아깝다 무겁다 이름 명의 고맙다 사진 투척 죄송하다 기억 즐겁다 유증 장난 집중 수가 필리핀 앓이 보라카이 스쿠버 스노 쿨링 추천 결정 감동 솔직하다 즐겁다 알차다
필리핀,즐겁다 마닐라 추하다 안녕하다 연휴 4일 마닐라 필리핀 간다 막상 홈페이지 네이버 검색 정보 도움 구정 연휴 해외여행 올해 휴일 별로 인지 티켓 자유여행 원하다 항공권 사기 자유여행 포기 가게 한참 여행지 마닐라 가격 대도 수기 비싸다 대비 어차피 황금 연휴 수기 지역 비싸다 지역 워낙 선택 여지 기대 반의 4일 마닐라 선택 결제 마닐라 총격 사건 한인 사망 뉴스 보도 단체 안전하다 가기 결심 에어아시아 제스트 항공 저가 항공사 연착 평이 다행하다 무사하다 게이트 20분 저녁 기내식 당연하다 제공 저가 항공 티켓팅 결제 제공 기내식 스튜어디스 티켓 확인 기내식 포함 기내식 제공 방송 기내식 제공 방송 기내식 포함 포함 원하다 기내 지불 좌석 좁다 불편하다 기내식 맛없다 저가 항공 비행 4시간 연착 다행 정시 그랜드 오페라 위험 지역 별로 업그레이드 마감 선택 여지 다행하다 위생 상태 욕실 샤워 수압 아프다 건물 공사 밤늦다 아침 일찍 감상 수영장 카지노 중요하다 업그레이드 바쁘다 수준 참고 직원 친절하다 별로 조식 조식 금방 편의점 맥주 간식 거리 차이나 타운 지저분하다 위험하다 지역 개인 위험하다 기간 교통체증 별로 심하다 불편하다 다행하다 불편 옵션 따갑다 화산 조랑말 트래킹 제주도 평지 가파른 말타 상상 무섭다 기도 여행지 색다르다 경험 즐겁다 평지 주변 경관 시원하다 화산 말타 니요 추하다 폭포 카누 래프팅 경험 대단하다 경험 필요 정상 고민 폭포 사진 바지 바지 사진 참고 88 온천 여러 온천 저녁 한식 맛있다 싫다 나이트 옵션 나이트 이브닝 시내 거리 과일 시장 코스 옵션 기본 포함 과일 시장 망고 다가 맛있다 마사지 마사지 좋아하다 기본 옵션 나머지 스파 동남아 마사지 필수 1일 저녁 새벽 2시 2일 따갑다 화산 나이트 마사지 3일 폭포 88 온천 마사지 4일 시내 쇼핑 오후 날씨 날씨 햇빛 뜨겁다 기내 다행하다 날씨 덥다 겨울 동남아 좌우 다행하다 편안하다 필리핀 부족하다 활용 필리핀 경험 재미 포토 친절하다 적극 사진 본인 사진기 래프팅 따갑다 화산 사진 수가 포토 이쁘다 카메라 적극 여행지 경험 좋아하다 옵션 선택 옵션 만족하다 옵션 문제 인하다 호불호 경험 옵션 여행지 경험 중요하다 그로 인하다 충분하다 즐겁다 짧다 즐겁다 필리핀 마닐라 위험 역이기 잔뜩 거나 시내 안전하다 단체 위험 인물 위험하다 기분 밤중 개인 수준 교통 여건 안전 문제 자유여행 여행지 기억 동남아 도심지 재미있다 기회 주변 마닐라 추하다 마닐라 사진 첨부 즐겁다
필리핀,마닐라 즐겁다 폭포 따갑다 이화산 조랑말 트래킹 추억 간직 빅터 우승 과장
필리핀,마닐라 쵝오 바쁘다 어째 새벽 붙이 나니 도통 수가 고객 관리 차원 거기 앓이 농담 벌써 덕택 흡족하다 무리하다 요구 불구 가능하다 고맙다 별별 질문 귀찮다 고맙다 질문 대머리 주책 부리 귀찮다 엉덩이 사건 주인공 절말 상냥하다 운전 조이 항상 오스카 안부 전해 주기 번호 금전 전화하다 아주머니 전화하다 가능성 덕택 즐겁다 건강하다 항상 일만 항상 행복하다 오스카 슬슬 관리 화이팅
필리핀,예상 마닐라 2013년 10월 18일 친구 마닐라 작년 송년회 친구 끼리 시작 이제야 머슴 이서 머슴 이서 간다 섭섭하다 약속 30년 친구 끼리 무척 설레다 마닐라 소주 건배 취침 아침 줄알 로이 필리핀 역사 박사 시작 지루하다 재미 말로 관광 즐겻습니 따갑다 활화산 커다랗다 호수 화산 호수 조랑말 트레킹 재미 엇습 바탕 카스 낚시 스노클링 바다 뗏목 바베큐 세명 이서 벙커 보트 힐링 벙커 보트 이서 전세 관광 햇습니 뗏목 바나나 무한 제공 바베큐 힐링 정점 찍엇습니 저녁때 사브 사브 해물 고기 무한리필 종일 없엇습니 마닐라 베이 일몰 진짜 절경 엇죠 배한 고가 사공 무척 엇을 죄송 중간 폭포 사진 폭포 뗏목 소원 나왓습니 폭포 다오 면서 필리핀 제일 유명하다 파이 소개 야자 파이 입안 로이 시내 관광 성당 수도원 스페인 주택 리쟐 공원 역사 공부 로이 즐거웟습니 힐링 마닐라 엇습 즐겁다 깊다 원하다 남자 끼리 여자 끼리 가족 끼리 마닐라 선택 절대 후회 로이 기억
필리핀,마닐라 행복하다 친정엄마 모시 추석 연휴 마닐라 마닐라 태풍 인하다 걱정스럽다 3일 날씨 더없이 날씨 따갑다 조랑말 산길 정경 가득하다 폭포수 느낌 남아 친정엄마 즐겁다 행복하다 더없이 행복하다 필리핀 역사 소개 개인 일부분 카이 행복하다 즐겁다 훈남 외모 유머 최선 다해 주신 기쁨 풍족하다 만끽 보조 만복 순수하다 맑은 웃음 벌써 그립다 필리핀 기회 카이 만복 일상 여전하다 행복하다
필리핀,즐겁다 마닐라 마린 지난 8월 27일 통해 마닐라 태풍 필리핀 피해 전혀 5일 개인 개인 기사 편하다 즐겁다 마린 재미있다 선택 사항 바탕가스 동남아 바다 구경 달라 스케줄 필리핀항공 용해 기내식 깔끔하다 후식 치즈 케익 아이스크림 주구 요기 88 스프링 온천 북적 거리 조용하다 개인 전용 수영장 경치 가족 바탕가스 바닷가 바다 발사 멋지다 발사 마린 한장 주신 바베큐 푸드 바베큐 덥다 바베큐 구우랴 스노 쿨링 쓰레빠 스노 쿨링 계속 고생 쎄다 바나나보트 보트 배타 스노 쿨링 물고기 가기 요것 고기잡이 도구 낚시 느낌 후닥 건저 야하다 어렵다 둔하다 고기 얼룩 빨갛다 마린 마린 필리핀 올해 마리 사진 다가 사진 운전 필리핀 기사 요건 마린 코코넛 쉐이크 달콤하다 서도 팔면 구경 사진 파크 필리핀사람 가족 평화롭다 산책 나이트 수산시장 구경 해산물 신선 과일 가게 구경 과일 황제 두리안 냄새 무시무시하다 소문 저건 보지 대신 코코넛 주스 망고스틴 저렴하다 오브 아시아 야경 구경 맥주 마무리 공항 사진 정리 마닐라 그립다 마닐라 친절하다 마린 편하다 즐겁다 마닐라 여행가 마닐라 신분 마닐라 기억 마닐라
필리핀,마닐라 팔라완 위메프 마닐라 코론 5일 세부퍼시픽 항곡 이용헤 필리핀 항공 인원 부족하다 세부퍼시픽 항공 급하다 결정 관광 휴양 안고 더랬습 첫날 마닐라 그랜드 오페라 차안 무섭다 노숙자 낯설다 수도 서도 말씀 위험하다 부수 가로 웨스트 타운 리조트 특급 기대하다 기대 쪼금 깔끔하다 부수 앙가라 시골 덥다 리조트 매점 물건 관광 만족하다 즐겁다 필리핀 우기 덥다 마닐라 가기 두둥 마닐라 날씨 취소 전날 날씨 악화 여행자 가야 당황 마찬가지 다행하다 외국인 수습 4시 세부퍼시픽 안뜰 이구 필리핀 항공 카드 달러 페소 6800 페소 내야 세부퍼시픽 필리핀항공 연락 오후 리조트 현금 곤란하다 장담 당황 분단 1900원 통화 감수 점심 상의 그날 4시 대기 한국인 공항 다행 4시 마닐라 무사하다 마닐라 오전 11시 부수 공항 9시 5시 불안하다 짜증 마닐라 저녁 유적지 안타깝다 기상 악화 자연재해 이기 속상하다 마닐라 묵고 무사하다 필리핀 무섭다 재밌다 험난하다 재미있다 필리핀 우기 항공 지연 취소 말씀 지연 이해 지연 취소 티켓 취소 티켓 구해 마닐라 가야 다행 4시 만해 짜증 상의 사전 필리핀 사정 자세하다 주지 달러 환전 마닐라 부수 달러 카드 페소 지불 여행가 기전 전화하다 달러 금액 페소 사용 페소 환전 페소 환전 답답하다 마닐라 부수 해주시 기상 악화 인하다 발생 상치 당황 대처 황당하다 통화 연락 수습 저렇다 내용 정표 기상 악화 인하다 변경 변경 취소 유적지 차량 경비 비용 포함 취소 건가 연락 즐겁다 멀다 껄끄럽습니 양안 레이크 인상 다이빙 물고기 웨스트 타운 리조트 마닐라 그랜드 오페라 별로 주변 별로 코론 계획 라면 참고 세부퍼시픽 필리핀 항공 추천
필리핀,마닐라 4일 7월 11일 세부퍼시픽 4일 마닐라 따갑다 베테 세라 똑똑하다 친절하다 즐겁다 유쾌하다 망고 바나나 부코 피자 코코넛 과자 언니 맛있다 날씨 타이밍 음식점 음식 해물 소고기 종류 샤브샤브 맛있다 음식 폭포 길이 길이 기억 아마존 정글 세상 절경 감탄 잘생기다 현빈 사공 친절하다 착하다 제한 타이트 자유롭다 필리핀 시장 주변 구경 여건 못내 그랜드 오페라 서비스 차이나타운 주변 복잡하다 어수선하다 치안 위험 행마 입실 구경 엄두 분위기 덥다 마닐라 궁금하다 어쨌든 즐겁다
필리핀,마닐라 써니 써니 써니 해외여행 옵션 강요 스트레스 써니 배려 부담 해외 자주 써니 항상 동반 편안하다 스케쥴 충실하다 주시 축복 아들 벌써 써니 써니 주중
필리핀,마닐라 즐겁다 먼저 빌어 5일 고생 써니 말씀 예전 달리 친절하다 강요 써니 인원 짜증 항상 친절하다 기회
필리핀,필리핀 마닐라 행복하다 추억 마닐라 곰돌이 애디 즐겁다 행복하다 날수 있엇음 건강하다 서울 반경희 2013년 2월 17 2월 21일
필리핀,친절하다 고맙다 마닐라 윌리 차장 여름 가족 마닐라 공교롭 가족 단독 부담 이름 안나 윌리 차장 친절하다 해주시 가족 부담 해주시 가족 즐겁다 차장 마닐라 일가 행운
필리핀,닐라닐 마닐라 주말 가기 마닐라 비행 4시간 30분 마닐라 포인트 푸드 맛집 마사지 패디 큐어 쇼핑 마닐라 마까빠갈 푸드 마켓 주인 사진 몇개 가게 스타 온갖 싱싱하다 해산물 구입 쿠킹 메뉴판 차지 쿠킹차지 원하다 요리 푸드 마켓 열대과일 가게 망고 다가 레스토랑 예쁘다 컷팅해 조리 음식 마사지 스파 마사지 여러가지 마사지 뜨겁다 렉스 스톤 마사지 쵝오 1시간 30분 200 페소 기억 라떼 티코 서클 근처 여자 패디 큐어 요기 패디 큐어 전문점 메니큐어 50 페소 착하다 가격 주말 일본 홍콩 마닐라 주말 충분하다 매력 맛집 마사지 쇼핑 비행 패턴 동남아 지역 선택 세부 선택
필리핀,즐겁다 마닐라 보라카이 친구 마닐라 보라카이 즐겁다 날씨 화창하다 일정하다 날씨 안좋다 불구 진짜 사진 투척 공항 착하다 보라카이 선착장 사진 바다 이쁘다 진짜 이쁘다 계속 반복 호핑투어 낚시 스노 쿨링 일링 보트 바다로 바다로 햇빛 마닐라 관광 날씨 아쉬움 친구 맘속 아름답다 보라카이 드라이 머리 아프다 색다르다 경험 커플
필리핀,즐겁다 마닐라 보라카이 친구 마닐라 보라카이 해외여행 인지 설레임 두려움 마닐라 패티 보라카이 하강 즐겁다 필리핀 우기 여자 진짜 리조트 거짓말 날씨 즐겁다 기회 그땐 커플 보라카이
