country,cleaned_sentences
필리핀,보라카이 필리핀 설레다 가족 필리핀 공항 라이 헬퍼 도도 라이 추천 음식 만족스럽다 활동 수건 따뜻하다 엄마 멀미 멀미 안전하다 라이 세심 살피 느낌 도도 항상 편하다 헬퍼 기분 필리핀 라이 도도 느낌 라이 고맙다
필리핀,필라 리조트 보라카이 5일 보라카이 2016 10 21 2016 10 25 보라카이 완벽하다 희다 베컴 렉스 부부 행운 커플 어쩜 신분 번호 교환 행운 독박 5일 날씨 건기 예약 리조트 예약 풀이 리조트 변경 선택 필라 리조트 선택 스테이션 중간 화이트 비치 도보 3분 도보 10분 한적하다 좋아하다 조식 화이트 비치 수영장 깨끗하다 침실 욕실 깨끗하다 직원 친절하다 장점 리조트 중요하다 행운 연속 지식 한식 맛있다 배부르다 충분하다 베컴 망고 산미구엘 틈틈하다 티비 마사지 스킨 스쿠버 호핑투어 결재 간터 저렴하다 예약 결재 경우 할인 금액 참고 야하다 버그 푸카 비치 추가 선택 라바 스톤 마사지 추가 티비 만족스럽다 부부 라바 스톤 마사지 4일 받을껄 후회 스톤 마사지 컨디션 스톤 마사지 자고 티비 컨디션 최상 재미있다 선물 중요하다 회사 동료 선물 버짓마켓 썬크림 라면 스폰지 크런치 10 가볍다 가격 캐리어 공간 사도 굿굿 양가 부모님 선물 공항 쇼핑 센터 노니 파우더 액스트 버진 코코넛오일 바나나칩 골드몽 쏙쏙 베컴 보라카이 주의 계획 추천
필리핀,보라카이 김세윤 재밌다 지난 5일 보라카이 개인 보라카이 필라 리조트 진짜 화이트 비치 비치 조식 선택 사항 호핑투어 페러 일링 진짜 짱짱 재밌다 짧다 기간 패키리 선택 나름 주가 다행하다 친절하다 옵션 친절하다 추천 재밌다 머릿속 쏙쏙 기억 남아 진짜 추억 재밌다 보라카이 가게 스타 미안하다 진짜 고맙다 스타 스타 김세윤
필리핀,보라카이 필독 심플 안녕하다 보라카이 보라카이 심플 말씀 필독 아스팔트 메인 도로 아스팔트 차선 별로 자동차 별로 주로 오토바이 운송 수단 느낌 오시 매연 부분 말씀 이유 환경 말씀 쇼핑 몰이 유명하다 짝퉁 아울렛 기대하다 공항 노니 비누 진주 사고 노노 인천공항 면세점 참고 노니 비누 인터넷 음식 태국 달리 필리핀 별로 음식 발달 맛있다 물가 비싸다 가십 해양스포츠 해양스포츠 보라카이 아름답다 해변 아름답다 바다 스쿠버다이빙 보트 페어 일링 스포츠 기본 십만원 내면 별로 오산 거기 해양스포츠 마사지 20 25만원 부분 감안 가십
필리핀,보라카이 5일 즐겁다 안전하다 기분 첫날 기전 13시간 숙소 인천공항 공항 버스 1시간 2시간 배타 15분 힘드다 정이 공항 착하다 만난 루키 마이클 첫날 마자 비빔밥 숙소 체크 루키 쏙쏙 맛집 첫날 믿음 스럽다 해외 편하다 첫날 맞이 이건 첫날 과일 살때 사진 필리핀 망고 망고 살때 루키 눈탱 안심 첫날 물건 주어 이떄 생수 야하다 리조트 복도 사진 방안 사진 로비 사진 복도 사진 복도 사진 청결 신축 느낌 신축 깔끔하다 직원 항상 스마일 볼때 인사 친절하다 수영장 옥상 리조트 다르다 조식 아침 6시 일어나서 비몽 간지 사진 옥상 수영장 이쁘다 첫날 체크 수영장 내일 일찍 취침 일찍 조식 일링 보트 일링 보트 지인 방향 일링 기대 환상 어요 배위 멋지다 석양 가까이 자체 아름답다 멋있다 사진 바쁘다 사진 사진 이건 직접 일링 보트 지식 고기랑 잡채 카레 체적 필리핀 음식 일링 바닷물 마셧기 갈증 자유시간 숙소 산미구엘 사서 산미구엘 애플 스폰지 초코 과자 이건 드셧보셧으 도수 높다 좋아하다 산미구엘 애플 적극 추천 계속 산미구엘 내일 호핑투어 취침 조식 대신 라면 아침 종일 갈증 이나 음식 기도 호핑 사진 정신 사진 신나다 물고기 도보 맥주 요건 호핑 중식 푸드 과일 맥주 덥다 사진 컵라면 바다 바람 컵라면 진짜 꿀맛 크리스탈 코브 간정 사진 썬크림 계속 야하다 2시간 숙소 에픽 모히또 모히또 보라카이 한잔 외치 화이트 비치 모히또 한잔 가야 아침 리조트 조식 아쉬움 체크아웃 숙소 캐리어 숙소 체크 아웃 기타등등 포함 사항 직접 주시 목적지 말씀 기만 척척 요게 보라카이 포함 공항 해물 된장 찌게 치킨 생선 생선 제일 쫀득하 맛있다 에어컨 빵빵 섬나갈떄 자유시간 마사지 대부분 물놀이 인하다 미역 줄기 사진떄문 사진 바다로 스타벅스 커피 한잔 에어컨 빵빵 맛집 피자 해변 인생 샷좀 보라카이 여기저기 사이트 해외여행 인지 편하다 국내 가야 고민 달리 엄마 드릴 보라카이 만족스럽다 웟습니 암만 던데 한국인 루키 지인 포토 그래퍼 마이클 벌써 해외여행 만족 마이클 삼겹살 연락처 루키 산미구엘 한잔 사진 몇장 도움 인생 는걸 고민 고민 사진 도움 되셧으 보라카이 내년 행복하다
필리핀,보라카이 가족 해외여행 가게 10년 신혼여행 보라카이 여름방학 여름 휴가 보라카이 전날 덩달아 버스 배타 길다 수영복 리조트 수영장 물놀이 시작 저렴하다 리조트 예약 나쁘다 가족 즐겁다 행복하다 보라카이 바다 말로 표현 아름답다 스킨 스쿠버 도하 호핑투어 구경 마사지 진정 천국 가족 해외여행 즐겁다 매년 해외여행 저렴하다 가격 가족 해외 보라카이
필리핀,8월 5일 보라카이 디테 안녕하다 17 21일 보라카이 약시 멜라 리조트 불가라 라임 리조트 대신 부탁 침대 트윈룸 요청 남자 여자 요청 막상 체크 인하다 도저히 남자 이서 방이 간이 침대 셋팅 이건 방이 불편하다 어자피 감수 보라카이 특성 물놀이 공간 상층 베란다 가능하다 방안 말리 냄새 불편하다 기분 감수 문제 사전 평이 안좋다 신분 요청 시작 반영 숙소 이해 이해 몰래 화가 나기 시작 담당 참고 참고 강제 추천 관광 하라 권유 얘기 선택 관광 얘기 불쾌하다 손님 추천 관광 관광 선택 휴식 취하 휴양 목적 휴식 거기 편애 정상 담당 픽업 보조 대화 안통 둘째 관광 마찬가지 선택 관광 이유 점심 피자 실내 에어컨 배치 실외 덥다 달라 항상 관심 저급 음식점 의아 리조트 문제 진짜 최악 싸움 기분 좀더 친절하다 어딘가 아쉬움 50 보조 5달러 얘기 지불 분명 50 포함 인걸 이해 숙소 신축 깔끔하다 경우 환기 문제 수영장 이쁘다 음식 특식 제외 나머지 지식 저렴하다 식당 느낌 위생 안좋다 식당
필리핀,보라카이 5일 보라카이 우기 계속 크게 지장 건기 화이트 비치 구름 선셋 일링 보트 진짜 재밌다 선택 관광 다이빙 색다르다 경험 추억 직할 필리핀 친절하다 음식
필리핀,석양 아름답다 보라카이 바쁘다 7월 벌써 8월 이안 건강하다 계시다 나이 똑똑하다 예의 매사 긍정 심심하다 즐겁다 석양 불쇼 묵고 스타벅스 시원하다 망고 쥬스 크루즈 환상 편하다 바다 바람 화이트 샌드 개인 진우 아버님 계시다 애기 바랬는데 가족 연인 건강하다 행복하다 애기 예쁘다 건강하다 기도 행복하다 셨으 이안 아프다 항상 건강하다 예쁘다 애인 행복하다
필리핀,안녕 보라카이 보라카이 화이트 비치 순간 덥다 불편하다 에이미 즐겁다 보냇네 맛있다 예쁘다 날수
필리핀,보라카이 올해 복인 해외여행 호사 누리 래서 선택 관광 추가 상술 실망하다 검색 고프다 보라카이 보라카이 지인 모시 오자 공항 만난 첫날 따뜻하다 미소 다정하다 최선 선택 지금껏 불신 거리 한순간 신뢰 신뢰 바탕 지난번 방법 동원 사비 간식 거리 제공 선물 고심 절대 고가 선물 면세점 억지로 생활 바탕 가족 조언 최선 선물 고민 따뜻하다 어디가 만날 해외여행 고용 노랗다 이미지 메이킹 확실하다 이간 지인 무조건 노랗다 보라카이 조건 난리 난리 댓글 훌륭하다 노랗다 모델 기대하다 헤난 리젠시 뷔페 그닥 가게 렌스 아스 트리 투숙
필리핀,보라카이 5일 항상 하나투어 결과 거품 가격 가기 온라인 가격 가량 검색 결과 패기 부모님 만족하다 뿌듯하다 대가 거품 계속
필리핀,아름답다 보라카이 즐겁다 리조트 친절하다 가족 아름답다 매일 즐겁다 보라카이
필리핀,아름답다 보라카이 화이트 비치 5일 필리핀항공 헤난 가든 리조트 구성 보라카이 자유여행 선호 보라카이 과정 번거롭다 자유여행 일일이 신청 포함 구성 저렴하다 수도 차이 안나 신청 안전 보장 편하다 정표 디스커버리 일링 보트 마사지 호핑투어 포함 만족스럽다 얘기 칼리 공항 맞은편 비빔밥 가량 버스 선착장 이십분 그거 헤난 가든 리조트 체크 와우 정리 로비 저녁 몽골리안 바베큐 산미구엘 맥주 병과 맛있다 삼십분 자유시간 리조트 수영 헤난 가든 리조트 외관 멋있다 수영 낭만 마무리 새벽 6시 화이 티비 감상 산책 사진 보라카이 화이 티비 치가 감동 감동 숙소 조식 열한시 로비 스킨 스쿠버 강습 스킨 스쿠버 강습 체험 별도 비용 강습 체험 배타 바다 스킨 스쿠버 친구 무섭다 보라카이 스킨 스쿠버 동영상 지식 점심 오일 마사지 시원하다 숙소 샤워 로비 일링 보트 일링 보트 석양 보트 금방 재미 저녁 삼겹살 물놀이 삼겹살 후식 망고 저녁 자유시간 숙소 시경 고고 할로 망고 홀릭 맛있다 썸머 레이스 클럽 신나다 화이트 비치 수많다 구경 로비 아홉시 호핑 스노 쿨링 가지각색 물고기 물고기 물고기 깜짝 스킨 스쿠버 신청 스노 쿨링 점심 푸드 이건 파리 덮어놓고 비위 약하다 새우 점심 자유시간 친구 해변 원피스 화이트 비치 스테이션 인생 사진 사진 이쁘다 풍경 예술 감탄 감탄 금치 뻘뻘 숙소 저녁 리조트 피곤하다 저녁 화이트 술집 변하다 바다 바람 산미구엘 약하다 체력 인하다 일찍 리조트 수영장 아침 수영 조식 열한시 체크아웃 지식 점심 자유시간 기념품 구경 기념품 스타벅스 하바 아나스 쪼리 조비 바나나칩 자석 동전지갑 신청 태반 마사지 자유시간 마사지 샤워 오십분 마사지 마사지 샤워실 드라이기 비위생적 오래되다 마사지 신경 마사지 가격 저렴하다 비싸다 부분 저녁 공항 근처 해물탕 국물 시원하다 맛있다 저녁 쇼핑 센터 구경 비싸다 노니 비누 사고 세트 로만 판매 공항 라운지 쇼핑 센터 노니 비누 이틀 사용 쇼핑 티켓팅 전체 불만 친절하다 아쉬움 자유시간 옵션 신청 해양스포츠 옵션 신청 가격 비싸다 가격 저렴하다 안전 인건비 수도 비싸다 드네 한국인 이분 월급 당연하다 순하다 착하다 고생 문화 문제 웝급 기본 여행자 안주 어쩌려 가득 외국인 노동자 월급 문제 보라카이 아예 월급 지인 조건 동의 기본 너무하다 개인 아프다 보라카이 5일 즐겁다 재밌다
필리핀,보라카이 최고 매너 위너 이안 윌리 3998 220738518954 6월 10일 6월 14일 보라카이 유럽 기억 피하 부부 평이 안좋다 자유여행 하자 일본 중국 대만 자유여행 보라카이 덜컥 신랑 개최 보라카이 반신반의 선택 진짜 다르다 4일 이안 윌리 세분 인상 피로 정성 크게 감동 레알 마리스 화이트 비치 가깝다 선택 입구 솔직하다 화이트 비치 가깝다 슬슬 바람 보라카이 사진 아침 저녁 아름답다 보라카이 행복하다 파란 하늘 에메랄드 바다색 응어리 첫쨰날 스쿠버 다이빙 마사지 중간 중간 자유시간 원하다 선택 사항 부족하다 얘기 든든하다 위너 맘껏 사진 윌리 사진 사진 대박 탄성 이안 항상 싱글벙글 꼼꼼하다 둘쨰날 레저 스포츠 자유시간 선택 대박 진짜 이안 촬영 움짤 추억 하늘 동영상 소장 선택 보라카이 워낙 위너 이안 윌리 인맥 저러코롬 신랑 보라카이 노래 기회 진짜 어렵다 위너 노래 노래 동영상 자랑 망고 맛있다 바다 예쁘다 친절하다 보라카이 위너 이안 윌리 보라카이 최고 인식 자주 1년 해외여행 계획 복중 박복 힙니
필리핀,보라카이 4일 즐겁다 레이 친절하다 웃기 파랗다 일링 가오리 기분 편안하다 된거 보라카이 헤난 가든 리조트 만족 이구 화이트 비치 아름답다 가족 지인 레이 귀엽다 레이
필리핀,행복하다 보라카이 에디 이수혁 방문 보라카이 에디 이수혁 행복하다 보라카이 친절하다 추억 10월 보라카이 보라카이 에디 무겁다 브란도
필리핀,보라카이 5일 크라운 리젠 컨벤션 에어 자유여행 괜츈해 보라카이 자유여행 에어 5일 크라운 리젠시 컨벤션 급하다 휴가 잡고 공항 통해 한국말 해피 친구 띠끌란 카를 보라카이 안전하다 두번째 보라카이 방문 결혼 세컨드 허니문 아내 휴양지 티비 안전 리조트 직접 한국인 레나 통해 스쿠버다이빙 호핑 라바 스톤 마사지 자유여행 편안하다 자유 안전 소지품 간수 잘해야 부분 동남아 휴양지 대부분 보라카이 깔끔하다 지역 단점 보라카이 워낙 스테이션 마다 색깔 좁다 길찾기 걷기 유명하다 리라 보지 보라카이 보라카이 저렴하다 자주 보라카이 버스 동승 부부 보라카이 두번째 보라카이 매력 6년 보라카이 크게 다르다 발전 항구 도로 한국말 수많다 삐끼 원래 원주민 가난하다 두번째 보라카이 아내 이쁘다 한국인 레나 이름 해피 친구 보라카이 즐겁다 여행가이드 부탁드리다
필리핀,보라카이 5일 즐겁다 행복하다 안녕하다 보라카이 5일 부분 생소하다 보라카이 편하다 즐겁다 전하 고자 첫날 공항 반갑다 맞이 엘빈 비롯 즐겁다 먼저 신경 얼굴 굳다 마다 한국인 루시 여자친구 즐겁다 소중하다 추억 인연 한국인 친절하다 세심 부분 신경 감동 짧다 세명 편안하다 즐겁다 보라카이 이미지 순간 이미지 안고 행복하다 보라카이 개인 한국인 루시 엘빈 편안하다 행복하다
필리핀,둘이서 보라카이 행복하다 사진 크롤 압박 주의 20160204 0208 기념 나이 잡다하다 작년 아랑 가기 약속 실행 자유로 고민 워냑 수기 금액 부분 고민 숙소 호핑투어 자유여행 견적 저렴하다 발견 거기 다가 기내식 필리핀 항공 우린 헤난 가든 억세다 스룸 원하다 방이 예약 9월 오전 8시 헤난 가든 리조트 그랜드 억세다 스룸 86만 9천원 예약 원래 프리미엄 억세다 스룸 예약 방이 관계 비싸다 그랜드 풀억세스룸 전날 부랴부랴 09 220622578036 아침 8시 4시 30분 관계 뜬눈 작년 아버지 환갑 선택 선택 지난번 차로 이동해 구역 버스 인지 순간 당황 에이 씨디 노래 카운터 아시아나 19 20 맞은편 테이블 아가 좀더 일찍 착하다 간단하다 좌석 배정 세상 나름 우린 면세 필리핀 면세 0원 살짝 바퀴 탑승 아랑 뽀송뽀송하다 머리 사진 필리핀항공 8시 작다 작다 불편하다 성인 남자 불편하다 거기 다가 기내식 마늘 삼겹살 야채 고추장 상도 착시 착륙 지연 땡볓 우산 인내심 슬슬 한계 길다 거기 다가 덥다 무분별 어디가 코딱지 수속 길다 공항 녹초 먼저 100 달라 환전 유심 구매 유심 카톡 빠르다 인터넷 빠르다 인내심 테스트 속도 점심 공항 가게 덥다 김치찌개 배고프다 입맛 점심 본격 골드 영상 주의 주심 선착장 연주 보라카이 10분 13시간 구나 헤난 가든 리조트 방키 동시 깜빡 바람 리조트 음료 무료 쿠폰 헤난 가든 리조트 그랜드 억세다 스룸 185 그랜드 포스팅 링크 09 220622586753 간뒤 간정 휴식 저녁 로비 집합 한국인 리조트 보정 사진 저녁 리조트 전경 저녁 몽골리안 레이크 타운 채소 기류 소스 요리사 철판 음식 소스 데리 공연 렌스 젠더 태국 비교 남자 스탈 아아 사진 공연 음식 등장 번호 소스 제공 산미구엘 휴지 입구 야하다 이유 모름 저녁 종료 내일 12시 로비 자유시간 만끽 골드 강조 굴욕 거지 버짓마트 내일 썬크림 과자 떡진 머리 수습 해번 무료 음료 쿠폰 웨이브 오픈 공간 자유롭다 외국인 신나다 부럽다 기도 자하 달리 뻣뻣하다 굳다 떡진머리 자임 첫날 피곤하다 긴장 풀림 인하다 일찍 복귀 우린 신라면 소주 타임 보라카이 컵라면 비싸다 넉넉하다 할껄 꿈나라 잠자리 나이 일찍 이럴떄 부지런하다 20160204 0208 2일 헤난 가든 리조트 조식 5시 30분 10시 서서 서서 테이블 부족하다 이서 직원 싫다 테이블 종류 다양하다 3일 발라 계란 느끼하다 김치 김치 점심 12시 호핑 가기 가드 망고 유명하다 할로 대신 튜브 로비 등장 전날 할로 워치 금방 길다 서서 산다 테이크아웃 종업원 덥다 자리다 신의 망고 기억 안나 또르르 달달 맛있다 보라카이 블로거 실망 실망하다 버짓마트 쇼핑 컵라면 맥주 장창 12시 핑갈 스노 쿨링 기전 푸드 푸드 마리 장도 도안 나무 가격 껍데기 우린 스냅 부족 부부 발라 주심 껍데기 집게 먹기 산미구엘 가게 60 페소 일반 마트 41 페소 사진 스노 쿨링 영상 사진 파노라마 요로 굴욕 사진 샷들 등장 노력 포기 여자 수영 잡고 고개 영상 물고기 나름 노력 선택 옵션 바닷가 거기 다섯시 로비 는걸 보라카이 교통 수단 시크 리조트 인증샷 저녁 일링 보트 고대로 수영 맥주 일링 보트 관계 사진 타임 이쁘다 다리 미안하다 살짝 셀카 인생샷 배경 끝내주다 사진 무섭다 무겁다 없었긔 달라 저녁 검색 러브 바베큐 비치 러브 바베큐 방문 여지 맛있다 맥주 망고 망고 맛있쪄떠욤 원래 맛있다 맛집 소개 머릿속 지우개 발동 안나 해변 마사지 자유시간 부가 불금 클럽 구경 사우나 맥주 다가 핸드폰 뻔하다 아찔하다 20160204 0208 3일 3일 자유시간 전날 해변 마사지 햇빛 알레르기 관계 생략 자유시간 점심 12시 로비 집합 커플 가면 소심하다 진작 면서 미안하다 골드 점심 자유 검색 유명하다 아리아 하와이 피자 햇빛 덥다 햇빛 알레르기 주문 하와이 피자 입맛 피클 핫소스 느끼하다 워냑 피자 2조 토종 입맛 친구 맛있다 소화 망고 쉐이크 유명하다 광년 머리 둔갑 길거리 70 페소 본격 수영 타임 원래 계획 해변 사진 해수욕 맥주 한잔 수영 계획 시작 나름 바다 사진 녹조 현상 베드 살이 아픔 몇장 리조트 복귀 해변 베드 맥주 리조트 튜브 의지 물놀이 물놀이 석식 리조트 식당 고고 조식 입맛 간단하다 파파 향함 저녁 랍스타 포기 알리 망고 새우 고고 상점 수산시장 우린 호객 곳도 구경 당하다 슬프다 검색 벨라 식당 알리 망고 칠리 버터 갈릭 주문 마늘 추가 요리 820 페소 진심 가면 다짐 실패 알리 망고 600 페소 새우 250 페소 칠리소스 도대체 맛있다 거임 버터 갈릭 마늘 칠리소스 용도 스팀 소화 기념품 경도 에픽 이또 셀카 찍긔 에픽 외국인 전날 지대 나제 해변 간단하다 는걸 벗트 저녁 워냑 부실하다 나머지 무난 버거 주문 외국 구경 3일 라면 주먹 20160204 0208 4일 벌써 4일 빠르다 원래 계획 라면 아침 일찍 일어나서 조식 도저히 거기 다가 창밖 바람 무섭다 깔끔하다 수영 포기 아침 첫날 음료 쿠폰 맥주 테라스 맥주 사진 찍기 시작 살짝 다다 잡긔 망고 주스 요러케 망고 주스 셀카 타임 바람 광년 머리 시작 골드 어제 11시 30분 11시 로비 6시 30분 자유시간 점심 지식 쿨하다 골드 다르다 주저 다르다 점심 블로그 맛집 유명하다 발할라 스테이크 스테이크 미듐웰던 콜라 한잔 맥주 한잔 주문 직원 진심 기와 음식 시원하다 맥주 간이 쎄다 만족 스테이크 기쁨 셀카 만족하다 망고 쉐이크 스테이션 방향 스타벅스 유명하다 가격 비싸다 길거리 망고 쉐이크 70 페소 배정 가격 망고 쉐이크 선물 길가 쓰레기통 볼펜 쇠고리 바나나칩 사고 마트 구매 물건 리조트 5분 가기 운동 그거 살짝 고프다 골드 치킨 무난 치킨 맥주 치킨 특이하다 치킨 아침 바람 쎄다 방울 6시 30분 로비 모임 구경 리조트 복귀 또르르 다행 비바람 생쥐 면서 공항 식당 해물 된장찌개 쇼핑 센터 망고 사고 공항 줄줄 줄줄 서기 시르다 요요 길다 캐리어 당하다 조마조마하다 무사 통과 스피드 골드 인사 지인 브로 이름 본명 기억 안나 무겁다 캐리어 스토 쿨링 착하다 민망하다 라면 페소 수줍다 인사 우린 공항 분명 새벽 1시 50분 비행 1시 매점 라면 탑승 려고 라면 공항 직원 타라 라면 국물 맛없다 기내식 리무진 뻣음 정리 선물 적지 부족하다 선물 가면 5일 자유로 갈껄 계속 후회 자하 포함 가격 자유시간 옵션 강요 태국 보라카이 만족하다 남자친구 약속 오자 1일 09 220622582860 2일 09 220622592813 3일 09 220622597276 4일 09 220622602662
필리핀,보라카이 히든 카드 재성 2015 12 29 11 10 인천공항 14 40 필리핀 칼리 공항 아들 칼리 33 해당 여름날 공항 젊다 산뜻하다 인원 체크 버스 보라카이 2시간 휴식 필리핀 보라카이 역사 배경 안전하다 관광 상세 리조트 자유 몰이 상가 지역 시작 보너스 부자 고민 공항 환전 공항 카드 현금 거래 가능하다 보라카이 카드 달랑 상의 말랜다 추가 비용 부담 국내 입금 필요하다 경비 필요하다 친절하다 오전 자유시간 오후 수중 다이빙 아름답다 바다 산호 물고기 날수 트라우마 폐쇠 공포증 아들 이기 싫다 신청 사전 교육 연습 바다로 마이 바다 파도 얼굴 사발 정신 몇번 시도 공포 시작 도저히 신호 홀로 배위 다리 거리 가슴 거리 공포 쓰나미 리조트 휴식 취하 리조 답답하다 가슴 공포 리조트 귀찮다 싫다 귀국 병원 내일 병원 우황 청심 복용 진정 중간 병원 귀국 좁다 공간 이나고 울렁증 나기 시작 상태 연락 내용 카톡 백방 소문 결과 지인 폐쇠 공포증 탈때 복용 구입 저녁 봉지 기전 봉지 편안하다 인천공항 효능 앞서 틀림 편안하다 귀국 보라카이 히든 카드 재성 바쁘다 와중 귀찮다 신경 미안하다 히든 정겨운 기침 소리 감기 얼굴 자신감 넘치다 벌써 그립다 젊다 멀리 나마 항상 응원 친절하다 거듭 보라카이 히든 카드 재성 이팅 대표자 히든 향후 희망이
필리핀,보라카이 안녕하다 2015년 12월 크리스마스 보라카이 우여곡절 행복하다 추억 보라카이 보라카이 100 호언 장담 보라카이 필리핀 야하다 역사 보라카이 맛집 알짜 코스 열정 기회
필리핀,보라카이 앤드류 고맙다 앤드류 현이 가족 보라카이 안타깝다 태풍 즐겁다 기분 항상 18 인원 둘이서 버거 법도 대말 15 개월 아가 비치 뻔하다 옵션 로그인 귀찮다 작성 5일 고생 본사 힘나다 로그인 작성 특별하다 낮선 여행지 옵션 계획 중요하다 마인드 승승장구 해주 보너스 힘나다 마련 이득 래야 서비스 마인드 앤드류 4월 보라카이 고맙다 소중하다 추억
필리핀,엉망 보라카이 엉망 인천 공항 랜딩 서비스 직원 거리느 데스크 지도 뒤늦다 발견 자세하다 이름 확인 몇번 티켓팅 일로 인하다 프린트 물이 티켓 인지도 정리 쓰레기 공항 출입 자체 프린트 물이 티켓 절대 이메일 티켓 확인 이메일 다른사람 티켓 안통 공항 직원 실갱 는걸 쫏겨 날때 대책 쫏겨나자 공항 직원 뒷돈 될껄 공항 직원 실갱 남자 젊다 여자애 새벽 가방 개인 마냥 규칙 단체 활동 참여 옵션 혜택 여자 개인 행동 12시 체크아웃 새벽 탈때 마사지 옵션 강제 강요 하니 신청 하라 보라카이 제일 어쩌 자랑 예약 가격 싫다 옵션 금액 주기 싫다 본의 취소 그날 종일 시원하다 커피숍 커피숍 허당 제일 멜라 리조 에어컨 청결 안좋다 리조트 업그레이드 무료 리조트 업그레이드 오신 계시다 이분 홈쇼핑 구매 가격 홈쇼핑 취소 계약 홈쇼핑 혜택 멜라 위약금 야하다 어쩌 연락 위약금 업그레이드 비용 일인 10만원 귀국 불만 사항 고객 센터 상담 해결 법무 연락 결재 시스템 일주일 연락 법무 개인 서럽다 법대 정의 약자 세상 더럽다
