country,cleaned_sentences
필리핀,보라카이 샹그릴라 리조트 매력 보라카이 샹그릴라 리조트 추천 이유 최근 허니문 여행지 뜨겁다 각광 보라카이 수많다 리조트 즐비하다 2009년 오픈 샹그릴라 리조트 그간 보라카이 리조트 보라카이 조용하다 한적하다 북쪽 편안하다 휴식 원하다 커플 추천 객실 바다 설계 전용 해변 보유 점도 장점 빌라 길이 개별 수영장 자쿠지 설치 프라이 기기 본격 보라카이 샹그릴라 리조트 매력 집중 탐구 럭셔리 인테리어 최상 서비스 보라카이 샹그릴라 이유 분명하다 밸류 샹그릴라 이기 비싸다 숙박 비도 아깝다 보라카이 최고 리조트 추천 단연 이유 럭셔리 인테리어 최상 서비스 자랑 주저 샹그릴라 보라카이 리조트 스파 빌라 36 포함 객실 219 규모 2억 달러 투자 동남아 압도 우위 자랑 서비스 충분하다 만족스럽다 샹그릴라 리조트 로비 한국인 여직원 체크 부대 방법 친절하다 무척 편리하다 객실 안락하다 세련 커플 디럭스 스위트룸 부럽다 넓다 호사 휴가 충분하다 작다 객실 디럭스 면적 평균 60 일반 디럭스 객실 프레지 덴셜 스위트 면적 무려 220 수평선 하늘 즐겁다 물놀이 수도 샹그릴라 인피니티 수영장 바다로 착각 노을 지상 최고 로맨틱 레이스 잔잔하다 파도 소리 연인 핑크 바다 하늘 낭만 만끽 대규모 전용 최고 휴식 샹그릴라 리조트 보라카이 시내 싫다 이유 어마어마하다 규모 자랑 프라이 비치 연결 멋지다 전용 미니바 예약 5천 페소 크레딧 망고 쥬스 콜라 하와 이안 피자 맛깔 먹거리 다가 보라카이 환상 풍경 최고 만찬 럭셔리 리조트 불구 가격 비싸다 별다르다 부담 마음껏 보라카이 샹그릴라 전용 비치 수많다 북적 화이트 비치 왁자지껄하다 싫다 한적하다 샹그릴라 프라이 비치 샹그릴라 리조트 주변 선착장 푼타붕 비치 프라이 비치라 비치 굳이 거리 멀다 화이트 비치 아름답다 해변 느낌 달라 취향 선택 한나절 푼타붕 해양 레포츠 자연 경관 감상 적합하다 반면 아담하다 프라이 느낌 개인 조용하다 비치 잔잔하다 파도 물고기 여유 기도 하얗다 모래 노랗다 파라솔 독서 태닝 온전 휴식 스노클링 도전 샹그릴라 리조트 투숙 전용 비치 스파 수영장 구장 탁구 비디오 게임 부대 자유롭다 샹그릴라 해양 레포츠 스노클링 스쿠버다이빙 윈드서핑 카약 체험 300 페소 6000원 내면 1시간 스노클링 필요하다 물안경 오리발 구명조끼 대여 한가지 기억 크레딧 스노클링 장비 대여 리조트 크레딧 음료 포함 음식 지불 가능하다 심하다 허니문 편리하다 더하다 친절하다 픽업 서비스 특별하다 라운지 완비 인천 칼리 공항 직항 보라카이 길다 여전하다 호락호락하다 칼리 공항 보라카이 선착장 15분 이동해 커플 샹그릴라 보라카이 투숙 이유 신속하다 친절하다 선착장 픽업 서비스 공항 선착장 샹그릴라 투숙 전용 라운지 샹그릴라 투숙 전용 리조트 전용 요트 전용 라운지 보라카이 무척 에어컨 빠방하 선착장 라운지 휴식 취할 샹그릴라 리조트 투숙 호사 특권 보라카이 습하다 덥다 날씨 최고 감동 선사 재미 샹그릴라 레스토랑 샹그릴라 각국 최고급 요리 레스토랑 아시아 음식 양식 취향 재미 무척 쏠쏠하다 이중 허니 무너 근사하다 로맨틱 디너 시에나 추천 리조트 레스토랑 예약 입장 가능하다 필리핀 물가 대비 비싸다 넉넉하다 예산 시에나 레스토랑 모듬 해산물 구이 요리 크레딧 결제 가능하다 종류 해산물 요리 입도 호강 양도 시에나 간단 주문 시에나 메인 모듬 해산물 구이 요리 유의 에피 간단하다 스프 해산물 샐러드 모듬 해산물 구이 요리 간단하다 나오니 중복 허니 무너 추하다 보라카이 최고 리조트 샹그릴라 매력 품격 서비스 200 시내 다양하다 부대 티비 맞이 샹그릴라 보라카이 3일 짧다 세상 커플 적극 지상 파라다이스
필리핀,보홀 호핑투어 방법 100 여개 필리핀 바다 세부 가깝다 보홀 주변 다이빙 포인트 리카 포카리 스웨트 광고 촬영 버진 아일랜드 외국인 필리핀 지인 사랑 듬뿍 아름답다 필리핀 바다 매력 만날 보홀 호핑 보홀 호핑투어 방법 돌핀 워칭 보홀 호핑투어 아침 돌핀워칭 시작 비비 시작 새벽 5시 바다 부지런하다 여행자 벌써 파밀 라칸 주변 돌고래 푸른 바다 위로 수십 마리 야생 돌고래 장면 어스름 새벽 바다 신비하다 구름 잔뜩 어스름 하늘 상치 일기예보 바람 파도 높다 돌고래 보트 멀다 바다로 뱃머리 주변 방카 돌고래 직감 돌고래 대감 잔뜩 실망하다 감치 돌고래 포기 수영 선크림 바람 맑은 풍경 출처 다이빙 포인트 리카 스노클링 1시간 바다 돌고래 보지 리카 호핑투어 목적 리카 아일랜드 리카 여행지 보홀 결정 계기 다이빙 포인트 이유 유명하다 다이빙 포인트 공통 특징 첫째 훼손 깨끗하다 바다 산호 원래 흰색 형형색색 산호 천연색 바다 생물 스노클링 바다 거북 작다 상어 만날 오염 바닷가 풍경 레스토랑 자연 식당 소박하다 버들 드물다 접근 자체 어렵다 공항 가깝다 보통 지인 진짜 만날 보홀 세부 불과 접근 리카 스노클링 호핑 비교 어렵다 바다 리카 아리 무동 보트 로만 해상 보호 구역 절벽 가까이 가면 바다 풍경 바닷 거북이 리카 다이빙 보홀 바베큐 망고 산미구엘 10시 허기 새벽 다가 포함 그럴듯하다 양념 발라 숯불 고기 생선 오징어 주식 볶음 국수 제철 망고 만족스럽다 반갑다 시원하다 산미구엘 산미구엘 얼음 부어 천국 경치 시원하다 바다 풍경 배경 점프 찍기 보홀 호핑투어 코스 이자 하일 라이트 버진아일랜드 버진 아일랜드 이름 자연 아름답다 라라 리리 라라 포카리스웨트 광고 촬영 지로 유명하다 썰물 초승달 길이 바다 가운데 사장 푸른 바다 비현실적 아름답다 정박 바다 복판 서서히 물이 모랫길 시작 발목 물이 방법 버진아일랜드 여념 보트 제안 버진아일랜드 가면 한장 점프 아빠 아빠 높이 폴짝 진아 폴짝 아빠 아빠 진아 아빠 진아 아빠 어렵다 진아 점프 덥다 날씨 폴짝 폴짝 얼굴 하늘 확인 진아 함박 웃음 덥다 시원하다 바다 풍경 배경 사랑 사람과 힘껏 가슴 깊이 스트레스 순간 기분 모델 놀이 광고 촬영 인물 사진 주변 벌써 한쪽 해변 패션 모델 여념 필리핀 언니 파란 비키니 치마 이미지 맑다 날씨 반갑다 아빠 사진 찍기 시작 햇살 살짝 엽서 돌고래 바닷 거북이 보지 물놀이 모래 모델 즐겁다 진아 호핑 거리 가족 즐겁다 추억 시작 정오 즈음 돌핀 워칭 리카 버진 아일랜드 보홀 호핑투어 로나 비치 호객 행위 지인 예약 크기 인원 퀄리티 기준 가격 보통 기준 호핑 가격 2천 페소 6만 시작 돌핀 워칭 이보 금액 지불 스노클링 점심식사 선택 세부 자유 계획 보홀 보홀 호핑투어
필리핀,보라카이 익사 포츠 곱다 곱다 하얗다 산호 모래 발바닥 간지럽다 표현 어렵다 영롱하다 빛깔 바다 보라카이 화이트 비치 경험 첫째 코코넛 나무 그늘 천국 가깝다 보라카이 풍경 감상 둘째 하늘 바다 아름답다 환상 일몰 감상 산미구엘 흥청 보라카이 만끽 넷째 레포츠 천국 보라카이 익사 티비 이중 보라카이 익사 레포츠 보라카이 심심하다 휴양지 로만 오산 작다 신나다 레포츠 종류 어마어마하다 부부 직접 체험 종류 무려 보라카이 다양하다 포츠 절반 항상 보라카이 천국 이란 수식어 천국 가깝다 풍경 이란 의미 레포츠 천국 이란 의미 일지 보트 쾌속 질주 흥미진진 보라 이의 수상 포츠 보석 보라카이 바다 한가운데 시작 제트 스키 바나나보트 플라이 피쉬 토네이도 제트 보트 선택 상상 짜릿하다 스릴 스피드 사진 보트 정체 토네이도 제트 보트 15 인승 큼지막하다 보트 안전하다 부담 선택 보트 토네이도 이름 어딘 공포 분위기 무시 화근 순식간 눈앞 무시무시하다 속도 회전력 거기 폭발 파워 번쩍 번쩍 번쩍 공포 등골 오싹하다 90 기술 이토 제트 스키 경험 보라카이 하늘 페러 일링 보라카이 필리핀 에어 기내 체험 하리 굳다 다짐 레포츠 다르다 페러 일링 도전 두둥 카메라 미소 순간 가슴 공포 순간 깜짝 사이 하늘 높이 무안하다 안정 바다 푸르른 하늘 항해 눈부시다 보라카이 두둥실 하늘 기분 최고 독자 기회 페러 일링 도전 바다로 소풍 아일랜드 호핑 보라카이 여러 수상 포츠 가격 대비 만족도 높다 레포츠 꼽으라 아일랜드 호핑투어 필리핀 전통 방카 주변 일주 포인트 정박 재미 낚시 훤히 맑은 바다로 첨벙 스노클링 신비롭다 세상 조우 싱싱하다 해산물 열대과일 더하다 점심 제공 당연하다 만족도 높다 낚시 경험 전무하다 부부 낚시 신비 로움 자체 니모 해저탐험 스쿠버 다이빙 차례 경험 1초 용감 무쌍 바다로 신랑 20 30분 가량 신랑 의기양양하다 위로 카메라 카메라 풍경 두고두고 후회 형형색색 니모 유유 헤엄 경험 신비롭다 해저 탐험 스쿠버 다이빙 절대 일링 보트 낭만 윈드서핑 바람 무동 일링 보트 보라카이 사랑 포츠 명성 로맨틱 더없이 선상 감상 보라카이 백만 낭만 선셋 뇌리 보라카이 기억 독자 사랑 연인 지상 최고 로맨틱 매력 만점 버그 버그 악용 자동차 사륜구동 산악 오토바이 악용 자동차 버그 사륜구동 산악 오토바이 직접 운전 구석구석 한적하다 도로 빠르다 질주 체험 보라카이 대표 매력 만점 포츠 보라카이 높다 마운틴 로호 전망대 빛깔 에메랄드 바다 풍경 감상 광고 화보 촬영 지로 유명하다 푸카 비치 보라카이 절경 만끽 어느새다 훌쩍 주행 어마어마하다 먼지 마스크 카트 레이싱 카트라이더 카트 레이싱 카트라이더 보라카이 포츠 자동차 최소한 구성 요소 스포츠 코리아 분위기 간접 체험 레이스 코스 정해진 트랙 라이딩 레포츠랍니 인기 만점 어른 신랑 무척 신나다 싱그럽다 초원 골프 보라카이 유일하다 골프장 페어 웨이 블루 워터 골프 클럽 바다 전망 감상 골프 프라이 전용 비치 수영장 최고급 리조트 사랑 푸르다 울창 자연 한가운데 골프 라면 체력 효과 안구 정화 기능 향상 부가 효과 줄줄이 사탕 느낌 최근 겟어바웃 트래블 웹진 보라카이 이벤트 한창 독자 한시 지루하다 레포츠 천국 보라카이 특별하다 2012 여름 휴가 강추 동남아 대표 휴양지 필리핀
필리핀,트리플 보라카이 리젠시 비치 리조트 보라카이 리젠시 비치 리조트 비치 보라카이 화이트 비치 수많다 리조트 사랑 독차지 특급 리조트 보라카이 리젠시 비치 리조트 1998년 오픈 보라카이 리젠시 비치 리조트 지속 증축 공사 거치 현재 보라카이 규모 자랑 리조트 거듭 동시 화이트 비치 리조트 필리핀 관광 트리플 등급 리조트 화이트 샌드 비치 한가운데 잡고 보라카이 장소 파파 시장 장점 고요 고급스럽다 외관 모던 객실 인테리어 차별 편의 수많다 장점 보유 꾸준하다 부부 특별하다 여름 휴가 리조트 매력 00 만남 고요한 새벽녘 보라카이 리젠시 쾌적하다 정돈 객실 반하다 은은하다 차분하다 조명도 피곤하다 번쩍 욕실 구비 어메니티 개운하다 샤워 환하다 태양 보라카이 새롭다 만남 기약 꿈나라 꼬우 09 00 아침 창문 환하다 햇살 모닝콜 보라카이 아침 부스스 몰골 테라스 행복하다 비명 리조트 울창 정원 한눈 햇살 가득 전경 어쩜 맑다 깨끗하다 보라카이 리젠시 비치 리조트 메인 이스트 구역 부부 이스트 최근 신관 웅장 세련되다 가든 풍경 객실 감상 이보 특별하다 단내 폴폴 휴식 계시다 객실 테라스 거치 시원하다 물속 수도 테라스 조명 야간 배경 달달 열대 과일 안주 분위기 리젠시 풀억세스룸 밑줄 쫙쫙 09 30 조식 리조트 거짓말 살짝 보태 걸음 보라카이 화이트 비치 해변 전용 레스토랑 아름답다 비치 조식 리젠시 비치 리조트 매력 포인트 바닷 바람 조식 메뉴 꿀맛 따끈하다 와플 토스트 기본 싱싱하다 샐러드 과일 거기 즉석 오믈렛 다양하다 메뉴 가득 리젠시 리조트 레스토랑 리조트 투숙 투숙 인기 만점 비용 지불 가능 10 30 화이트 비치 가슴 벅차다 보라카이 눈부시다 화이트 비치 걸음 든든하다 조식 소화 남편 화이트 비치 에메랄드 바다 보석 하얗다 해변 취해 5분 살이 시뻘겋다 조심 12 30 중천 수영 하자 직사 광선 껍질 먹기 딱이다 쇼핑 점심 해결 보라카이 대표 명소 리젠시 리조트 해변 5분 우릴 파란색 간판 보라카이 최고 자랑 리조트 더니 인증 급하다 미처 화려하다 비치 달달 필리핀 음식 필요 보라카이 대표 명소 쇼핑 이면 쇼핑 마사지 마사지 음식 이면 음식 해결 매력 만점 구석구석 조만간 자세하다 소개 04 00 웰컴 링크 보라카이 리젠시 비치 리조트 독특하다 리조트 기간 원하다 원하다 종류 웰컴 드링크 선택 로비 리조트 체크 인하다 티켓 주스 주문 얼음 동동 시원하다 웰컴 드링크 시원하다 서늘하다 로비 얼음 동동 음료수 뜨겁다 동남아 더위 시원하다 05 00 수영장 물놀이 객실 300 대형 리조트 공용 하진 걱정스럽다 막상 메인 이스트 구역 수영장 투숙 리조트 수영장 휴가 이스트 자쿠 보유 미끄럼틀 유아 보유 메인 투숙 라면 구역 물놀이 이유 보라카이 리젠시 비치 리조트 허니 무너 가족 단위 사랑 모양 08 00 로맨틱 디너 보라카이 로맨틱 타임 석양 해변 저녁식사 낭만 자체 테이블 촛불 은은하다 맛있다 스테이크 달콤하다 와인 더하다 최고 만찬 사이 결혼 남편 서운하다 어느새다 사르르 믿음 사랑 100 감성 충전 완료 10 00 1분 1초 아깝다 낭만 보라카이 급하다 공수 산미구엘 하나투어 허니문 특전 열대 과일 와인 테이블 좌르륵 오붓하다 특별하다 내일 꿈나라 합리 가격 최고 완벽하다 편의 조건 충족 보라카이 최고 추천 리조트 보라카이 리젠시 비치 리조트 특별하다 독자 체험 보라카이 허니문 둘러보기 취재 지원 하나투어 연관 하나투어 보라카이 허니문 추천 이유 111591 연인 보라카이 20 112653
필리핀,보라카이 커플 스쿠버다이빙 체험 보라카이 여자 휴양지 천만 말씀 포함 남자 보라카이 좋아하다 이유 여자 보라카이 사랑 이유 다양하다 후끈하다 열기 가득하다 클럽 싱싱하다 해산물 유혹 레스토랑 바다 육지 티비 남자 설레다 깊이 바다 탐험 체험 다이빙 이란 프로그램 도전 살짝 두렵다 기도 아름답다 보라카이 죄악 가깝다 동행 여자친구 시도 친절하다 동행 물이 무섭다 수영 티비 경우 호주 케언즈 그레이 베리 리프 스쿠버다이빙 여친 태연하다 약속 가슴 쿵쾅 쿵쾅 마구 호흡 문제 불안감 순간 바다 스쿠버다이빙 연습 공간 스쿠버다이빙 경험 초보자 바다 물속 호흡 신호 반복 연습 여친 호흡 어렵다 경험 덤덤하다 연습 필리핀 전통 카를 바다로 화이트 비치 멀다 바다로 파도 방카 심장 비트 강렬하다 숙련 웨트 슈트 물안경 오리발 소통 장비 잔뜩 착용 뒤뚱뒤뚱 걸음 걸음 신비롭다 바다 깊이 수압 귀가 살짝 아프다 찰나 고통 포기 바다 빛깔 세상 황홀하다 매혹 깊다 길다 내뿜기 반복 어느새다 바다 적응하다 나니 아프다 멀쩡하다 산호초 형형색색 열대어 인사 크래커 유인 열대어 수중 카메라 동영상 사진 허니 무너 커플 수중 키스 타임 커플 방수 카메라 사용 시도 스쿠버 다이빙 능숙하다 수중 키스 타임 패스 대신 연인 끼리 다정하다 셀프카메라 빌어 바다 인증샷 멋지다 추억 보라카이 맑은 바다 풍경 수중 재미있다 촬영 참고 기념품 보라카이 선택 관광 스킨 스쿠버 체험 다이빙 100 소요 2시간 다이빙 스팟 30 훌쩍 보라카이 버들 천국 국내 좀처럼 경험 힘드다 수중 탐험 합리 가격 환상 코스 독자 도전 다이빙 경험 얕다 수심 안전하다 체험 다이빙 프로그램 남녀 노소 추천 멋지다 티비 취재 지원 하나투어 보라카이 허니문 둘러보기
필리핀,필리핀 보홀 가족 가족 필리핀 보홀 출산 개월 남편 업무 연장 축복 행복 기쁨 아기 어로 표현 사랑스럽다 존재 무겁다 휴식 필요하다 30 초여름 더위 기승 5월 가족 힐링 필리핀 세부 세부 바다 건너 보홀 다기 표현 보홀 6일 해변 그늘 빈둥 거리 기만 행복하다 서로 상처 다독 밑바닥 찌꺼기 사흘 보홀 빛깔 치유 보홀 대표 먼저 바다 코발트블루 맑은 아침 보홀 비치 클럽 프라이 비치 햇살 코발트 하늘 바다 하얗다 모래 대비 잉크 진해 푸른 황홀하다 기분 물이 오후 바다 투명하다 하늘 바다 맨발 하늘 착각 보홀 10 30분 달리 리카 에메랄드 리카 주변 바다 10 다이빙 포인트 명성 스노클링 다양하다 종류 물고기 산호 관찰 산호 모래 화이트 샌드 오후 보홀 비치 클럽 해변 맨발 맨손 곱다 곱다 모래 찰흙 쫀득 모래 감촉 새롭다 돌핀 워칭 리카 스노클링 버진 아일랜드 관광 보홀 호핑 필리핀 전통 나무 카를 에메랄드 바다 둥실 방카 행복하다 기분 썰물 반달 모양 모래사장 버진 아일랜드 조가비 장사꾼 만날 소라 껍데기 대고 파도 소리 추억 반갑다 가격 환경 반출 엄격하다 금지 열대 나무 내뿜는 신선하다 기운 리조트 푸르다 초록 자연 생기 온몸 깨끗하다 리조트 발짝 남국 풍경 아침 딸아이 머리 오후 수영 노곤 어스름 산미구엘 비치 체어 벌써 보홀 주요 교통 수단 대부분 빨간색 운전 머리 용도 구분 택시 미터 가격 흥정 승용차 좋아하다 딸아이 에어컨 오토바이 옹기종기 흠뻑 엄마 무릎 좋아하다 빨갛다 원피스 보홀 난감하다 순간 순수하다 질문 답변 분명 질문 여유 모유 수유 맥주 주스 맥주 핑계 목마 시도 산미구엘 강하다 쌉쌀하다 필슨 계열 맥주 음식 기기 자체 음미 햇살 한낮 마시기 산미구엘 라이트 부담 산미구엘 보홀 망고 바나나 마트 노천 망고 킬로그램 단위 껍질 노랗다 진하다 냄새 달달 바나나 먹기 고구마 필리핀 전통 방식 고기 돼지고기 달콤 짭짜름 양념 발라 숯불 돼지고기 꼬치 삼겹살 구이 닭다리 맛있다 화려하다 문화 왁자지껄하다 시장 풍경 쇼핑 원하다 보홀 절대 드물다 한적하다 진정하다 휴식 푸른 바다 곱다 사장 천연색 풍경 보홀 스케줄 대화 보홀 서로 믿음 값지다 선물 에디터 추천 연관 태국 방콕 대가족 레지던스 66169 한중일 크루즈 81723 여름 가족 남해 자연 힐튼 리조트 71718 하늘 요람 20 개월 다솔 이의 싱가포르 항공 체험 63590 휴가 태교여행 임신부 수칙 70104
필리핀,보라카이 럭셔리 리조트 아샤 프리미어 스위트 보라카이 럭셔리 리조트 아샤 프리미어 스위트 보라카이 에메랄드 바다 호핑투어 웅장 럭셔리 느낌 리조트 정체 궁금하다 계속 질문 부부 묵고 계시다 리조트 대답 일순간 부러 시선 부부 조심 브이 화답 아샤 프리미어 스위트 아샤 프리미어 스위트 국내 널리 보라카이 고품격 리조트 보라카이 화이트 비치 개인 풀이 프레지 덴셜 스위트 프리미어 스위트 타입 객실 20 보유 객실 수가 대신 세심 서비스 제공 투숙 로맨틱 프라이 보장 허니 무너 최고 리조트 아샤 프리미어 스위트 최고 매력 포인트 입구 시원하다 바다 전망 멋지다 전망 로비 객실 감상 감동 자체 시작 불과하다 양파 껍질 아샤 프리미어 스위트 매력 꺼풀 꺼풀 소개 01 자연 화형 리조트 객실 버기 마주 리조트 느낌 굉장하다 편안하다 자연 공기 맑다 바람 선선 나무 자연 향기 느낌 리조트 객실 기대하다 감동 활짝 02 보라카이 최대 규모 객실 방문 무려 33 넓다 객실 마주 순간 탄성 큼직하다 객실 상큼 홍색 컬러 포인트 모던 세련되다 느낌 인테리어 스타일 객실 미니바 냉장고 금고 비롯 오디오 시스템 생수 욕실 어메니티 객실 마련 낮다 햇살 가득 머금 로맨틱 욕실 보라카이 아샤 프리미어 스위트 커다랗다 외부 완벽하다 차단 구조 설계 시선 필요 프라이 공간 깔끔하다 깔끔하다 머리카락 먼지 보이지 이요 욕실 바닥 휴식 라면 피로 객실 넓다 전용 베란다 테이블 소파 한낮 열대 우림 푸른 바다 환상 풍경 저녁 붉다 아름답다 일몰 감상 특권 객실 오션 자랑 아샤 프리미어 위트 라면 순간 행복하다 03 에지 리조트 수영장 바다 어마어마하다 규모 공용 아샤 프리미어 스위트 대표 공간 손색 편하다 얕다 성인 전용 깊다 수영장 바닥 경사 수심 달리 미적 아름답다 실용 리조트 한낮 뜨겁다 열기 고스 흡수 햇살 오후 물놀이 최적 온도 유지 베드 졸졸졸 소리 지그시 감고 열대 우림 한가운데 착각 야간 수영 고요 밤하늘 로맨틱 수영 멋지다 추억 분명하다 04 리조트 프라이 전용 비치 투숙 리조트 전용 객실 멀다 잡고 투숙 조용하다 잔잔하다 리조트 프라이 비치 보라카이 화이트 비치 아름답다 마음껏 만끽 햇살 가득 금은 바다 예쁘다 시뻘겋다 얼굴 행복하다 아샤 프리미어 스위트 전용 비치 진짜 아침 뜨겁다 오후 이보 로맨틱 자연 은은하다 조명 부부 4년 그날 설레다 05 백만불 일몰 감상 리조트 객실 수영장 피트니스 센터 비지니스 센터 회장 레스토랑 이중 이름 아름답다 보라카이 바다 전망 실컷 감상 허니문 투숙 보라 추천 맥주 칵테일 가격 100 200 페소 한화 000 000원 가격 저렴하다 편입 감상 일몰 백만 환상 기대하다 06 기본 친절하다 서비스 리조트 기간 고작 이틀 매일 아침 레스토랑 발걸음 참으로 가볍다 신선하다 과일 주스 포함 다양하다 종류 음식 친절하다 직원 환하다 아침 인사 매일 기분 시작 일상 문득 문득 상쾌하다 아침 미소 07 별빛 가득하다 리조트 보라카이 이면 보라카이 아쉬움 맥주 신랑 전용 비치 잡고 사장 부부 동시 아름답다 신비롭다 밤하늘 맞닥뜨리 별빛 오붓하다 어느새다 부부 사랑 깊다 태양 환하다 아침 뜨겁다 오후 붉다 노을 매혹 저녁 어둠 사뿐하다 엽서 멋지다 풍경 자랑 보라카이 허니문 아샤 프리미어 스위트 리조트 적극 추천 이유 취재 지원 하나투어 보라카이 허니문 둘러보기
