country,cleaned_sentences
라오스,라오스 11 11 5일 박용 건기 시작 라오스 비엔 티엔 방비 11 11 5일 제주항공 작년 4월 친구 라오스 기억 1년 남편 동창 모임 최종 선택 라오스 방비 적극 추천 젊음 12 구성 마니아 가슴 호기심 지역 5시간 비행 심심하다 지루하다 다리 아프다 불만 시작 라오스 방비 체험 블루라군 카약 짚라인 롱테일 보트 동굴 라오스 역사 수도 비엔 티엔 미소 이쁘다 노래 매일 마사지 감동 맛있다 작년 방비 새롭다 작년 반갑다 망고 가게 새댁 반갑다 박용 부장 기억 라오스 만족하다 즐겁다 수고 고맙다 옵션 12 명의 환전 옵션 강요 말씀 선택 이하 날씨 20 명의 식구 비엔 티엔 공항 망고 쥬스 한잔 추억 즐겁다 친구 남편 친구 지기 가족 편하다 사이 개월 동창 모임 즐겁다 행복하다 상담 본사 방문 인원 본사 방문 항상 친절하다 직원 기분 라오스 담당 고맙다 거품
라오스,즐겁다 라오스 2017 11 11 9일 5일 라오스 추억 동남아 국가 건기 시기 지장 주지 고향 친구 부부 편안함 설레다 해외 어려움 감안 고추장 조미 반찬 라오스 불편 전혀 한국인 운영 식당 삼겹살 닭도리탕 상추 만점 불교 국가 라오스 수도 비엔 티엔 사원 군데 라오스 독립문 루앙프르방 왕궁 박물관 푸시 시내 전경 둘러보기 광시 폭포 사진 참으로 이롭다 새벽 행렬 체험 새벽 시장 그린 망고 구입 노랗다 망고 방비 짚라인 카약 래프팅 체험 재미있다 추억 새벽 보트 거슬러 라오스 한가지 부족하다 숙박 건물 냉장고 작동 별로 부대 운영 라오스 착하다 순수하다 조급하다 순리 생활 거리 차량 운행 경적 소리 생활 무사하다 라오스 즐겁다 추억 서정호 부장 바이
라오스,추석 연휴 라오스 가족 라오스 가족 명훈 부장 고맙다 거동 불편하다 언니 느리다 거름 느긋하다 주시 주심 가족 탁발 행렬 명훈 부장 편하다 추석 연휴 라오스 가족 대자 연속 힐링 짚라인 블루라군 롱테일 보트 카약 레프 도로 평화 자유 스럽다 안전 운행 기사 오래오래 기억 건강하다 행복하다
라오스,라오스 라오스 나흘 우릴 김재윤 항상 안전 맛있다 분위기 해주 노력 감명 읍니 대성 젊다 읍니 날씨 동행 삼박자 즐겁다 삼박자 읍니 라오스 불구 방울 십대 오십 대가 거리 동화 노력 김재윤 상인 읍니 나이 액티피드 카톡 사진 전송 고맙다 라오스 하늘 그림 청명 하늘 덥다 상쾌하다 추천 여행지
라오스,라오스 김광 실장 기억 좋아하다 2016년 16회 2017년 라오스 10 14 5일 해외 저가 차례 첫날 기분 차례 해외 불신 마찬가지 별로 라오스 인식 변화 계기 비엔 티엔 입국 수속 수하물 맞이 소하 피곤 인상 별로 아무렇다 이름 확인 인도 차량 탑승 16일 알래스카 크루즈 8일 저가 해외 기대 이틀 사흘 진심 중국 차례 인하다 잡친 어련하다 인식 잘못 확인 계기 선택 관광 인하다 향상 기분 김광 실장 진실되다 참여 18 전혀 부담 주지 행온 선택 관광 경비 경비 독촉 분위기 10 출하 주자 의견 노인 악수 저가 해외 프로그램 진심 기억 라오스 직업 의식 김광 실장 회사 이러하다 보유 표창장 종이 한장 위로 격려 해주시 강력하다 부탁
라오스,라오스 김경준 라오스 학교 방문 라오스 라오스 학교 방문 방비 버기카 블루라군 작다 라오스 학교 폰능 이름 정확하다 라오스 귀엽다 순진하다 똘망똥망 친구 인상 깊다 학교 방문 라오스 김경준 거리 친근하다 라오스 경험 만남
라오스,라오스 평생 평소 라오스 달전 예약 10일 고객 취소 통보 황당하다 무사하다 평생 계속 동남아 군데 최고 재미있다 스릴 감동 멋지다 아내 기억 라오스 색다르다 경험 짚라인 카약 불루라군 다이빙 5일 광호 선택 관광 쇼핑 강요 편안하다 다정다감하다 해박 지식 수많다 경험 도움 광호 편안하다 최고 라오스 적극 추천
라오스,라오스 민영 전주호 안녕하다 지난 8월 14일 19일 라오스 약골 가족 대표 출장 가족 2일 아버지 크게 주말 처리 동동 월요일 당일 민영 연결하다 탑승 변경 신청 당일 무리하다 부탁 항공사 문제 신속하다 친절하다 처리 출장 아버지 병원 정신 기억 안나 말씀 우여곡절 당일 사촌동생 여행자 변경 라오스 만난 전주호 먼저 먼저 하자 라오스 가능하다 열악하다 예상 특급 방비 박도 사장 서비스 만족 당연하다 깔끔하다 유로 거리 저녁 가족 맥주 야시장 구경 바퀴벌레 마리 모기 6일 내용 만족 버스 비엔 티엔 방비 4시간 중간 중간 관광 휴게소 곳도 가족 멀미 약하다 출장 예약 차로 내용 확인 차만 가족 가족 항상 전주호 친절하다 버스 아프다 아시 정보 유용하다 정보 사진 포즈 약골 가족 별명 진짜 버스 멀미 컨디션 체크 자유여행 해외여행 적응 가족 널널 말씀 멀미 적응 가족 항상 민폐 죄송하다 항상 장난 가족 수다 이쁘다 친절하다 전주호 친절하다 민영 전주호 가족 추억 10월 아버지 환갑 가족 계획 12월 겨울 휴가 가족 여행사진 동영상 공유 비몽 번호 교환 가족 계시 통해 연락 부탁드리다
라오스,4일 행복하다 라오스 엄마 여행지 라오스 선택 가기 엄마 연세 자유여행 필요 대화 라오스 시골 숙소 숙소 사진 티비 활동 중간 중간 계속 사진 추가 선택 관광 버기카 롱테일 보트 짚라인 마사지 추천 후회 큰일 뻔하다 희다
라오스,라오스 6월 19일 23일 5일 라오스 바쁘다 이제야 급하다 휴가 바람 가게 무척 걱정스럽다 다행 명의 단촐 인원 친절하다 편안하다 유명 희다 성의 감동 아쉬움 덥다 시원하다 과일 갈증 해소 허비스커스 손수 장거리 구수하다 옥수수 지루함 읍니 순간 순간 포착 사진 즐겁다 가성 길이 길이 추억 계획 최고 유명 희다 남자 건강하다
라오스,베스트 10년 친구 라오스 유람 박영 실장 대학교 학년 만남 만난 친구 시끌벅적하다 모임 이름 친구 벌써 10년 졸업 자주 취지 4만원 근교 로만 해외여행 자유여행 급하다 결정 직장 생활 바쁘다 선택 장소 군데 라오스 라오스 두번째 보라카이 계엄령 쫄보 라오스 변경 대반 설레다 살짝 계획 안고 라오스 무색 기내식 시작 저가 항공 불구 기내식 컵라면 비밀 진에어 엽서 서비스 무료 엽서 조카 묶인 언니 얼른 엽서 엽서 그림 개선문 모티브 건물 유명하다 책갈피 첫날 기대하다 컨디션 푹신하다 침대 넓다 화장실 라오스 따뜻하다 비엔 티엔 원투 시작 태국 핫팬츠 무료 감동 날씨 친구 끼리 사진 100 장정 날씨 나쁘다 굉장하다 소리 라오스 운치 끝내주다 가뭄 라오스 예쁘다 빠뚜 사이 프랑스 개선문 모티브 프랑스 식민지 지배 관련 얘기 기억 죄송하다 7년 사시 와이프 라오스 상세 도움 이름 기억 안나 홈페이지 문의 박영 장님 진짜 최고 이건 개선문 라오스 라오스 지인 한국인 이미지 사진 기분 라오스 헤프닝 지인 친구 계속 사진 친구 라오스 미녀 부럽다 점심 선상 음악 지식 꿀맛 입맛 고생 닭봉 바나나 새우 튀김 계란말이 지식 샐러드 찰밥 찰밥 귀엽다 닭봉 저녁 롱테일 보트 이건 옵션 20 롱테일 보트 고민 참고 옵션 선택 만족스럽다 재밌다 옵션 고민 즐겁다 저녁 삼겹살 삼겹살 맛있다 라오스 한가롭다 자유롭다 방생 고기 야들야들 꼬들꼬들 맛있다 돼지고기 돼지 자유롭다 진짜 치면 최고급 삼겹살 맛있다 무한리필 상추 상추 진짜 연하다 본격 방비 물놀이 아침 저녁 알차다 아침 유명하다 이모 샌드위치 든든하다 맛있다 샌드위치 성공 가격 망고 주스 환율 8000 불구 1달러 이모 짱짱 샌드위치 샌드위치 단돈 3달러 이틀 망고 주스 시럽 달라 시럽 대신 파인애플 단맛 감동 방비 시작 버기카 청춘 웅덩이 돌진 운전 순간 라이더 기분 재미있다 교통체증 안전하다 운전 버기카 고민 옵션 가격 저렴하다 짚라인 12 코스 스텝 살신성인 안전하다 장비 한눈 안전 짚라인 하늘 진짜 시원하다 스트레스 봉사활동 셀카 영상 다가 브레이크 바람 스텝 압수 사진 즐겁다 추억 코스 동영상 스텝 재미있다 믿음 선임 짚라인 버기카 블루라군 청춘 장면 뭉클하다 재미있다 물놀이 스텝 망고 손수 충분하다 망고 망고 달리 쫄깃쫄깃 탱탱하다 망고 갈비 파인애플 설탕 진짜 엄빠 라오스 사랑 순간 카약 카약 진짜 최고 재밌다 기대 스텝 시늉 중요하다 이거슨 카약 싸움 재밌다 싸움 상태 하늘 아름답다 넝실넝실 카약 친구 스텝 스텝 노래 곤돌라 부럽다 튜빙 바베큐 진짜 세상 꿀맛 라오스 라오스 은근 어른 나이 충분하다 닭고기 양파 토마토 오이 고추가 꽃힌 꼬치 크로스 물놀이 코스 유이 폭포 폭포 별거 워낙 최고 높다 깨끗하다 폭포 어깨 마사지 반나절 물놀이 진짜 시원하다 황홀하다 기억 만날 폭포 제일 폭포 무지개 폭포 1년 우기 만날 하니 럭키 길다 여행자 직접 백숙 해주시 신나다 오리 불고기 리필 진짜 세상 꿀맛 남아 저녁 자유시간 저녁 쇼핑 로컬 식당 맥주 한잔 기념 팔찌 사서 단돈 예쁘다 방수 물놀이 방수 가격 엄마 장만 리터 10 리터 싫다 잔뜩 행복하다 이건 매일 저녁 한잔 라오비 라오스 유명하다 바나나 과자 레쉬 베리 선물 딱이다 선물 고민 라면 다오 커피 추천 친구 맛있다 만족스럽다 초록색 전통 공연 샤브샤브 야시장 샤브샤브 고기 리필 재밌다 평소 동남아 과일 진짜 매일 과일 편하다 맛있다 옥수수 진짜 부드럽다 옥수수 몽족 재래시장 야시장 구경 진짜 제일 좋아하다 시장 구경 만날 행운 고맙다 진짜 벌써 5일 마무리 든든하다 기내식 새벽 즈음 야무지다 느낌 안녕 라오스 짱짱맨 최고 아내 라오스 가수 앨범 승하 엽서
라오스,부장 즐겁다 라오스 12 막내 라오스 즐겁다 20 명의 인원 서로 즐겁다 5일 항상 서부 장님 거품 거품 서부 장님 환상 궁합 비엔 티엔 방비 여정 항상 즐겁다 서부 장님 계서 최고 기회 항상 건강하다 행복하다
라오스,싫다 라오스 야근 시험 일상 이서 5일 서울 기대 예약 선택 결제 여권사진 공항 스트레스 현실 도피 라오스 피켓 이름 계시다 편하다 시원하다 훌륭하다 버스 대기 이형기 이사 첫인상 무섭다 나름 파워 첫째 공항 숙소 숙소 동남아 지역 둘째 비엔 티엔 근처 사찰 승리 소금 마을 방문 방비 문화 달라 내용 구체 상세 머릿속 기억 방비 티비 시작 추천 선택 관광 집라인 버기카 롱테일 보트 마사지 훌륭하다 집라인 버기카 강추 시원하다 소리 스트레스 청정 자연 티비 전혀 아깝다 블루라군 무섭다 높이 점프 도전 해외여행 이면 지식 티비 피곤하다 한식 메뉴 특별 주문 주신 김치 피로 넷째 비엔 티엔 3시간 버스 전날 티비 꿀잠 숙소 부분 부분 비교 즐겁다 6월 라오스 우기 오지 짬짬이 덥다 버기카 먼지 즐겁다 우기 저렴 이름 버스 기사 이형기 즐겁다 기억 라오스
라오스,베스트 정성 라오스 청춘 라오스 대표 블루라군 사진 먼저 안녕하다 취직 우울하다 시기 라오스 급하다 중간 중간 저장 저장 방법 반의 엄마 눈치 살피 중이 일분 일초 아깝다 도전 재밌다 오른쪽 이쁘다 스티커 캐리어 붙이 들뜨다 상태 오후 라오스 왼쪽 라오스 공항 오른쪽 라오스 먼저 다르다 모기 공항 만난 흐엉찰런 중간 중간 라오스 전반 개발도상국 70년 얘기 거리 어둡다 무섭다 모기 살짝 실망 스럽다 흐엉찰런 검색 바퀴벌레 깨끗하다 나름 만족하다 하룻밤 모기 친구 작다 바퀴벌레 몸집 사진 흐엉찰런 조식 식이 입맛 별로 친구 만족하다 오른쪽 아침 일어나서 흐엉찰런 보이시 먼저 간략하다 탓루앙 사원 빠뚜 사이 사원 사원 소금 마을 탕원 유원지 선상 중식 방비 롱테일 보트 두번째 작성 빠르다 작성중 좋아하다 는걸 탓루앙 사원 20 사진 찍기 열중 기억 나진 멋지다 나무 이쁘다 사진 덥다 이쁘다 사진 친구 사진 천장 독립 기념 빠뚜 사이 개인 이쁘다 왼쪽 개선문 멋지다 풍경 오른쪽 개선문 사진 기억 안나 덥다 체력 수도 풍경 이쁘다 개선문 분수 인생 사진 라오스 가격 기억 안나 인화 나름 이쁘다 사원 사원 사진 사원 짧다 바지 치마 이쁘다 치마 오른쪽 사진 사원 사진 사원 뒷모습 신발 신고 표지판 보지 지적 창피하다 빠르다 신발 소금 마을 이쁘다 사진 친구 한국인 하나둘셋 김치 사진 착하다 친구 마르다 사탕 자꾸만 숨기 달라 아프다 특별하다 달라 가엾다 기도 환하다 이쁘다 기도 탕원 유원지 선상 중식 맛있다 탕원 유원지 선상 중식 멋지다 풍경 판자 맛있다 사진 노래 빵빵 시원하다 얘기 나름 치킨 계란 요리 샐러드 국도 입맛 치킨 친구 맛있다 라오비 맥주 맛있다 시장 티셔츠 라오비 유명하다 맥주 방비 슝슝 라오스 길거리 풍경 라오스 평화스럽다 라오스 길거리 무섭다 라오스 순하다 무섭다 주의 무질서 오토바이 항상 라오스 풍경 낙후 건물 일본 빵빵 조화롭다 방비 말씀 라오스 방비 려고 이틀 방비 왼쪽 양치질 오른쪽 복도 아름답다 풍경 모기 마리 도마뱀 친구 귀엽다 도마뱀 도마뱀 만족하다 방비 롱테일 보트 슝슝 롱테일 보트 계획 텝스 결과 절망 스럽다 스트레스 30달러 아깝다 보트 오른쪽 물소 도마뱀 귀엽다 친구 물소 귀엽다 좋아하다 물소 보트 무섭다 친구 귀엽다 좋아하다 풍경 말로 표현 이쁘다 시원하다 스트레스 고민 추천 삼겹살 무한 뷔폐 얇다 삼겹살 배고프다 만족하다 된장국 입맛 김재윤 라오스 망고 숙소 이쁘다 엄마 망고 팔고 키로 3000원 기억 안나 맛있다 종류 옐로우 망고 그린 망고 질감 애플 망고 입맛 옐로우 망고 제일 방비 대표 사쿠라 클럽 재밌다 안전하다 어르신 계시다 사쿠라 클럽 나이 어르신 젋은이 재밌다 라오스 전쟁 아들 여장 아들 렌스 젠더 라오스 존중 진짜 이쁘다 렌스 젠더 목소리 걸걸하다 편견 블루라군 짚라인 체험 동굴 카약 체험 블루라군 오른쪽 사진 물놀이 복장 복도 사진 왼쪽 항상 방비 트럭 즐거움 중간 한글파일 복사 사진 복사 사진 불안하다 한글파일 복사 진짜 무섭다 까맣다 짚라인 왼쪽 연습 사진 오른쪽 실제 짚라인 나이 어르신 티비 무섭다 계속 안전 요원 나무 계시다 왠만하다 무섭다 풍경 추하다 안전 치가 안심 왼쪽 사진 블루라군 그네 무려 이서 가운데 재밌다 강제 꿀잼 위험하다 조심 오른쪽 친구 그네 주변 그네 매너 외국 블루라군 동굴 튜빙 블루라군 물놀이 짚라인 어르신 지루하다 계시다 한소리 빠르다 동굴 블루라군 아쉬움 사진 진짜 닥터피쉬 각질 제거 오른쪽 튜브 동굴 이동해 야하다 팔이 아프다 선택 사항 라면 굳이 포함 경험 물놀이 방비 가용 버스 숙소 배고프다 저녁밥 친구 볶음밥 볶음밥 맛있다 바닐라 커피 사이즈 사이즈 라오스 인심 저녁밥 사진 맛있다 김치 식당 진짜 그림 도마뱀 가게 한국인 운영 진짜 입맛 입맛 맛있다 시장 구경 유명하다 간식 거리 오른쪽 사진 바나나 티셔츠 비어 보이시 가나 젊음 끼리 오순도순 피자 재미 테이블 클럽 만난 남녀 시끄럽다 끼리 재미 수다 두번째 두번째 어르신 젊다 세번 쇼핑 휴게소 아침 일찍 일어나서 친구 쌀국수 볶음밥 꿀맛 아침 음식 간판 나영석 피디 3일 해장 홍보 가게 보장 맛있다 중간 중간 라텍스 매장 망고 농장 상황버섯 취준생 과일 맛있다 이뻣던 샤브샤브 가게 다양하다 음식 입맛 맛있다 훌쩍 메콩강 야시장 이쁘다 사지 방비 시장 사지 이쁘다 원피스 다양하다 비교 방비 아주머니 불친절하다 기분 상한 살걸 후회 라오스 청춘 일주일 라오스 완전하다 사진 동영상 라오스 위험하다 라오스 지인 친절하다 풍경 친구 가족 여행지 강추 새벽 세시 취준생 재밌다
라오스,라오스 티비 원하다 색다르다 체험 좋아하다 여행자 추천 코스 따님 가족 특성 상점 과일 수준 책정 비싸다
라오스,라오스 김경준 라오스 안녕하다 바쁘다 핑계 엄마 계획 자유여행 편하다 고심 라오스 선택 특성 부담 대반 환하다 웃음 친철 라오스 시작 여자 연령 다양하다 여자 다가 할머니 고등학생 다양하다 연령 웃음 안전 즐겁다 노력 김경준 전직 사진작가 순간 순간 사진 사진 노하우 인생 사진 라오스 김경준 신의 한수 엄마 서도 계모임 라오스 계획 얘기 라오스 톱니바퀴 당시 사모님 아기 몸조리 중이 시라 라오스 아기 라오스 계시다 이름 세련되다 노처녀 기억 결혼 라오스 추억 사진 즐겁다 힘드다
라오스,체험 라오스 라오스 2016년 10월 15일 10월 20일 6일 편하다 50 60년 자연 추천 참고 선택 옵션 라오스 선택 관광 조정 선택 관광 지루하다 난생처음 선택 관광 힐링 라오스 정감
라오스,순수 도시 라오스 사회주의 국가 인식 두렵다 라오스 인민 민주주의 원주민 순수하다 인상 남고 방비 추억 아름답다 이홍규 정보 안고 즐겁다 편안하다 나이 언니 배려 통로 배려 편안하다 루앙 푸르다
라오스,라오스 만난 아름답다 청춘 무척 덥다 여름 불편하다 기억 일상 무료함 즐겁다 유익하다 고프다 홈페이지 라오스 라오항공 여름 자락 추억 작다 바램 해외 두렵다 불편하다 숙소 입맛 식도 일생 수도 여행지 만남 두려움 대반 공항 공항 입구 록끼 소개 동갑 내기 한순간 두려움 기대 순간 빡빡 소화 록끼 열정 유익하다 재미 사원 지인 소통 방법 야하다 음식 경고 경험 숙소 불편하다 3일 청춘 상기 노래 블루라군 유이 폭포 자연 버기카 운전 자연 수중 동굴 튜브 밧줄 의지 자연 쏭강 물살 카약 빠뚜 사이 기념 포켓몬 성지 인증샷 지인 재래시장 야시장 군것질 유쾌하다 신선하다 체험 인원 100 느리다 종횡무진 비엔 티엔 방비 누비 평생 간직 추억 라따 라오스 만남 기억 명의 낙오 즐겁다 라오스 세월 가면 뜨겁다 덥다 여름날 피해 짧다 즐겁다 행복하다 가득 미소 젊음 여행지 기억 행복하다 추억 뒤로 어느새다 선선 가을 바람 인천공항
라오스,라오스 기대 대박 호기심 라오스 선택 결론 기대 대박 결론 방비 방비 블루라군 물놀이 놀이 카약 동굴 튜브 탐험 방비 블루라군 다이빙 놀이 블루라군 맑은 물속 고기 먹이 순식간 막상 물속 물고기 간지럽다 이상하다 물고기 보이지 주위 미터 높이 응원 목소리 재미 표정 환희 기억 두번째 타잔 나무 나무 재미 간략하다 아무렇다 사고 재미나 타잔 나무 나무 재미나 신기하다 두번째 고급 코스 재미 더하다 블루라군 버기카 운전면허 재미나 왕복 운전 흐뭇하다 쏭강 카약 재미 카약 대신 튜브 느긋하다 프랑스 부럽다 수영 흉내 사고 날수 튜브 단념하다 방비 음식 카페 마사지 방비 병풍 두루 절벽 산세 최고 절경 시골 동네 고급 사탕 특이하다 버기카 예의 미안하다 루앙프라방 비엔 티엔 루앙프라방 꽝시 폭포 탁발 스님 행렬 비엔 티엔 소금 마을 선상 태국 접경 고수부지 야시장 감동 방비 감동 잔잔하다 여정 여정 안전하다 재미나 이홍규 실장 첫인상 실장 결론 항상 최선 다해 감동 이상하다 수고 대표 인사 이홍규 실장 라오스 이홍규 실장 연결 재미 안전 마리 토끼 라오스
